Date,ok,CurrentDateTimeUtc,LastChangeDateTimeUtc,Year,Convention,TotalCount,Age,Gender,Status,ShirtSize,Country,Sponsor,SpecialInterest
01/29/2024,True,2024-01-29T23:56:25.795+00:00,2024-01-29T23:56:25.795+00:00,2024,EF28,221,"{'20': 1, '21': 3, '22': 7, '23': 6, '24': 6, '25': 6, '26': 3, '27': 5, '28': 6, '29': 4, '30': 10, '31': 9, '32': 7, '33': 9, '34': 11, '35': 8, '36': 12, '37': 12, '38': 8, '39': 11, '40': 11, '41': 7, '42': 4, '43': 4, '44': 3, '45': 5, '46': 6, '47': 7, '48': 1, '49': 6, '50': 4, '51': 5, '52': 3, '53': 3, '54': 1, '55': 1, '57': 1, '59': 3, '62': 2}",{},{'new': 221},"{'S': 5, 'M': 30, 'L': 43, 'XL': 30, 'XXL': 21}","{'AT': 7, 'BE': 2, 'CH': 7, 'CZ': 1, 'DE': 173, 'DK': 4, 'FI': 3, 'FR': 3, 'GB': 2, 'HU': 1, 'IE': 2, 'IT': 5, 'NL': 9, 'NO': 1, 'SI': 1}","{'normal': 150, 'sponsor': 36, 'supersponsor': 35}","{'animator': 38, 'artist': 68, 'fursuiter': 91, 'musician': 49}"
01/30/2024,True,2024-01-30T23:47:31.188+00:00,2024-01-30T23:47:31.188+00:00,2024,EF28,246,"{'19': 1, '20': 2, '21': 3, '22': 7, '23': 8, '24': 6, '25': 6, '26': 3, '27': 5, '28': 6, '29': 4, '30': 11, '31': 9, '32': 10, '33': 10, '34': 12, '35': 8, '36': 13, '37': 15, '38': 11, '39': 14, '40': 11, '41': 7, '42': 4, '43': 4, '44': 5, '45': 5, '46': 6, '47': 8, '48': 2, '49': 6, '50': 4, '51': 5, '52': 3, '53': 3, '54': 1, '55': 1, '57': 1, '59': 3, '62': 2, '64': 1}",{},"{'new': 3, 'approved': 207, 'paid': 36}","{'S': 5, 'M': 36, 'L': 46, 'XL': 33, 'XXL': 21}","{'AT': 9, 'BE': 2, 'CH': 10, 'CZ': 1, 'DE': 191, 'DK': 4, 'FI': 3, 'FR': 3, 'GB': 2, 'HU': 1, 'IE': 2, 'IT': 5, 'NL': 11, 'NO': 1, 'SI': 1}","{'normal': 168, 'sponsor': 41, 'supersponsor': 37}","{'animator': 43, 'artist': 75, 'fursuiter': 100, 'musician': 50}"
01/31/2024,True,2024-01-31T23:46:08.703+00:00,2024-01-31T23:46:08.703+00:00,2024,EF28,282,"{'19': 1, '20': 3, '21': 3, '22': 7, '23': 8, '24': 7, '25': 9, '26': 3, '27': 7, '28': 8, '29': 6, '30': 12, '31': 13, '32': 10, '33': 12, '34': 12, '35': 10, '36': 14, '37': 16, '38': 12, '39': 16, '40': 13, '41': 8, '42': 4, '43': 4, '44': 6, '45': 6, '46': 7, '47': 8, '48': 2, '49': 9, '50': 4, '51': 5, '52': 4, '53': 3, '54': 1, '55': 1, '57': 1, '58': 1, '59': 3, '62': 2, '64': 1}",{},"{'new': 9, 'approved': 193, 'paid': 80}","{'S': 6, 'M': 40, 'L': 52, 'XL': 39, 'XXL': 27}","{'AT': 10, 'BE': 2, 'CH': 15, 'CZ': 1, 'DE': 214, 'DK': 4, 'FI': 3, 'FR': 4, 'GB': 3, 'HU': 1, 'IE': 2, 'IT': 5, 'NL': 15, 'NO': 1, 'SI': 2}","{'normal': 192, 'sponsor': 49, 'supersponsor': 41}","{'animator': 48, 'artist': 84, 'fursuiter': 115, 'musician': 58}"
02/01/2024,True,2024-02-01T23:47:08.588+00:00,2024-02-01T23:47:08.588+00:00,2024,EF28,1636,"{'18': 6, '19': 25, '20': 45, '21': 44, '22': 75, '23': 100, '24': 97, '25': 102, '26': 82, '27': 102, '28': 65, '29': 77, '30': 82, '31': 73, '32': 65, '33': 71, '34': 59, '35': 56, '36': 55, '37': 57, '38': 42, '39': 32, '40': 34, '41': 32, '42': 14, '43': 11, '44': 16, '45': 13, '46': 12, '47': 15, '48': 7, '49': 15, '50': 8, '51': 7, '52': 5, '53': 5, '54': 1, '55': 6, '56': 2, '57': 3, '58': 1, '59': 5, '60': 3, '62': 3, '63': 1, '64': 1, '68': 1, '69': 1, '70': 1, '71': 1}",{},"{'new': 11, 'approved': 1332, 'paid': 293}","{'XS': 2, 'S': 53, 'M': 286, 'L': 316, 'XL': 218, 'XXL': 132}","{'AT': 73, 'AU': 5, 'BE': 18, 'BR': 2, 'CA': 3, 'CH': 53, 'CL': 1, 'CO': 1, 'CZ': 19, 'DE': 1044, 'DK': 22, 'EE': 1, 'ES': 24, 'FI': 17, 'FR': 32, 'GB': 62, 'GE': 1, 'HU': 24, 'IE': 9, 'IL': 2, 'IT': 16, 'LU': 2, 'LV': 1, 'MT': 1, 'MX': 1, 'NL': 110, 'NO': 12, 'PL': 28, 'PT': 4, 'QA': 1, 'RO': 5, 'RU': 2, 'SE': 10, 'SI': 6, 'SK': 7, 'TH': 1, 'TR': 1, 'UA': 1, 'US': 12, 'ZA': 2}","{'normal': 1015, 'sponsor': 368, 'supersponsor': 253}","{'animator': 466, 'artist': 706, 'fursuiter': 831, 'musician': 507}"
02/02/2024,True,2024-02-02T23:47:01.697+00:00,2024-02-02T23:47:01.697+00:00,2024,EF28,1900,"{'18': 7, '19': 33, '20': 52, '21': 53, '22': 89, '23': 114, '24': 110, '25': 111, '26': 97, '27': 115, '28': 86, '29': 92, '30': 97, '31': 93, '32': 86, '33': 75, '34': 67, '35': 66, '36': 62, '37': 63, '38': 47, '39': 37, '40': 37, '41': 39, '42': 17, '43': 12, '44': 16, '45': 15, '46': 15, '47': 17, '48': 7, '49': 15, '50': 9, '51': 7, '52': 5, '53': 5, '54': 1, '55': 6, '56': 2, '57': 3, '58': 1, '59': 5, '60': 4, '62': 3, '63': 1, '64': 1, '68': 1, '69': 1, '70': 1, '71': 1, '119': 1}",{},"{'new': 1, 'approved': 1193, 'partially paid': 1, 'paid': 705}","{'XS': 2, 'S': 62, 'M': 330, 'L': 361, 'XL': 251, 'XXL': 146}","{'AL': 1, 'AT': 88, 'AU': 6, 'BE': 21, 'BG': 2, 'BR': 2, 'BS': 1, 'CA': 6, 'CH': 61, 'CL': 1, 'CO': 1, 'CY': 1, 'CZ': 23, 'DE': 1182, 'DK': 28, 'EE': 3, 'ES': 29, 'FI': 21, 'FR': 36, 'GB': 78, 'GE': 1, 'HU': 25, 'IE': 9, 'IL': 2, 'IM': 1, 'IS': 1, 'IT': 21, 'LT': 1, 'LU': 2, 'LV': 2, 'MT': 1, 'MX': 2, 'NL': 131, 'NO': 13, 'PL': 35, 'PT': 4, 'QA': 1, 'RO': 7, 'RU': 2, 'SE': 10, 'SI': 8, 'SK': 7, 'TH': 1, 'TR': 1, 'UA': 2, 'US': 17, 'ZA': 2}","{'normal': 1197, 'sponsor': 431, 'supersponsor': 272}","{'animator': 556, 'artist': 834, 'fursuiter': 956, 'musician': 588}"
02/03/2024,True,2024-02-03T23:47:33.624+00:00,2024-02-03T23:47:33.624+00:00,2024,EF28,1995,"{'18': 8, '19': 34, '20': 56, '21': 55, '22': 92, '23': 118, '24': 117, '25': 116, '26': 103, '27': 121, '28': 91, '29': 98, '30': 101, '31': 97, '32': 92, '33': 80, '34': 72, '35': 71, '36': 67, '37': 63, '38': 48, '39': 39, '40': 39, '41': 41, '42': 18, '43': 12, '44': 16, '45': 15, '46': 15, '47': 17, '48': 8, '49': 15, '50': 9, '51': 7, '52': 5, '53': 5, '54': 2, '55': 6, '56': 2, '57': 4, '58': 1, '59': 5, '60': 4, '62': 3, '63': 1, '64': 1, '68': 1, '69': 1, '70': 1, '71': 1, '119': 1}",{},"{'approved': 1216, 'partially paid': 2, 'paid': 777}","{'XS': 2, 'S': 66, 'M': 341, 'L': 373, 'XL': 264, 'XXL': 150}","{'AL': 1, 'AT': 92, 'AU': 6, 'BE': 24, 'BG': 2, 'BR': 2, 'BS': 1, 'CA': 6, 'CH': 64, 'CL': 1, 'CO': 1, 'CY': 1, 'CZ': 25, 'DE': 1232, 'DK': 31, 'EE': 3, 'ES': 29, 'FI': 23, 'FR': 42, 'GB': 82, 'GE': 1, 'HU': 27, 'IE': 9, 'IL': 2, 'IM': 1, 'IS': 1, 'IT': 21, 'LT': 1, 'LU': 3, 'LV': 2, 'MT': 1, 'MX': 2, 'NL': 138, 'NO': 13, 'PL': 38, 'PT': 4, 'QA': 1, 'RO': 7, 'RU': 2, 'SE': 12, 'SI': 8, 'SK': 7, 'TH': 1, 'TR': 1, 'UA': 2, 'US': 20, 'ZA': 2}","{'normal': 1269, 'sponsor': 451, 'supersponsor': 275}","{'animator': 584, 'artist': 877, 'fursuiter': 1004, 'musician': 615}"
02/04/2024,True,2024-02-04T23:47:03.183+00:00,2024-02-04T23:47:03.183+00:00,2024,EF28,2069,"{'18': 9, '19': 35, '20': 58, '21': 58, '22': 94, '23': 126, '24': 124, '25': 121, '26': 107, '27': 126, '28': 94, '29': 102, '30': 103, '31': 101, '32': 94, '33': 82, '34': 75, '35': 74, '36': 71, '37': 63, '38': 50, '39': 40, '40': 41, '41': 43, '42': 19, '43': 12, '44': 16, '45': 15, '46': 15, '47': 17, '48': 8, '49': 15, '50': 9, '51': 7, '52': 5, '53': 5, '54': 2, '55': 6, '56': 2, '57': 4, '58': 2, '59': 5, '60': 4, '62': 3, '63': 1, '64': 1, '68': 1, '69': 1, '70': 1, '71': 1, '119': 1}",{},"{'new': 7, 'approved': 1206, 'partially paid': 1, 'paid': 855}","{'XS': 2, 'S': 68, 'M': 352, 'L': 382, 'XL': 269, 'XXL': 155}","{'AL': 1, 'AT': 93, 'AU': 6, 'BE': 26, 'BG': 2, 'BR': 2, 'BS': 1, 'CA': 6, 'CH': 64, 'CL': 1, 'CO': 1, 'CY': 1, 'CZ': 27, 'DE': 1276, 'DK': 32, 'EE': 3, 'ES': 29, 'FI': 24, 'FR': 42, 'GB': 85, 'GE': 1, 'HU': 27, 'IE': 10, 'IL': 4, 'IM': 1, 'IS': 1, 'IT': 21, 'LT': 1, 'LU': 3, 'LV': 2, 'MT': 1, 'MX': 2, 'NL': 142, 'NO': 13, 'PL': 44, 'PT': 5, 'QA': 1, 'RO': 7, 'RU': 2, 'SE': 13, 'SI': 8, 'SK': 7, 'TH': 1, 'TR': 1, 'UA': 2, 'US': 25, 'ZA': 2}","{'normal': 1324, 'sponsor': 466, 'supersponsor': 279}","{'animator': 610, 'artist': 911, 'fursuiter': 1042, 'musician': 642}"
02/05/2024,True,2024-02-05T23:47:35.756+00:00,2024-02-05T23:47:35.756+00:00,2024,EF28,2134,"{'18': 10, '19': 37, '20': 62, '21': 61, '22': 101, '23': 129, '24': 125, '25': 127, '26': 108, '27': 127, '28': 98, '29': 107, '30': 104, '31': 106, '32': 102, '33': 84, '34': 76, '35': 75, '36': 73, '37': 63, '38': 52, '39': 42, '40': 41, '41': 43, '42': 20, '43': 12, '44': 16, '45': 16, '46': 15, '47': 17, '48': 8, '49': 15, '50': 9, '51': 7, '52': 5, '53': 5, '54': 2, '55': 6, '56': 2, '57': 4, '58': 2, '59': 5, '60': 4, '62': 3, '63': 1, '64': 1, '68': 1, '69': 2, '70': 1, '71': 1, '119': 1}",{},"{'new': 6, 'approved': 1065, 'partially paid': 1, 'paid': 1062}","{'XS': 2, 'S': 71, 'M': 364, 'L': 390, 'XL': 274, 'XXL': 158}","{'AL': 1, 'AT': 95, 'AU': 6, 'BE': 30, 'BG': 2, 'BR': 2, 'BS': 1, 'CA': 7, 'CH': 65, 'CL': 1, 'CO': 1, 'CY': 1, 'CZ': 29, 'DE': 1305, 'DK': 32, 'EE': 3, 'ES': 30, 'FI': 24, 'FR': 43, 'GB': 96, 'GE': 1, 'HU': 27, 'IE': 12, 'IL': 4, 'IM': 1, 'IS': 1, 'IT': 22, 'LT': 1, 'LU': 3, 'LV': 2, 'MT': 1, 'MX': 3, 'NL': 145, 'NO': 14, 'PL': 45, 'PT': 5, 'QA': 1, 'RO': 8, 'RU': 2, 'SE': 14, 'SI': 8, 'SK': 7, 'TH': 2, 'TR': 1, 'UA': 2, 'US': 26, 'ZA': 2}","{'normal': 1374, 'sponsor': 478, 'supersponsor': 281}","{'animator': 630, 'artist': 939, 'fursuiter': 1068, 'musician': 656}"
02/06/2024,True,2024-02-06T23:47:16.301+00:00,2024-02-06T23:47:16.301+00:00,2024,EF28,2172,"{'18': 11, '19': 38, '20': 63, '21': 64, '22': 102, '23': 132, '24': 126, '25': 130, '26': 110, '27': 129, '28': 102, '29': 112, '30': 104, '31': 109, '32': 103, '33': 84, '34': 77, '35': 76, '36': 74, '37': 63, '38': 53, '39': 42, '40': 42, '41': 43, '42': 20, '43': 12, '44': 16, '45': 16, '46': 16, '47': 17, '48': 8, '49': 15, '50': 9, '51': 7, '52': 5, '53': 5, '54': 2, '55': 6, '56': 3, '57': 4, '58': 2, '59': 5, '60': 4, '62': 3, '63': 1, '64': 1, '68': 1, '69': 2, '70': 1, '71': 1, '119': 1}",{},"{'new': 7, 'approved': 982, 'partially paid': 1, 'paid': 1182}","{'XS': 2, 'S': 72, 'M': 370, 'L': 399, 'XL': 276, 'XXL': 160}","{'AL': 1, 'AT': 98, 'AU': 6, 'BE': 31, 'BG': 2, 'BR': 2, 'BS': 1, 'CA': 7, 'CH': 65, 'CL': 1, 'CO': 1, 'CY': 1, 'CZ': 29, 'DE': 1323, 'DK': 32, 'EE': 3, 'ES': 32, 'FI': 24, 'FR': 43, 'GB': 100, 'GE': 1, 'HU': 27, 'IE': 14, 'IL': 4, 'IM': 1, 'IS': 1, 'IT': 22, 'LT': 2, 'LU': 4, 'LV': 2, 'MT': 1, 'MX': 3, 'NL': 148, 'NO': 16, 'PL': 47, 'PT': 5, 'QA': 1, 'RO': 8, 'RU': 2, 'SE': 13, 'SI': 8, 'SK': 7, 'TH': 2, 'TR': 1, 'UA': 2, 'US': 26, 'ZA': 2}","{'normal': 1406, 'sponsor': 482, 'supersponsor': 283}","{'animator': 643, 'artist': 958, 'fursuiter': 1089, 'musician': 672}"
02/07/2024,True,2024-02-07T23:47:17.995+00:00,2024-02-07T23:47:17.995+00:00,2024,EF28,2211,"{'18': 12, '19': 40, '20': 63, '21': 67, '22': 104, '23': 132, '24': 129, '25': 134, '26': 115, '27': 133, '28': 102, '29': 114, '30': 106, '31': 112, '32': 103, '33': 85, '34': 78, '35': 76, '36': 76, '37': 64, '38': 53, '39': 43, '40': 42, '41': 43, '42': 20, '43': 12, '44': 16, '45': 16, '46': 16, '47': 18, '48': 8, '49': 15, '50': 9, '51': 7, '52': 5, '53': 5, '54': 2, '55': 6, '56': 4, '57': 4, '58': 2, '59': 5, '60': 4, '62': 3, '63': 1, '64': 1, '68': 1, '69': 2, '70': 1, '71': 1, '119': 1}",{},"{'new': 6, 'approved': 938, 'partially paid': 2, 'paid': 1265}","{'XS': 4, 'S': 73, 'M': 373, 'L': 404, 'XL': 278, 'XXL': 162}","{'AL': 1, 'AT': 99, 'AU': 6, 'BE': 31, 'BG': 2, 'BR': 2, 'BS': 1, 'CA': 7, 'CH': 65, 'CL': 1, 'CO': 1, 'CY': 1, 'CZ': 29, 'DE': 1339, 'DK': 33, 'EE': 3, 'ES': 33, 'FI': 25, 'FR': 43, 'GB': 108, 'GE': 1, 'HU': 28, 'IE': 15, 'IL': 4, 'IM': 1, 'IS': 1, 'IT': 25, 'LT': 2, 'LU': 4, 'LV': 2, 'MT': 1, 'MX': 3, 'NL': 150, 'NO': 16, 'PL': 47, 'PT': 5, 'QA': 1, 'RO': 8, 'RU': 2, 'SE': 13, 'SI': 9, 'SK': 7, 'TH': 2, 'TR': 1, 'UA': 2, 'US': 29, 'ZA': 2}","{'normal': 1441, 'sponsor': 487, 'supersponsor': 282}","{'animator': 657, 'artist': 975, 'fursuiter': 1107, 'musician': 685}"
02/08/2024,True,2024-02-08T23:47:22.274+00:00,2024-02-08T23:47:22.274+00:00,2024,EF28,2258,"{'18': 13, '19': 41, '20': 65, '21': 68, '22': 111, '23': 136, '24': 132, '25': 137, '26': 119, '27': 134, '28': 102, '29': 115, '30': 107, '31': 115, '32': 104, '33': 90, '34': 79, '35': 77, '36': 78, '37': 64, '38': 54, '39': 43, '40': 42, '41': 44, '42': 20, '43': 13, '44': 17, '45': 16, '46': 16, '47': 18, '48': 8, '49': 15, '50': 10, '51': 7, '52': 5, '53': 5, '54': 2, '55': 6, '56': 4, '57': 4, '58': 2, '59': 5, '60': 4, '62': 3, '63': 1, '64': 1, '68': 1, '69': 2, '70': 1, '71': 1, '119': 1}",{},"{'new': 6, 'approved': 903, 'partially paid': 3, 'paid': 1346}","{'XS': 4, 'S': 73, 'M': 379, 'L': 413, 'XL': 284, 'XXL': 167}","{'AL': 1, 'AT': 100, 'AU': 7, 'BE': 31, 'BG': 2, 'BR': 2, 'BS': 1, 'CA': 9, 'CH': 65, 'CL': 1, 'CO': 1, 'CY': 1, 'CZ': 29, 'DE': 1361, 'DK': 34, 'EE': 3, 'ES': 33, 'FI': 25, 'FR': 44, 'GB': 113, 'GE': 1, 'HU': 28, 'IE': 19, 'IL': 4, 'IM': 1, 'IS': 1, 'IT': 26, 'LT': 2, 'LU': 5, 'LV': 2, 'MT': 2, 'MX': 3, 'NL': 153, 'NO': 16, 'PL': 48, 'PT': 5, 'QA': 1, 'RO': 8, 'RU': 2, 'SE': 13, 'SI': 10, 'SK': 7, 'TH': 2, 'TR': 1, 'UA': 2, 'US': 31, 'ZA': 2}","{'normal': 1478, 'sponsor': 493, 'supersponsor': 286}","{'animator': 675, 'artist': 1003, 'fursuiter': 1132, 'musician': 701}"
02/09/2024,True,2024-02-09T23:47:26.985+00:00,2024-02-09T23:47:26.985+00:00,2024,EF28,2292,"{'18': 13, '19': 41, '20': 65, '21': 70, '22': 113, '23': 139, '24': 133, '25': 140, '26': 123, '27': 138, '28': 102, '29': 116, '30': 111, '31': 115, '32': 105, '33': 92, '34': 79, '35': 78, '36': 78, '37': 65, '38': 55, '39': 43, '40': 42, '41': 45, '42': 20, '43': 13, '44': 17, '45': 16, '46': 16, '47': 18, '48': 10, '49': 15, '50': 10, '51': 7, '52': 5, '53': 6, '54': 2, '55': 6, '56': 4, '57': 4, '58': 2, '59': 5, '60': 4, '62': 3, '63': 1, '64': 1, '68': 1, '69': 2, '70': 1, '71': 1, '119': 1}",{},"{'approved': 869, 'partially paid': 3, 'paid': 1420}","{'XS': 4, 'S': 74, 'M': 387, 'L': 418, 'XL': 286, 'XXL': 174}","{'AL': 1, 'AT': 101, 'AU': 7, 'BE': 31, 'BG': 2, 'BR': 2, 'BS': 1, 'CA': 9, 'CH': 66, 'CL': 1, 'CO': 1, 'CY': 1, 'CZ': 29, 'DE': 1384, 'DK': 34, 'EE': 3, 'ES': 33, 'FI': 25, 'FR': 45, 'GB': 115, 'GE': 1, 'HU': 29, 'IE': 19, 'IL': 4, 'IM': 1, 'IS': 1, 'IT': 26, 'LT': 2, 'LU': 5, 'LV': 2, 'MT': 2, 'MX': 3, 'NL': 154, 'NO': 16, 'NZ': 1, 'PL': 48, 'PT': 5, 'QA': 1, 'RO': 8, 'RU': 2, 'SE': 14, 'SI': 10, 'SK': 7, 'TH': 2, 'TR': 1, 'UA': 2, 'US': 33, 'ZA': 2}","{'normal': 1501, 'sponsor': 502, 'supersponsor': 288}","{'animator': 687, 'artist': 1016, 'fursuiter': 1146, 'musician': 708}"
02/10/2024,True,2024-02-10T23:47:35.797+00:00,2024-02-10T23:47:35.797+00:00,2024,EF28,2322,"{'18': 14, '19': 41, '20': 65, '21': 72, '22': 114, '23': 141, '24': 135, '25': 142, '26': 127, '27': 138, '28': 103, '29': 119, '30': 114, '31': 116, '32': 106, '33': 93, '34': 79, '35': 79, '36': 78, '37': 66, '38': 55, '39': 44, '40': 42, '41': 46, '42': 21, '43': 13, '44': 17, '45': 16, '46': 16, '47': 18, '48': 10, '49': 15, '50': 10, '51': 7, '52': 5, '53': 6, '54': 2, '55': 6, '56': 4, '57': 4, '58': 2, '59': 5, '60': 4, '62': 4, '63': 1, '64': 1, '68': 1, '69': 2, '70': 1, '71': 1, '119': 1}",{},"{'new': 1, 'approved': 849, 'partially paid': 3, 'paid': 1469}","{'XS': 4, 'S': 74, 'M': 391, 'L': 427, 'XL': 292, 'XXL': 176}","{'AL': 1, 'AT': 101, 'AU': 7, 'BE': 31, 'BG': 2, 'BR': 2, 'BS': 1, 'CA': 9, 'CH': 66, 'CL': 1, 'CO': 1, 'CY': 1, 'CZ': 29, 'DE': 1398, 'DK': 35, 'EE': 3, 'ES': 35, 'FI': 25, 'FR': 46, 'GB': 121, 'GE': 1, 'HU': 29, 'IE': 19, 'IL': 4, 'IM': 1, 'IS': 1, 'IT': 26, 'LT': 2, 'LU': 5, 'LV': 2, 'MT': 2, 'MX': 3, 'NL': 158, 'NO': 17, 'NZ': 1, 'PL': 49, 'PT': 5, 'QA': 1, 'RO': 8, 'RU': 2, 'SE': 14, 'SI': 10, 'SK': 7, 'TH': 2, 'TR': 1, 'UA': 2, 'US': 33, 'ZA': 2}","{'normal': 1524, 'sponsor': 506, 'supersponsor': 291}","{'animator': 699, 'artist': 1029, 'fursuiter': 1159, 'musician': 721}"
02/11/2024,True,2024-02-11T23:47:32.739+00:00,2024-02-11T23:47:32.739+00:00,2024,EF28,2375,"{'18': 15, '19': 43, '20': 66, '21': 74, '22': 116, '23': 143, '24': 135, '25': 144, '26': 132, '27': 141, '28': 104, '29': 123, '30': 115, '31': 120, '32': 110, '33': 97, '34': 81, '35': 81, '36': 80, '37': 67, '38': 56, '39': 45, '40': 42, '41': 47, '42': 22, '43': 13, '44': 19, '45': 16, '46': 16, '47': 18, '48': 11, '49': 15, '50': 10, '51': 7, '52': 5, '53': 6, '54': 3, '55': 6, '56': 4, '57': 4, '58': 2, '59': 5, '60': 4, '62': 4, '63': 1, '64': 1, '68': 1, '69': 2, '70': 1, '71': 1, '119': 1}",{},"{'new': 2, 'approved': 856, 'partially paid': 3, 'paid': 1514}","{'XS': 4, 'S': 75, 'M': 398, 'L': 437, 'XL': 295, 'XXL': 180}","{'AL': 1, 'AT': 102, 'AU': 7, 'BE': 31, 'BG': 2, 'BR': 2, 'BS': 1, 'CA': 9, 'CH': 69, 'CL': 1, 'CO': 1, 'CY': 1, 'CZ': 30, 'DE': 1435, 'DK': 36, 'EE': 3, 'ES': 35, 'FI': 26, 'FR': 47, 'GB': 126, 'GE': 1, 'HU': 30, 'IE': 19, 'IL': 4, 'IM': 1, 'IS': 1, 'IT': 26, 'LT': 2, 'LU': 6, 'LV': 2, 'MT': 2, 'MX': 3, 'NL': 158, 'NO': 18, 'NZ': 1, 'PL': 49, 'PT': 5, 'QA': 1, 'RO': 8, 'RU': 2, 'SE': 14, 'SI': 10, 'SK': 7, 'TH': 2, 'TR': 1, 'UA': 2, 'US': 33, 'ZA': 2}","{'normal': 1571, 'sponsor': 512, 'supersponsor': 291}","{'animator': 714, 'artist': 1052, 'fursuiter': 1178, 'musician': 736}"
02/12/2024,True,2024-02-12T23:47:26.190+00:00,2024-02-12T23:47:26.190+00:00,2024,EF28,2416,"{'18': 16, '19': 43, '20': 68, '21': 77, '22': 116, '23': 148, '24': 137, '25': 145, '26': 136, '27': 143, '28': 105, '29': 128, '30': 118, '31': 120, '32': 110, '33': 98, '34': 83, '35': 81, '36': 82, '37': 69, '38': 58, '39': 46, '40': 42, '41': 48, '42': 22, '43': 13, '44': 20, '45': 16, '46': 16, '47': 18, '48': 11, '49': 15, '50': 10, '51': 7, '52': 5, '53': 6, '54': 3, '55': 6, '56': 4, '57': 4, '58': 2, '59': 5, '60': 4, '62': 4, '63': 1, '64': 1, '68': 1, '69': 2, '70': 1, '71': 1, '119': 1}",{},"{'new': 4, 'approved': 760, 'partially paid': 4, 'paid': 1648}","{'XS': 5, 'S': 78, 'M': 403, 'L': 443, 'XL': 301, 'XXL': 182}","{'AL': 1, 'AT': 105, 'AU': 7, 'BE': 31, 'BG': 2, 'BR': 2, 'BS': 1, 'CA': 9, 'CH': 69, 'CL': 1, 'CO': 1, 'CY': 1, 'CZ': 31, 'DE': 1454, 'DK': 36, 'EE': 3, 'ES': 35, 'FI': 26, 'FR': 49, 'GB': 129, 'GE': 1, 'HU': 30, 'IE': 24, 'IL': 4, 'IM': 1, 'IS': 1, 'IT': 26, 'LT': 2, 'LU': 6, 'LV': 2, 'MT': 2, 'MX': 3, 'NL': 163, 'NO': 18, 'NZ': 1, 'PL': 50, 'PT': 5, 'QA': 1, 'RO': 8, 'RU': 2, 'SE': 15, 'SI': 10, 'SK': 7, 'TH': 2, 'TR': 1, 'UA': 2, 'US': 34, 'ZA': 2}","{'normal': 1604, 'sponsor': 519, 'supersponsor': 292}","{'animator': 727, 'artist': 1069, 'fursuiter': 1199, 'musician': 750}"
02/13/2024,True,2024-02-13T23:47:05.160+00:00,2024-02-13T23:47:05.160+00:00,2024,EF28,2444,"{'18': 17, '19': 43, '20': 69, '21': 79, '22': 118, '23': 148, '24': 139, '25': 147, '26': 136, '27': 148, '28': 106, '29': 129, '30': 118, '31': 120, '32': 111, '33': 98, '34': 86, '35': 84, '36': 83, '37': 70, '38': 58, '39': 47, '40': 42, '41': 48, '42': 22, '43': 13, '44': 21, '45': 16, '46': 16, '47': 18, '48': 11, '49': 15, '50': 10, '51': 7, '52': 5, '53': 6, '54': 3, '55': 6, '56': 4, '57': 4, '58': 2, '59': 5, '60': 4, '62': 4, '63': 1, '64': 1, '68': 1, '69': 2, '70': 1, '71': 1, '119': 1}",{},"{'new': 8, 'approved': 711, 'partially paid': 4, 'paid': 1721}","{'XS': 5, 'S': 78, 'M': 406, 'L': 445, 'XL': 305, 'XXL': 182}","{'AL': 1, 'AT': 106, 'AU': 8, 'BE': 31, 'BG': 2, 'BR': 2, 'BS': 1, 'CA': 9, 'CH': 69, 'CL': 1, 'CO': 1, 'CY': 1, 'CZ': 31, 'DE': 1470, 'DK': 36, 'EE': 3, 'ES': 36, 'FI': 26, 'FR': 49, 'GB': 131, 'GE': 1, 'HU': 30, 'IE': 24, 'IL': 4, 'IM': 1, 'IS': 1, 'IT': 26, 'LT': 2, 'LU': 7, 'LV': 2, 'MT': 2, 'MX': 3, 'NL': 167, 'NO': 18, 'NZ': 1, 'PL': 50, 'PT': 5, 'QA': 1, 'RO': 8, 'RU': 2, 'SE': 15, 'SI': 10, 'SK': 7, 'TH': 2, 'TR': 1, 'UA': 2, 'US': 36, 'ZA': 2}","{'normal': 1633, 'sponsor': 520, 'supersponsor': 290}","{'animator': 736, 'artist': 1078, 'fursuiter': 1212, 'musician': 761}"
02/14/2024,True,2024-02-14T23:47:54.324+00:00,2024-02-14T23:47:54.324+00:00,2024,EF28,2474,"{'18': 17, '19': 43, '20': 72, '21': 79, '22': 120, '23': 148, '24': 143, '25': 148, '26': 136, '27': 154, '28': 107, '29': 131, '30': 121, '31': 120, '32': 112, '33': 100, '34': 87, '35': 85, '36': 85, '37': 71, '38': 58, '39': 47, '40': 42, '41': 48, '42': 22, '43': 13, '44': 21, '45': 16, '46': 16, '47': 18, '48': 11, '49': 15, '50': 10, '51': 7, '52': 5, '53': 6, '54': 3, '55': 6, '56': 4, '57': 4, '58': 2, '59': 5, '60': 4, '62': 4, '63': 1, '64': 1, '68': 1, '69': 2, '70': 1, '71': 1, '119': 1}",{},"{'new': 4, 'approved': 677, 'partially paid': 4, 'paid': 1789}","{'XS': 5, 'S': 79, 'M': 409, 'L': 447, 'XL': 309, 'XXL': 184}","{'AL': 1, 'AT': 107, 'AU': 8, 'BE': 33, 'BG': 2, 'BR': 2, 'BS': 1, 'CA': 9, 'CH': 69, 'CL': 1, 'CO': 1, 'CY': 1, 'CZ': 33, 'DE': 1484, 'DK': 36, 'EE': 3, 'ES': 36, 'FI': 26, 'FR': 50, 'GB': 131, 'GE': 1, 'HU': 30, 'IE': 24, 'IL': 4, 'IM': 1, 'IS': 1, 'IT': 26, 'LT': 2, 'LU': 7, 'LV': 2, 'MT': 2, 'MX': 3, 'NL': 171, 'NO': 18, 'NZ': 1, 'PL': 51, 'PT': 5, 'QA': 1, 'RO': 8, 'RU': 3, 'SE': 16, 'SI': 10, 'SK': 7, 'TH': 2, 'TR': 1, 'UA': 2, 'US': 39, 'ZA': 2}","{'normal': 1658, 'sponsor': 525, 'supersponsor': 290}","{'animator': 746, 'artist': 1088, 'fursuiter': 1225, 'musician': 768}"
02/15/2024,True,2024-02-15T23:47:31.052+00:00,2024-02-15T23:47:31.052+00:00,2024,EF28,2498,"{'18': 17, '19': 43, '20': 72, '21': 82, '22': 125, '23': 148, '24': 145, '25': 149, '26': 136, '27': 156, '28': 107, '29': 132, '30': 121, '31': 120, '32': 112, '33': 102, '34': 88, '35': 86, '36': 85, '37': 71, '38': 59, '39': 48, '40': 42, '41': 50, '42': 22, '43': 14, '44': 21, '45': 16, '46': 16, '47': 18, '48': 11, '49': 15, '50': 11, '51': 7, '52': 5, '53': 6, '54': 3, '55': 6, '56': 4, '57': 4, '58': 2, '59': 5, '60': 4, '62': 4, '63': 1, '64': 1, '68': 1, '69': 2, '70': 1, '71': 1, '119': 1}",{},"{'new': 4, 'approved': 629, 'partially paid': 4, 'paid': 1861}","{'XS': 5, 'S': 79, 'M': 414, 'L': 449, 'XL': 309, 'XXL': 186}","{'AL': 1, 'AT': 107, 'AU': 8, 'BE': 33, 'BG': 2, 'BR': 2, 'BS': 1, 'CA': 9, 'CH': 69, 'CL': 1, 'CO': 1, 'CY': 1, 'CZ': 33, 'DE': 1497, 'DK': 36, 'EE': 3, 'ES': 36, 'FI': 27, 'FR': 51, 'GB': 133, 'GE': 1, 'HU': 31, 'IE': 24, 'IL': 4, 'IM': 1, 'IS': 1, 'IT': 26, 'LT': 2, 'LU': 7, 'LV': 2, 'MT': 2, 'MX': 3, 'NL': 172, 'NO': 18, 'NZ': 1, 'PL': 53, 'PT': 5, 'QA': 1, 'RO': 9, 'RU': 3, 'SE': 17, 'SI': 10, 'SK': 7, 'TH': 2, 'TR': 1, 'UA': 2, 'US': 40, 'ZA': 2}","{'normal': 1678, 'sponsor': 528, 'supersponsor': 291}","{'animator': 757, 'artist': 1103, 'fursuiter': 1236, 'musician': 777}"
02/16/2024,True,2024-02-16T23:47:31.186+00:00,2024-02-16T23:47:31.186+00:00,2024,EF28,2516,"{'18': 17, '19': 43, '20': 73, '21': 82, '22': 125, '23': 150, '24': 145, '25': 152, '26': 138, '27': 156, '28': 108, '29': 132, '30': 123, '31': 121, '32': 112, '33': 103, '34': 88, '35': 87, '36': 85, '37': 72, '38': 59, '39': 48, '40': 42, '41': 51, '42': 22, '43': 14, '44': 22, '45': 16, '46': 16, '47': 18, '48': 11, '49': 15, '50': 11, '51': 7, '52': 5, '53': 7, '54': 3, '55': 6, '56': 4, '57': 4, '58': 2, '59': 5, '60': 4, '62': 4, '63': 1, '64': 1, '68': 1, '69': 2, '70': 1, '71': 1, '119': 1}",{},"{'approved': 597, 'partially paid': 4, 'paid': 1915}","{'XS': 5, 'S': 80, 'M': 414, 'L': 453, 'XL': 311, 'XXL': 187}","{'AL': 1, 'AT': 107, 'AU': 8, 'BE': 33, 'BG': 2, 'BR': 2, 'BS': 1, 'CA': 9, 'CH': 69, 'CL': 1, 'CO': 1, 'CY': 1, 'CZ': 33, 'DE': 1509, 'DK': 36, 'EE': 3, 'ES': 36, 'FI': 28, 'FR': 52, 'GB': 133, 'GE': 1, 'HU': 31, 'IE': 24, 'IL': 4, 'IM': 1, 'IS': 1, 'IT': 26, 'LT': 2, 'LU': 7, 'LV': 2, 'MT': 2, 'MX': 3, 'NL': 174, 'NO': 18, 'NZ': 1, 'PL': 54, 'PT': 5, 'QA': 1, 'RO': 9, 'RU': 3, 'SE': 17, 'SI': 10, 'SK': 7, 'TH': 2, 'TR': 1, 'UA': 2, 'US': 41, 'ZA': 2}","{'normal': 1693, 'sponsor': 530, 'supersponsor': 292}","{'animator': 762, 'artist': 1113, 'fursuiter': 1243, 'musician': 784}"
02/17/2024,True,2024-02-17T23:47:27.949+00:00,2024-02-17T23:47:27.949+00:00,2024,EF28,2531,"{'18': 17, '19': 43, '20': 74, '21': 82, '22': 126, '23': 150, '24': 146, '25': 152, '26': 141, '27': 157, '28': 109, '29': 133, '30': 124, '31': 121, '32': 113, '33': 105, '34': 88, '35': 87, '36': 85, '37': 72, '38': 59, '39': 48, '40': 43, '41': 52, '42': 22, '43': 14, '44': 22, '45': 16, '46': 16, '47': 18, '48': 11, '49': 15, '50': 11, '51': 7, '52': 5, '53': 7, '54': 3, '55': 6, '56': 4, '57': 4, '58': 2, '59': 5, '60': 4, '62': 4, '63': 1, '64': 1, '68': 1, '69': 2, '70': 1, '71': 1, '119': 1}",{},"{'new': 1, 'approved': 593, 'partially paid': 4, 'paid': 1933}","{'XS': 5, 'S': 81, 'M': 417, 'L': 456, 'XL': 313, 'XXL': 189}","{'AL': 1, 'AT': 107, 'AU': 8, 'BE': 34, 'BG': 2, 'BR': 2, 'BS': 1, 'CA': 9, 'CH': 70, 'CL': 1, 'CO': 1, 'CY': 1, 'CZ': 33, 'DE': 1519, 'DK': 36, 'EE': 3, 'ES': 36, 'FI': 28, 'FR': 53, 'GB': 133, 'GE': 1, 'HU': 31, 'IE': 24, 'IL': 4, 'IM': 1, 'IS': 1, 'IT': 26, 'LT': 2, 'LU': 7, 'LV': 2, 'MT': 2, 'MX': 3, 'NL': 174, 'NO': 18, 'NZ': 1, 'PL': 54, 'PT': 5, 'QA': 1, 'RO': 9, 'RU': 3, 'SE': 17, 'SI': 10, 'SK': 7, 'TH': 2, 'TR': 1, 'UA': 2, 'US': 43, 'ZA': 2}","{'normal': 1699, 'sponsor': 539, 'supersponsor': 292}","{'animator': 767, 'artist': 1119, 'fursuiter': 1250, 'musician': 793}"
02/18/2024,True,2024-02-18T23:48:29.608+00:00,2024-02-18T23:48:29.608+00:00,2024,EF28,2554,"{'18': 19, '19': 43, '20': 76, '21': 83, '22': 128, '23': 150, '24': 147, '25': 154, '26': 142, '27': 157, '28': 110, '29': 137, '30': 126, '31': 123, '32': 113, '33': 106, '34': 88, '35': 87, '36': 85, '37': 72, '38': 60, '39': 48, '40': 43, '41': 52, '42': 22, '43': 14, '44': 22, '45': 16, '46': 16, '47': 18, '48': 11, '49': 15, '50': 11, '51': 7, '52': 5, '53': 7, '54': 3, '55': 6, '56': 4, '57': 4, '58': 2, '59': 5, '60': 4, '62': 4, '63': 2, '64': 1, '68': 1, '69': 2, '70': 1, '71': 1, '119': 1}",{},"{'approved': 596, 'partially paid': 5, 'paid': 1953}","{'XS': 5, 'S': 82, 'M': 419, 'L': 463, 'XL': 315, 'XXL': 191}","{'AL': 1, 'AT': 110, 'AU': 8, 'BE': 36, 'BG': 2, 'BR': 2, 'BS': 1, 'CA': 9, 'CH': 71, 'CL': 1, 'CO': 1, 'CY': 1, 'CZ': 33, 'DE': 1528, 'DK': 36, 'EE': 3, 'ES': 36, 'FI': 28, 'FR': 54, 'GB': 135, 'GE': 1, 'HU': 31, 'IE': 25, 'IL': 4, 'IM': 1, 'IS': 1, 'IT': 27, 'LT': 2, 'LU': 7, 'LV': 2, 'MT': 2, 'MX': 3, 'NL': 175, 'NO': 18, 'NZ': 1, 'PL': 54, 'PT': 6, 'QA': 1, 'RO': 9, 'RU': 3, 'SE': 17, 'SI': 10, 'SK': 7, 'TH': 2, 'TR': 1, 'UA': 2, 'US': 44, 'ZA': 2}","{'normal': 1717, 'sponsor': 543, 'supersponsor': 293}","{'animator': 773, 'artist': 1128, 'fursuiter': 1260, 'musician': 801}"
02/19/2024,True,2024-02-19T23:47:17.520+00:00,2024-02-19T23:47:17.520+00:00,2024,EF28,2585,"{'18': 19, '19': 43, '20': 78, '21': 84, '22': 130, '23': 150, '24': 148, '25': 155, '26': 143, '27': 158, '28': 117, '29': 139, '30': 129, '31': 124, '32': 114, '33': 107, '34': 90, '35': 88, '36': 86, '37': 72, '38': 61, '39': 49, '40': 43, '41': 52, '42': 22, '43': 14, '44': 22, '45': 17, '46': 16, '47': 18, '48': 11, '49': 15, '50': 11, '51': 7, '52': 5, '53': 7, '54': 3, '55': 6, '56': 4, '57': 4, '58': 2, '59': 5, '60': 4, '62': 4, '63': 2, '64': 1, '68': 1, '69': 2, '70': 1, '71': 1, '119': 1}",{},"{'new': 3, 'approved': 581, 'partially paid': 5, 'paid': 1996}","{'XS': 7, 'S': 82, 'M': 422, 'L': 468, 'XL': 317, 'XXL': 191}","{'AL': 1, 'AT': 110, 'AU': 8, 'BE': 37, 'BG': 2, 'BR': 2, 'BS': 1, 'CA': 9, 'CH': 73, 'CL': 1, 'CO': 1, 'CY': 1, 'CZ': 33, 'DE': 1548, 'DK': 37, 'EE': 3, 'ES': 38, 'FI': 28, 'FR': 54, 'GB': 136, 'GE': 1, 'GG': 1, 'HU': 31, 'IE': 26, 'IL': 4, 'IM': 1, 'IS': 1, 'IT': 27, 'LT': 2, 'LU': 7, 'LV': 2, 'MT': 2, 'MX': 3, 'NL': 175, 'NO': 18, 'NZ': 1, 'PL': 55, 'PT': 6, 'QA': 1, 'RO': 9, 'RU': 3, 'SE': 17, 'SI': 10, 'SK': 7, 'TH': 2, 'TR': 1, 'TW': 1, 'UA': 2, 'US': 44, 'ZA': 2}","{'normal': 1740, 'sponsor': 550, 'supersponsor': 294}","{'animator': 786, 'artist': 1143, 'fursuiter': 1277, 'musician': 813}"
02/20/2024,True,2024-02-20T23:47:02.366+00:00,2024-02-20T23:47:02.366+00:00,2024,EF28,2623,"{'18': 19, '19': 44, '20': 80, '21': 86, '22': 131, '23': 155, '24': 150, '25': 158, '26': 147, '27': 162, '28': 124, '29': 140, '30': 129, '31': 124, '32': 115, '33': 107, '34': 90, '35': 89, '36': 86, '37': 74, '38': 61, '39': 49, '40': 43, '41': 52, '42': 22, '43': 14, '44': 22, '45': 17, '46': 16, '47': 18, '48': 11, '49': 15, '50': 11, '51': 7, '52': 5, '53': 7, '54': 3, '55': 6, '56': 4, '57': 4, '58': 2, '59': 6, '60': 4, '62': 4, '63': 2, '64': 1, '68': 1, '69': 2, '70': 1, '71': 1, '89': 1, '119': 1}",{},"{'new': 7, 'approved': 585, 'partially paid': 5, 'paid': 2026}","{'XS': 7, 'S': 83, 'M': 427, 'L': 475, 'XL': 321, 'XXL': 192}","{'AL': 1, 'AT': 112, 'AU': 8, 'BE': 37, 'BG': 2, 'BR': 2, 'BS': 1, 'CA': 9, 'CH': 73, 'CL': 1, 'CO': 1, 'CY': 1, 'CZ': 34, 'DE': 1567, 'DK': 39, 'EE': 3, 'ES': 38, 'FI': 29, 'FR': 58, 'GB': 136, 'GE': 1, 'GG': 1, 'HU': 31, 'IE': 26, 'IL': 4, 'IM': 1, 'IS': 1, 'IT': 27, 'LT': 2, 'LU': 7, 'LV': 2, 'MT': 2, 'MX': 3, 'NL': 177, 'NO': 18, 'NZ': 1, 'PL': 55, 'PT': 6, 'QA': 1, 'RO': 9, 'RU': 3, 'SE': 18, 'SG': 1, 'SI': 11, 'SK': 7, 'TH': 2, 'TR': 1, 'TW': 1, 'UA': 2, 'US': 48, 'ZA': 2}","{'normal': 1775, 'sponsor': 551, 'supersponsor': 296}","{'animator': 797, 'artist': 1161, 'fursuiter': 1294, 'musician': 824}"
02/21/2024,True,2024-02-21T23:48:18.312+00:00,2024-02-21T23:48:18.312+00:00,2024,EF28,2644,"{'18': 19, '19': 46, '20': 81, '21': 86, '22': 133, '23': 157, '24': 151, '25': 159, '26': 148, '27': 164, '28': 126, '29': 141, '30': 131, '31': 124, '32': 116, '33': 107, '34': 90, '35': 89, '36': 87, '37': 74, '38': 61, '39': 49, '40': 44, '41': 52, '42': 22, '43': 14, '44': 22, '45': 17, '46': 16, '47': 18, '48': 11, '49': 15, '50': 11, '51': 7, '52': 6, '53': 7, '54': 3, '55': 6, '56': 4, '57': 4, '58': 2, '59': 6, '60': 4, '62': 4, '63': 2, '64': 1, '68': 1, '69': 2, '70': 1, '71': 1, '89': 1, '119': 1}",{},"{'approved': 579, 'partially paid': 5, 'paid': 2060}","{'XS': 7, 'S': 86, 'M': 428, 'L': 477, 'XL': 323, 'XXL': 192}","{'AL': 1, 'AT': 113, 'AU': 8, 'BE': 37, 'BG': 2, 'BR': 2, 'BS': 1, 'CA': 9, 'CH': 74, 'CL': 1, 'CO': 1, 'CY': 1, 'CZ': 34, 'DE': 1582, 'DK': 39, 'EE': 3, 'ES': 38, 'FI': 29, 'FR': 58, 'GB': 136, 'GE': 1, 'GG': 1, 'HU': 31, 'IE': 26, 'IL': 4, 'IM': 1, 'IS': 3, 'IT': 27, 'LT': 2, 'LU': 7, 'LV': 2, 'MT': 2, 'MX': 3, 'NL': 177, 'NO': 18, 'NZ': 1, 'PL': 55, 'PT': 6, 'QA': 1, 'RO': 9, 'RU': 3, 'SE': 18, 'SG': 1, 'SI': 11, 'SK': 7, 'SX': 1, 'TH': 2, 'TR': 1, 'TW': 1, 'UA': 2, 'US': 49, 'ZA': 2}","{'normal': 1792, 'sponsor': 551, 'supersponsor': 298}","{'animator': 803, 'artist': 1171, 'fursuiter': 1303, 'musician': 831}"
02/22/2024,True,2024-02-22T23:47:16.960+00:00,2024-02-22T23:47:16.960+00:00,2024,EF28,2675,"{'18': 20, '19': 48, '20': 84, '21': 88, '22': 134, '23': 161, '24': 154, '25': 162, '26': 148, '27': 167, '28': 129, '29': 141, '30': 133, '31': 125, '32': 117, '33': 107, '34': 90, '35': 89, '36': 88, '37': 74, '38': 61, '39': 49, '40': 44, '41': 52, '42': 22, '43': 14, '44': 22, '45': 18, '46': 16, '47': 18, '48': 11, '49': 15, '50': 11, '51': 7, '52': 6, '53': 7, '54': 3, '55': 6, '56': 4, '57': 4, '58': 2, '59': 6, '60': 4, '62': 4, '63': 2, '64': 1, '68': 1, '69': 2, '70': 1, '71': 1, '89': 1, '119': 1}",{},"{'new': 3, 'approved': 578, 'partially paid': 5, 'paid': 2089}","{'XS': 7, 'S': 86, 'M': 432, 'L': 480, 'XL': 326, 'XXL': 195}","{'AL': 1, 'AT': 113, 'AU': 8, 'BE': 37, 'BG': 2, 'BR': 2, 'BS': 1, 'CA': 10, 'CH': 74, 'CL': 1, 'CO': 1, 'CY': 1, 'CZ': 34, 'DE': 1600, 'DK': 39, 'EE': 3, 'ES': 39, 'FI': 29, 'FR': 60, 'GB': 137, 'GE': 1, 'GG': 1, 'HU': 31, 'IE': 26, 'IL': 4, 'IM': 1, 'IS': 4, 'IT': 27, 'LT': 2, 'LU': 7, 'LV': 2, 'MT': 2, 'MX': 3, 'NL': 180, 'NO': 18, 'NZ': 1, 'PL': 57, 'PT': 6, 'QA': 1, 'RO': 9, 'RU': 3, 'SE': 18, 'SG': 2, 'SI': 11, 'SK': 7, 'SX': 1, 'TH': 2, 'TR': 1, 'TW': 1, 'UA': 3, 'US': 49, 'ZA': 2}","{'normal': 1817, 'sponsor': 557, 'supersponsor': 298}","{'animator': 812, 'artist': 1183, 'fursuiter': 1319, 'musician': 841}"
02/23/2024,True,2024-02-23T23:47:15.108+00:00,2024-02-23T23:47:15.108+00:00,2024,EF28,2705,"{'18': 22, '19': 49, '20': 88, '21': 90, '22': 136, '23': 163, '24': 154, '25': 164, '26': 154, '27': 167, '28': 132, '29': 142, '30': 132, '31': 127, '32': 118, '33': 107, '34': 91, '35': 90, '36': 88, '37': 74, '38': 62, '39': 48, '40': 44, '41': 52, '42': 22, '43': 14, '44': 23, '45': 18, '46': 16, '47': 18, '48': 11, '49': 15, '50': 11, '51': 7, '52': 6, '53': 7, '54': 3, '55': 6, '56': 4, '57': 4, '58': 2, '59': 6, '60': 4, '62': 4, '63': 2, '64': 1, '68': 1, '69': 2, '70': 1, '71': 1, '89': 1, '119': 1}",{},"{'approved': 569, 'partially paid': 6, 'paid': 2130}","{'XS': 7, 'S': 86, 'M': 435, 'L': 488, 'XL': 328, 'XXL': 197}","{'AL': 1, 'AT': 113, 'AU': 8, 'BE': 37, 'BG': 2, 'BR': 2, 'BS': 1, 'CA': 11, 'CH': 76, 'CL': 1, 'CO': 1, 'CY': 1, 'CZ': 34, 'DE': 1610, 'DK': 41, 'EE': 3, 'ES': 40, 'FI': 31, 'FR': 60, 'GB': 140, 'GE': 1, 'GG': 1, 'HU': 31, 'IE': 27, 'IL': 5, 'IM': 1, 'IS': 4, 'IT': 27, 'LT': 2, 'LU': 8, 'LV': 2, 'MT': 2, 'MX': 2, 'NL': 184, 'NO': 19, 'NZ': 1, 'PL': 58, 'PT': 6, 'QA': 1, 'RO': 9, 'RU': 3, 'SE': 18, 'SG': 2, 'SI': 11, 'SK': 7, 'SX': 1, 'TH': 2, 'TR': 1, 'TW': 1, 'UA': 3, 'US': 50, 'ZA': 2}","{'normal': 1838, 'sponsor': 564, 'supersponsor': 300}","{'animator': 820, 'artist': 1192, 'fursuiter': 1328, 'musician': 847}"
02/24/2024,True,2024-02-24T23:49:13.635+00:00,2024-02-24T23:49:13.635+00:00,2024,EF28,2724,"{'18': 22, '19': 50, '20': 89, '21': 91, '22': 135, '23': 165, '24': 154, '25': 165, '26': 154, '27': 168, '28': 132, '29': 143, '30': 133, '31': 127, '32': 118, '33': 109, '34': 93, '35': 91, '36': 88, '37': 74, '38': 63, '39': 49, '40': 45, '41': 52, '42': 22, '43': 15, '44': 23, '45': 18, '46': 17, '47': 19, '48': 11, '49': 15, '50': 11, '51': 7, '52': 6, '53': 7, '54': 3, '55': 6, '56': 4, '57': 4, '58': 2, '59': 6, '60': 4, '62': 4, '63': 2, '64': 1, '68': 1, '69': 2, '70': 1, '71': 1, '89': 1, '119': 1}",{},"{'new': 5, 'approved': 565, 'partially paid': 6, 'paid': 2148}","{'XS': 7, 'S': 86, 'M': 439, 'L': 494, 'XL': 330, 'XXL': 198}","{'AL': 1, 'AT': 114, 'AU': 8, 'BE': 37, 'BG': 2, 'BR': 2, 'BS': 1, 'CA': 11, 'CH': 76, 'CL': 1, 'CO': 1, 'CY': 1, 'CZ': 34, 'DE': 1620, 'DK': 41, 'EE': 3, 'ES': 41, 'FI': 31, 'FR': 60, 'GB': 144, 'GE': 1, 'GG': 1, 'HU': 31, 'IE': 27, 'IL': 5, 'IM': 1, 'IS': 4, 'IT': 27, 'LT': 2, 'LU': 8, 'LV': 2, 'MT': 2, 'MX': 2, 'NL': 185, 'NO': 19, 'NZ': 1, 'PL': 59, 'PT': 6, 'QA': 1, 'RO': 9, 'RU': 3, 'SE': 19, 'SG': 2, 'SI': 11, 'SK': 7, 'SX': 1, 'TH': 2, 'TR': 1, 'TW': 1, 'UA': 3, 'US': 50, 'ZA': 2}","{'normal': 1851, 'sponsor': 571, 'supersponsor': 299}","{'animator': 823, 'artist': 1199, 'fursuiter': 1337, 'musician': 851}"
02/25/2024,True,2024-02-25T23:47:19.025+00:00,2024-02-25T23:47:19.025+00:00,2024,EF28,2765,"{'18': 24, '19': 53, '20': 92, '21': 93, '22': 135, '23': 167, '24': 157, '25': 166, '26': 158, '27': 172, '28': 133, '29': 146, '30': 133, '31': 128, '32': 119, '33': 112, '34': 95, '35': 93, '36': 88, '37': 75, '38': 63, '39': 49, '40': 45, '41': 53, '42': 22, '43': 15, '44': 24, '45': 18, '46': 17, '47': 19, '48': 11, '49': 15, '50': 11, '51': 8, '52': 6, '53': 7, '54': 3, '55': 6, '56': 4, '57': 4, '58': 2, '59': 6, '60': 4, '62': 4, '63': 2, '64': 1, '68': 1, '69': 2, '70': 1, '71': 1, '89': 1, '119': 1}",{},"{'new': 11, 'approved': 579, 'partially paid': 6, 'paid': 2169}","{'XS': 7, 'S': 88, 'M': 444, 'L': 500, 'XL': 334, 'XXL': 198}","{'AL': 1, 'AT': 117, 'AU': 8, 'BE': 37, 'BG': 2, 'BR': 2, 'BS': 1, 'CA': 11, 'CH': 76, 'CL': 1, 'CO': 1, 'CY': 1, 'CZ': 34, 'DE': 1642, 'DK': 41, 'EE': 4, 'ES': 41, 'FI': 31, 'FR': 62, 'GB': 144, 'GE': 1, 'GG': 1, 'HK': 1, 'HU': 31, 'IE': 28, 'IL': 6, 'IM': 1, 'IS': 4, 'IT': 28, 'LT': 2, 'LU': 8, 'LV': 2, 'MT': 2, 'MX': 2, 'NL': 187, 'NO': 20, 'NZ': 1, 'PL': 61, 'PT': 6, 'QA': 1, 'RO': 10, 'RU': 3, 'SE': 20, 'SG': 2, 'SI': 11, 'SK': 7, 'SX': 1, 'TH': 2, 'TR': 1, 'TW': 1, 'UA': 3, 'US': 51, 'ZA': 3}","{'normal': 1877, 'sponsor': 584, 'supersponsor': 301}","{'animator': 835, 'artist': 1217, 'fursuiter': 1360, 'musician': 859}"
02/26/2024,True,2024-02-26T23:47:22.117+00:00,2024-02-26T23:47:22.117+00:00,2024,EF28,2830,"{'18': 25, '19': 54, '20': 92, '21': 98, '22': 137, '23': 170, '24': 163, '25': 171, '26': 161, '27': 175, '28': 140, '29': 149, '30': 140, '31': 131, '32': 120, '33': 113, '34': 96, '35': 94, '36': 92, '37': 77, '38': 64, '39': 50, '40': 46, '41': 54, '42': 22, '43': 15, '44': 24, '45': 19, '46': 17, '47': 19, '48': 11, '49': 15, '50': 11, '51': 8, '52': 6, '53': 7, '54': 3, '55': 6, '56': 5, '57': 4, '58': 2, '59': 6, '60': 4, '62': 4, '63': 2, '64': 1, '68': 1, '69': 2, '70': 1, '71': 1, '89': 1, '119': 1}",{},"{'new': 7, 'approved': 572, 'partially paid': 6, 'paid': 2245}","{'XS': 7, 'S': 92, 'M': 456, 'L': 508, 'XL': 337, 'XXL': 200}","{'AL': 1, 'AT': 119, 'AU': 8, 'BE': 39, 'BG': 3, 'BR': 3, 'BS': 1, 'CA': 11, 'CH': 79, 'CL': 1, 'CO': 1, 'CY': 1, 'CZ': 34, 'DE': 1677, 'DK': 44, 'EE': 4, 'ES': 45, 'FI': 33, 'FR': 62, 'GB': 147, 'GE': 1, 'GG': 1, 'GR': 1, 'HK': 1, 'HU': 31, 'IE': 28, 'IL': 6, 'IM': 1, 'IS': 4, 'IT': 27, 'LT': 3, 'LU': 9, 'LV': 2, 'MT': 2, 'MX': 2, 'NL': 190, 'NO': 20, 'NZ': 1, 'PL': 61, 'PT': 6, 'QA': 1, 'RO': 10, 'RU': 3, 'SE': 22, 'SG': 2, 'SI': 12, 'SK': 7, 'SX': 1, 'TH': 2, 'TR': 1, 'TW': 1, 'UA': 3, 'US': 52, 'ZA': 3}","{'normal': 1928, 'sponsor': 594, 'supersponsor': 305}","{'animator': 852, 'artist': 1244, 'fursuiter': 1391, 'musician': 879}"
02/27/2024,True,2024-02-27T23:47:09.095+00:00,2024-02-27T23:47:09.095+00:00,2024,EF28,2891,"{'18': 26, '19': 55, '20': 93, '21': 102, '22': 138, '23': 173, '24': 166, '25': 178, '26': 164, '27': 180, '28': 141, '29': 150, '30': 143, '31': 136, '32': 122, '33': 116, '34': 97, '35': 99, '36': 94, '37': 78, '38': 65, '39': 51, '40': 46, '41': 54, '42': 22, '43': 15, '44': 24, '45': 20, '46': 18, '47': 21, '48': 11, '49': 15, '50': 11, '51': 8, '52': 6, '53': 7, '54': 3, '55': 8, '56': 5, '57': 4, '58': 2, '59': 6, '60': 4, '62': 4, '63': 2, '64': 1, '68': 1, '69': 2, '70': 1, '71': 1, '89': 1, '119': 1}",{},"{'new': 5, 'approved': 562, 'partially paid': 6, 'paid': 2318}","{'XS': 7, 'S': 93, 'M': 461, 'L': 519, 'XL': 340, 'XXL': 207}","{'AL': 1, 'AT': 121, 'AU': 8, 'BE': 39, 'BG': 3, 'BR': 3, 'BS': 1, 'CA': 11, 'CH': 81, 'CL': 1, 'CO': 1, 'CY': 1, 'CZ': 35, 'DE': 1709, 'DK': 44, 'EE': 4, 'ES': 47, 'FI': 37, 'FR': 62, 'GB': 150, 'GE': 1, 'GG': 1, 'GR': 1, 'HK': 1, 'HU': 31, 'IE': 28, 'IL': 6, 'IM': 1, 'IS': 4, 'IT': 30, 'LT': 3, 'LU': 9, 'LV': 4, 'MT': 2, 'MX': 2, 'NL': 194, 'NO': 20, 'NZ': 1, 'PL': 62, 'PT': 7, 'QA': 1, 'RO': 10, 'RU': 4, 'SE': 23, 'SG': 2, 'SI': 12, 'SK': 7, 'SX': 1, 'TH': 2, 'TR': 1, 'TW': 1, 'UA': 3, 'US': 54, 'ZA': 3}","{'normal': 1974, 'sponsor': 604, 'supersponsor': 310}","{'animator': 866, 'artist': 1268, 'fursuiter': 1420, 'musician': 898}"
02/28/2024,True,2024-02-28T23:47:18.714+00:00,2024-02-28T23:47:18.714+00:00,2024,EF28,3000,"{'18': 28, '19': 57, '20': 100, '21': 108, '22': 140, '23': 182, '24': 172, '25': 186, '26': 175, '27': 185, '28': 148, '29': 160, '30': 144, '31': 137, '32': 126, '33': 120, '34': 104, '35': 102, '36': 100, '37': 80, '38': 67, '39': 51, '40': 46, '41': 56, '42': 23, '43': 15, '44': 24, '45': 21, '46': 18, '47': 21, '48': 11, '49': 15, '50': 11, '51': 8, '52': 6, '53': 7, '54': 3, '55': 8, '56': 5, '57': 4, '58': 2, '59': 6, '60': 4, '62': 4, '63': 2, '64': 1, '68': 1, '69': 2, '70': 1, '71': 1, '89': 1, '119': 1}",{},"{'new': 3, 'approved': 577, 'partially paid': 6, 'paid': 2414}","{'XS': 7, 'S': 97, 'M': 479, 'L': 536, 'XL': 350, 'XXL': 214}","{'AL': 1, 'AT': 125, 'AU': 8, 'BE': 46, 'BG': 3, 'BR': 4, 'BS': 1, 'CA': 11, 'CH': 87, 'CL': 1, 'CO': 1, 'CY': 1, 'CZ': 35, 'DE': 1765, 'DK': 46, 'EE': 5, 'ES': 47, 'FI': 39, 'FR': 63, 'GB': 154, 'GE': 1, 'GG': 1, 'GR': 1, 'HK': 1, 'HU': 32, 'IE': 28, 'IL': 6, 'IM': 1, 'IS': 4, 'IT': 33, 'JP': 1, 'LT': 3, 'LU': 10, 'LV': 4, 'MT': 2, 'MX': 2, 'MY': 1, 'NL': 204, 'NO': 22, 'NZ': 1, 'PL': 64, 'PT': 8, 'QA': 1, 'RO': 10, 'RU': 4, 'SE': 23, 'SG': 2, 'SI': 12, 'SK': 7, 'SX': 1, 'TH': 2, 'TR': 1, 'TW': 1, 'UA': 3, 'US': 57, 'ZA': 3}","{'normal': 2054, 'sponsor': 627, 'supersponsor': 316}","{'animator': 897, 'artist': 1310, 'fursuiter': 1471, 'musician': 935}"
02/29/2024,True,2024-02-29T23:47:12.820+00:00,2024-02-29T23:47:12.820+00:00,2024,EF28,3177,"{'18': 28, '19': 66, '20': 104, '21': 117, '22': 151, '23': 199, '24': 182, '25': 193, '26': 182, '27': 198, '28': 160, '29': 170, '30': 157, '31': 142, '32': 134, '33': 126, '34': 112, '35': 107, '36': 103, '37': 87, '38': 70, '39': 53, '40': 50, '41': 56, '42': 25, '43': 15, '44': 24, '45': 21, '46': 18, '47': 22, '48': 11, '49': 15, '50': 11, '51': 8, '52': 6, '53': 7, '54': 3, '55': 8, '56': 5, '57': 4, '58': 2, '59': 6, '60': 4, '62': 4, '63': 2, '64': 2, '68': 1, '69': 2, '70': 1, '71': 1, '89': 1, '119': 1}",{},"{'new': 1, 'approved': 565, 'partially paid': 6, 'paid': 2605}","{'XS': 7, 'S': 107, 'M': 505, 'L': 561, 'XL': 369, 'XXL': 221}","{'AL': 1, 'AT': 133, 'AU': 10, 'BE': 48, 'BG': 3, 'BR': 5, 'BS': 1, 'CA': 11, 'CH': 90, 'CL': 1, 'CO': 1, 'CY': 1, 'CZ': 37, 'DE': 1857, 'DK': 53, 'EE': 5, 'ES': 53, 'FI': 46, 'FR': 65, 'GB': 158, 'GE': 1, 'GG': 2, 'GR': 1, 'HK': 1, 'HR': 2, 'HU': 33, 'IE': 28, 'IL': 6, 'IM': 1, 'IS': 5, 'IT': 34, 'JP': 2, 'LT': 3, 'LU': 11, 'LV': 4, 'MT': 2, 'MX': 2, 'MY': 1, 'NL': 213, 'NO': 28, 'NZ': 1, 'PL': 70, 'PT': 8, 'QA': 1, 'RO': 10, 'RU': 4, 'SE': 24, 'SG': 2, 'SI': 13, 'SK': 8, 'SX': 1, 'TH': 2, 'TR': 1, 'TW': 1, 'UA': 3, 'US': 65, 'ZA': 4}","{'normal': 2194, 'sponsor': 651, 'supersponsor': 329}","{'animator': 960, 'artist': 1401, 'fursuiter': 1568, 'musician': 1015}"
03/01/2024,True,2024-03-01T23:47:11.600+00:00,2024-03-01T23:47:11.600+00:00,2024,EF28,3207,"{'18': 28, '19': 66, '20': 103, '21': 122, '22': 153, '23': 201, '24': 182, '25': 195, '26': 183, '27': 201, '28': 163, '29': 172, '30': 160, '31': 142, '32': 135, '33': 126, '34': 112, '35': 109, '36': 104, '37': 88, '38': 70, '39': 53, '40': 50, '41': 56, '42': 25, '43': 15, '44': 24, '45': 21, '46': 18, '47': 22, '48': 12, '49': 15, '50': 11, '51': 8, '52': 6, '53': 7, '54': 3, '55': 8, '56': 6, '57': 4, '58': 2, '59': 6, '60': 4, '62': 4, '63': 2, '64': 2, '68': 1, '69': 2, '70': 1, '71': 1, '74': 1, '89': 1, '119': 1}",{},"{'approved': 520, 'partially paid': 6, 'paid': 2681}","{'XS': 7, 'S': 108, 'M': 505, 'L': 564, 'XL': 372, 'XXL': 223}","{'AL': 1, 'AT': 133, 'AU': 10, 'BE': 48, 'BG': 4, 'BR': 5, 'BS': 1, 'CA': 11, 'CH': 90, 'CL': 1, 'CO': 1, 'CY': 1, 'CZ': 37, 'DE': 1871, 'DK': 53, 'EE': 5, 'ES': 53, 'FI': 48, 'FR': 67, 'GB': 162, 'GE': 1, 'GG': 2, 'GR': 1, 'HK': 1, 'HR': 2, 'HU': 33, 'IE': 28, 'IL': 8, 'IM': 1, 'IS': 5, 'IT': 34, 'JP': 2, 'LT': 3, 'LU': 11, 'LV': 4, 'MT': 2, 'MX': 2, 'MY': 1, 'NL': 215, 'NO': 27, 'NZ': 1, 'PL': 70, 'PT': 8, 'QA': 1, 'RO': 10, 'RU': 4, 'SE': 28, 'SG': 2, 'SI': 13, 'SK': 8, 'SX': 1, 'TH': 2, 'TR': 1, 'TW': 1, 'UA': 3, 'US': 65, 'ZA': 4}","{'normal': 2216, 'sponsor': 655, 'supersponsor': 331}","{'animator': 969, 'artist': 1415, 'fursuiter': 1581, 'musician': 1027}"
03/02/2024,True,2024-03-02T23:47:02.035+00:00,2024-03-02T23:47:02.035+00:00,2024,EF28,3229,"{'18': 30, '19': 67, '20': 104, '21': 122, '22': 155, '23': 201, '24': 183, '25': 196, '26': 183, '27': 202, '28': 165, '29': 172, '30': 162, '31': 143, '32': 136, '33': 127, '34': 112, '35': 109, '36': 106, '37': 88, '38': 70, '39': 55, '40': 50, '41': 56, '42': 25, '43': 15, '44': 24, '45': 21, '46': 18, '47': 22, '48': 12, '49': 15, '50': 11, '51': 8, '52': 7, '53': 8, '54': 3, '55': 8, '56': 6, '57': 4, '58': 2, '59': 6, '60': 4, '62': 4, '63': 2, '64': 2, '68': 1, '69': 2, '70': 1, '71': 1, '74': 1, '89': 1, '119': 1}",{},"{'new': 1, 'approved': 520, 'partially paid': 6, 'paid': 2702}","{'XS': 7, 'S': 108, 'M': 507, 'L': 567, 'XL': 374, 'XXL': 225}","{'AL': 1, 'AT': 134, 'AU': 10, 'BE': 50, 'BG': 4, 'BR': 5, 'BS': 1, 'CA': 11, 'CH': 91, 'CL': 1, 'CO': 1, 'CY': 1, 'CZ': 37, 'DE': 1879, 'DK': 53, 'EE': 5, 'ES': 55, 'FI': 50, 'FR': 69, 'GB': 162, 'GE': 1, 'GG': 2, 'GR': 1, 'HK': 1, 'HR': 2, 'HU': 34, 'IE': 28, 'IL': 8, 'IM': 1, 'IS': 5, 'IT': 34, 'JP': 2, 'LT': 3, 'LU': 12, 'LV': 4, 'MT': 2, 'MX': 3, 'MY': 1, 'NL': 215, 'NO': 27, 'NZ': 1, 'PL': 70, 'PT': 8, 'QA': 1, 'RO': 10, 'RU': 4, 'SE': 28, 'SG': 2, 'SI': 13, 'SK': 8, 'SX': 1, 'TH': 2, 'TR': 1, 'TW': 1, 'UA': 3, 'US': 66, 'ZA': 4}","{'normal': 2229, 'sponsor': 663, 'supersponsor': 332}","{'animator': 972, 'artist': 1423, 'fursuiter': 1591, 'musician': 1030}"
03/03/2024,True,2024-03-03T23:47:07.100+00:00,2024-03-03T23:47:07.100+00:00,2024,EF28,3252,"{'18': 31, '19': 69, '20': 105, '21': 125, '22': 155, '23': 201, '24': 185, '25': 197, '26': 185, '27': 204, '28': 166, '29': 173, '30': 164, '31': 143, '32': 136, '33': 128, '34': 112, '35': 109, '36': 108, '37': 89, '38': 70, '39': 56, '40': 50, '41': 56, '42': 25, '43': 15, '44': 24, '45': 21, '46': 18, '47': 22, '48': 12, '49': 15, '50': 11, '51': 8, '52': 7, '53': 8, '54': 3, '55': 8, '56': 6, '57': 4, '58': 2, '59': 6, '60': 4, '62': 4, '63': 2, '64': 2, '68': 1, '69': 2, '70': 1, '71': 1, '74': 1, '89': 1, '119': 1}",{},"{'new': 2, 'approved': 515, 'partially paid': 6, 'paid': 2729}","{'XS': 7, 'S': 108, 'M': 509, 'L': 569, 'XL': 376, 'XXL': 225}","{'AL': 1, 'AT': 134, 'AU': 11, 'BE': 51, 'BG': 4, 'BR': 5, 'BS': 1, 'CA': 11, 'CH': 91, 'CL': 1, 'CO': 1, 'CY': 1, 'CZ': 37, 'DE': 1885, 'DK': 54, 'EE': 5, 'ES': 56, 'FI': 52, 'FR': 69, 'GB': 168, 'GE': 1, 'GG': 2, 'GR': 1, 'HK': 1, 'HR': 2, 'HU': 34, 'IE': 28, 'IL': 8, 'IM': 1, 'IS': 5, 'IT': 34, 'JP': 2, 'LT': 3, 'LU': 12, 'LV': 4, 'MT': 2, 'MX': 3, 'MY': 1, 'NL': 217, 'NO': 28, 'NZ': 1, 'PL': 71, 'PT': 8, 'QA': 1, 'RO': 10, 'RU': 4, 'SE': 29, 'SG': 2, 'SI': 13, 'SK': 8, 'SX': 1, 'TH': 2, 'TR': 1, 'TW': 1, 'UA': 3, 'US': 66, 'ZA': 4}","{'normal': 2250, 'sponsor': 664, 'supersponsor': 333}","{'animator': 980, 'artist': 1432, 'fursuiter': 1600, 'musician': 1039}"
03/04/2024,True,2024-03-04T23:47:42.130+00:00,2024-03-04T23:47:42.130+00:00,2024,EF28,3163,"{'18': 34, '19': 64, '20': 100, '21': 119, '22': 151, '23': 191, '24': 181, '25': 195, '26': 180, '27': 195, '28': 161, '29': 167, '30': 163, '31': 138, '32': 128, '33': 126, '34': 108, '35': 107, '36': 107, '37': 88, '38': 67, '39': 55, '40': 49, '41': 55, '42': 24, '43': 15, '44': 26, '45': 21, '46': 18, '47': 22, '48': 12, '49': 15, '50': 10, '51': 8, '52': 7, '53': 8, '54': 3, '55': 8, '56': 6, '57': 4, '58': 2, '59': 6, '60': 4, '62': 4, '63': 2, '64': 2, '68': 1, '69': 2, '70': 1, '71': 1, '74': 1, '89': 1}",{},"{'approved': 385, 'partially paid': 7, 'paid': 2771}","{'XS': 7, 'S': 105, 'M': 499, 'L': 556, 'XL': 368, 'XXL': 217}","{'AT': 132, 'AU': 11, 'BE': 48, 'BG': 4, 'BR': 5, 'BS': 1, 'CA': 11, 'CH': 88, 'CL': 1, 'CO': 1, 'CY': 1, 'CZ': 34, 'DE': 1840, 'DK': 52, 'EE': 5, 'ES': 56, 'FI': 50, 'FR': 69, 'GB': 163, 'GE': 1, 'GG': 2, 'GR': 1, 'HK': 1, 'HR': 2, 'HU': 33, 'IE': 27, 'IL': 8, 'IM': 1, 'IS': 5, 'IT': 32, 'JP': 2, 'LT': 3, 'LU': 12, 'LV': 4, 'MT': 2, 'MX': 3, 'MY': 1, 'NL': 212, 'NO': 26, 'NZ': 1, 'PL': 70, 'PT': 7, 'QA': 1, 'RO': 10, 'RU': 2, 'SE': 27, 'SG': 2, 'SI': 11, 'SK': 5, 'SX': 1, 'TH': 2, 'TR': 1, 'TW': 1, 'UA': 3, 'US': 64, 'ZA': 5}","{'normal': 2185, 'sponsor': 648, 'supersponsor': 325}","{'animator': 953, 'artist': 1393, 'fursuiter': 1545, 'musician': 1014}"
03/05/2024,True,2024-03-05T23:47:03.476+00:00,2024-03-05T23:47:03.476+00:00,2024,EF28,3180,"{'18': 35, '19': 65, '20': 100, '21': 120, '22': 152, '23': 191, '24': 182, '25': 198, '26': 180, '27': 197, '28': 163, '29': 167, '30': 164, '31': 141, '32': 128, '33': 126, '34': 108, '35': 107, '36': 107, '37': 88, '38': 67, '39': 55, '40': 49, '41': 55, '42': 25, '43': 15, '44': 26, '45': 21, '46': 18, '47': 22, '48': 12, '49': 15, '50': 10, '51': 8, '52': 7, '53': 8, '54': 3, '55': 8, '56': 6, '57': 4, '58': 2, '59': 6, '60': 4, '62': 4, '63': 2, '64': 2, '68': 1, '69': 2, '70': 1, '71': 1, '74': 1, '89': 1}",{},"{'approved': 367, 'partially paid': 11, 'paid': 2802}","{'XS': 7, 'S': 107, 'M': 504, 'L': 557, 'XL': 369, 'XXL': 219}","{'AT': 132, 'AU': 11, 'BE': 48, 'BG': 4, 'BR': 5, 'BS': 1, 'CA': 11, 'CH': 88, 'CL': 1, 'CO': 1, 'CY': 1, 'CZ': 34, 'DE': 1847, 'DK': 52, 'EE': 6, 'ES': 56, 'FI': 50, 'FR': 74, 'GB': 164, 'GE': 1, 'GG': 2, 'GR': 1, 'HK': 1, 'HR': 2, 'HU': 33, 'IE': 29, 'IL': 8, 'IM': 1, 'IS': 5, 'IT': 32, 'JP': 2, 'LT': 3, 'LU': 12, 'LV': 4, 'MT': 2, 'MX': 3, 'MY': 1, 'NL': 212, 'NO': 27, 'NZ': 1, 'PL': 69, 'PT': 7, 'QA': 1, 'RO': 10, 'RU': 2, 'SE': 28, 'SG': 2, 'SI': 11, 'SK': 5, 'SX': 1, 'TH': 2, 'TR': 1, 'TW': 1, 'UA': 3, 'US': 64, 'ZA': 5}","{'normal': 2197, 'sponsor': 653, 'supersponsor': 325}","{'animator': 959, 'artist': 1400, 'fursuiter': 1554, 'musician': 1020}"
03/06/2024,True,2024-03-06T23:47:09.099+00:00,2024-03-06T23:47:09.099+00:00,2024,EF28,3199,"{'18': 36, '19': 65, '20': 101, '21': 120, '22': 153, '23': 193, '24': 183, '25': 200, '26': 182, '27': 198, '28': 165, '29': 169, '30': 165, '31': 141, '32': 128, '33': 126, '34': 108, '35': 108, '36': 107, '37': 88, '38': 68, '39': 55, '40': 49, '41': 55, '42': 25, '43': 15, '44': 26, '45': 21, '46': 19, '47': 22, '48': 12, '49': 15, '50': 10, '51': 8, '52': 7, '53': 8, '54': 3, '55': 8, '56': 6, '57': 4, '58': 2, '59': 6, '60': 4, '62': 4, '63': 2, '64': 2, '68': 1, '69': 2, '70': 1, '71': 1, '74': 1, '89': 1}",{},"{'new': 2, 'approved': 365, 'partially paid': 13, 'paid': 2819}","{'XS': 7, 'S': 107, 'M': 506, 'L': 560, 'XL': 371, 'XXL': 220}","{'AT': 132, 'AU': 11, 'BE': 48, 'BG': 4, 'BR': 5, 'BS': 1, 'CA': 11, 'CH': 88, 'CL': 1, 'CO': 1, 'CY': 1, 'CZ': 34, 'DE': 1862, 'DK': 52, 'EE': 6, 'ES': 56, 'FI': 50, 'FR': 75, 'GB': 164, 'GE': 1, 'GG': 2, 'GR': 1, 'HK': 1, 'HR': 2, 'HU': 33, 'IE': 30, 'IL': 9, 'IM': 1, 'IS': 5, 'IT': 32, 'JP': 2, 'LT': 3, 'LU': 12, 'LV': 4, 'MT': 2, 'MX': 3, 'MY': 1, 'NL': 212, 'NO': 27, 'NZ': 1, 'PL': 69, 'PT': 7, 'QA': 1, 'RO': 10, 'RU': 2, 'SE': 28, 'SG': 2, 'SI': 11, 'SK': 5, 'SX': 1, 'TH': 2, 'TR': 1, 'TW': 1, 'UA': 3, 'US': 65, 'ZA': 5}","{'normal': 2209, 'sponsor': 657, 'supersponsor': 328}","{'animator': 965, 'artist': 1407, 'fursuiter': 1565, 'musician': 1026}"
03/07/2024,True,2024-03-07T23:48:34.748+00:00,2024-03-07T23:48:34.748+00:00,2024,EF28,3210,"{'18': 36, '19': 65, '20': 103, '21': 120, '22': 154, '23': 194, '24': 184, '25': 200, '26': 182, '27': 198, '28': 165, '29': 169, '30': 165, '31': 141, '32': 130, '33': 127, '34': 108, '35': 108, '36': 108, '37': 89, '38': 68, '39': 56, '40': 49, '41': 55, '42': 25, '43': 15, '44': 26, '45': 21, '46': 19, '47': 22, '48': 12, '49': 15, '50': 10, '51': 8, '52': 7, '53': 8, '54': 3, '55': 8, '56': 6, '57': 4, '58': 2, '59': 6, '60': 4, '62': 4, '63': 2, '64': 2, '68': 1, '69': 2, '70': 1, '71': 1, '74': 1, '89': 1}",{},"{'new': 1, 'approved': 354, 'partially paid': 14, 'paid': 2841}","{'XS': 7, 'S': 108, 'M': 506, 'L': 564, 'XL': 371, 'XXL': 220}","{'AT': 132, 'AU': 11, 'BE': 49, 'BG': 4, 'BR': 5, 'BS': 1, 'CA': 11, 'CH': 88, 'CL': 1, 'CO': 1, 'CY': 1, 'CZ': 34, 'DE': 1867, 'DK': 54, 'EE': 6, 'ES': 56, 'FI': 50, 'FR': 75, 'GB': 166, 'GE': 1, 'GG': 2, 'GR': 1, 'HK': 1, 'HR': 2, 'HU': 33, 'IE': 30, 'IL': 9, 'IM': 1, 'IS': 5, 'IT': 32, 'JP': 2, 'LT': 3, 'LU': 12, 'LV': 4, 'MT': 2, 'MX': 3, 'MY': 1, 'NL': 212, 'NO': 27, 'NZ': 1, 'PL': 69, 'PT': 7, 'QA': 1, 'RO': 10, 'RU': 2, 'SE': 29, 'SG': 2, 'SI': 11, 'SK': 5, 'SX': 1, 'TH': 2, 'TR': 1, 'TW': 1, 'UA': 3, 'US': 65, 'ZA': 5}","{'normal': 2215, 'sponsor': 662, 'supersponsor': 328}","{'animator': 970, 'artist': 1414, 'fursuiter': 1568, 'musician': 1030}"
03/08/2024,True,2024-03-08T23:48:55.896+00:00,2024-03-08T23:48:55.896+00:00,2024,EF28,3225,"{'18': 36, '19': 66, '20': 104, '21': 121, '22': 158, '23': 194, '24': 185, '25': 200, '26': 182, '27': 199, '28': 165, '29': 169, '30': 166, '31': 142, '32': 131, '33': 128, '34': 108, '35': 109, '36': 108, '37': 89, '38': 68, '39': 56, '40': 49, '41': 55, '42': 25, '43': 16, '44': 26, '45': 21, '46': 19, '47': 22, '48': 12, '49': 15, '50': 10, '51': 8, '52': 7, '53': 8, '54': 3, '55': 8, '56': 6, '57': 4, '58': 2, '59': 6, '60': 4, '62': 4, '63': 2, '64': 2, '68': 1, '69': 2, '70': 1, '71': 1, '74': 1, '89': 1}",{},"{'approved': 353, 'partially paid': 13, 'paid': 2859}","{'XS': 7, 'S': 108, 'M': 508, 'L': 566, 'XL': 374, 'XXL': 220}","{'AT': 133, 'AU': 11, 'BE': 49, 'BG': 4, 'BR': 5, 'BS': 1, 'CA': 11, 'CH': 88, 'CL': 1, 'CO': 1, 'CY': 1, 'CZ': 35, 'DE': 1875, 'DK': 55, 'EE': 6, 'ES': 56, 'FI': 50, 'FR': 75, 'GB': 167, 'GE': 1, 'GG': 2, 'GR': 1, 'HK': 1, 'HR': 2, 'HU': 33, 'IE': 30, 'IL': 10, 'IM': 1, 'IS': 5, 'IT': 33, 'JP': 2, 'LT': 3, 'LU': 13, 'LV': 4, 'MT': 2, 'MX': 3, 'MY': 1, 'NL': 212, 'NO': 27, 'NZ': 1, 'PL': 69, 'PT': 7, 'QA': 1, 'RO': 10, 'RU': 2, 'SE': 29, 'SG': 2, 'SI': 11, 'SK': 5, 'SX': 1, 'TH': 2, 'TR': 1, 'TW': 1, 'UA': 3, 'US': 65, 'ZA': 5}","{'normal': 2226, 'sponsor': 665, 'supersponsor': 329}","{'animator': 977, 'artist': 1421, 'fursuiter': 1576, 'musician': 1038}"
03/09/2024,True,2024-03-09T23:48:08.600+00:00,2024-03-09T23:48:08.600+00:00,2024,EF28,3248,"{'18': 36, '19': 66, '20': 106, '21': 121, '22': 160, '23': 197, '24': 186, '25': 203, '26': 183, '27': 201, '28': 169, '29': 169, '30': 168, '31': 143, '32': 132, '33': 128, '34': 108, '35': 109, '36': 109, '37': 89, '38': 68, '39': 56, '40': 49, '41': 55, '42': 25, '43': 16, '44': 26, '45': 21, '46': 19, '47': 22, '48': 12, '49': 15, '50': 10, '51': 8, '52': 7, '53': 8, '54': 3, '55': 8, '56': 6, '57': 4, '58': 2, '59': 6, '60': 4, '62': 4, '63': 2, '64': 2, '68': 1, '69': 2, '70': 1, '71': 1, '74': 1, '89': 1}",{},"{'approved': 362, 'partially paid': 13, 'paid': 2873}","{'XS': 7, 'S': 108, 'M': 513, 'L': 569, 'XL': 379, 'XXL': 222}","{'AR': 1, 'AT': 135, 'AU': 11, 'BE': 49, 'BG': 4, 'BR': 5, 'BS': 1, 'CA': 11, 'CH': 89, 'CL': 1, 'CO': 1, 'CY': 1, 'CZ': 36, 'DE': 1882, 'DK': 58, 'EE': 6, 'ES': 56, 'FI': 50, 'FR': 75, 'GB': 169, 'GE': 1, 'GG': 2, 'GR': 1, 'HK': 1, 'HR': 2, 'HU': 33, 'IE': 31, 'IL': 10, 'IM': 1, 'IS': 5, 'IT': 34, 'JP': 2, 'LT': 3, 'LU': 14, 'LV': 5, 'MT': 2, 'MX': 3, 'MY': 1, 'NL': 213, 'NO': 28, 'NZ': 1, 'PL': 69, 'PT': 7, 'QA': 1, 'RO': 10, 'RU': 2, 'SE': 29, 'SG': 2, 'SI': 11, 'SK': 5, 'SX': 1, 'TH': 2, 'TR': 1, 'TW': 1, 'UA': 3, 'US': 65, 'ZA': 5}","{'normal': 2243, 'sponsor': 670, 'supersponsor': 330}","{'animator': 981, 'artist': 1429, 'fursuiter': 1588, 'musician': 1045}"
03/10/2024,True,2024-03-10T23:47:38.292+00:00,2024-03-10T23:47:38.292+00:00,2024,EF28,3258,"{'18': 36, '19': 66, '20': 109, '21': 120, '22': 162, '23': 197, '24': 186, '25': 204, '26': 183, '27': 201, '28': 171, '29': 169, '30': 168, '31': 143, '32': 132, '33': 128, '34': 109, '35': 109, '36': 109, '37': 89, '38': 69, '39': 56, '40': 50, '41': 55, '42': 25, '43': 16, '44': 26, '45': 21, '46': 19, '47': 22, '48': 12, '49': 15, '50': 10, '51': 8, '52': 7, '53': 8, '54': 3, '55': 8, '56': 6, '57': 4, '58': 2, '59': 6, '60': 4, '62': 4, '63': 2, '64': 2, '68': 1, '69': 2, '70': 1, '71': 1, '74': 1, '89': 1}",{},"{'approved': 356, 'partially paid': 13, 'paid': 2889}","{'XS': 7, 'S': 108, 'M': 513, 'L': 573, 'XL': 381, 'XXL': 222}","{'AR': 1, 'AT': 136, 'AU': 11, 'BE': 49, 'BG': 4, 'BR': 5, 'BS': 1, 'CA': 11, 'CH': 89, 'CL': 1, 'CO': 1, 'CY': 1, 'CZ': 36, 'DE': 1891, 'DK': 58, 'EE': 6, 'ES': 56, 'FI': 50, 'FR': 75, 'GB': 169, 'GE': 1, 'GG': 2, 'GR': 1, 'HK': 1, 'HR': 2, 'HU': 33, 'IE': 31, 'IL': 10, 'IM': 1, 'IS': 5, 'IT': 34, 'JP': 2, 'LT': 3, 'LU': 14, 'LV': 5, 'MT': 2, 'MX': 3, 'MY': 1, 'NL': 213, 'NO': 28, 'NZ': 1, 'PL': 69, 'PT': 7, 'QA': 1, 'RO': 10, 'RU': 2, 'SE': 29, 'SG': 2, 'SI': 11, 'SK': 5, 'SX': 1, 'TH': 2, 'TR': 1, 'TW': 1, 'UA': 3, 'US': 65, 'ZA': 5}","{'normal': 2251, 'sponsor': 672, 'supersponsor': 330}","{'animator': 984, 'artist': 1433, 'fursuiter': 1590, 'musician': 1048}"
03/11/2024,True,2024-03-11T23:47:24.876+00:00,2024-03-11T23:47:24.876+00:00,2024,EF28,3251,"{'18': 35, '19': 65, '20': 110, '21': 121, '22': 161, '23': 198, '24': 185, '25': 204, '26': 182, '27': 202, '28': 169, '29': 168, '30': 165, '31': 142, '32': 133, '33': 129, '34': 108, '35': 109, '36': 110, '37': 87, '38': 69, '39': 56, '40': 50, '41': 56, '42': 25, '43': 16, '44': 26, '45': 21, '46': 19, '47': 22, '48': 12, '49': 15, '50': 10, '51': 8, '52': 7, '53': 8, '54': 3, '55': 8, '56': 6, '57': 4, '58': 2, '59': 6, '60': 4, '62': 4, '63': 2, '64': 2, '68': 1, '69': 2, '70': 1, '71': 1, '74': 1, '89': 1}",{},"{'new': 2, 'approved': 322, 'partially paid': 14, 'paid': 2913}","{'XS': 7, 'S': 108, 'M': 512, 'L': 568, 'XL': 382, 'XXL': 221}","{'AR': 1, 'AT': 136, 'AU': 11, 'BE': 48, 'BG': 4, 'BR': 5, 'BS': 1, 'CA': 12, 'CH': 90, 'CL': 1, 'CO': 1, 'CY': 1, 'CZ': 35, 'DE': 1888, 'DK': 58, 'EE': 6, 'ES': 57, 'FI': 50, 'FR': 74, 'GB': 164, 'GE': 1, 'GG': 2, 'GR': 1, 'HK': 1, 'HR': 2, 'HU': 32, 'IE': 31, 'IL': 10, 'IM': 1, 'IS': 5, 'IT': 34, 'JP': 2, 'LT': 3, 'LU': 14, 'LV': 5, 'MT': 2, 'MX': 3, 'MY': 1, 'NL': 216, 'NO': 28, 'NZ': 1, 'PL': 67, 'PT': 7, 'QA': 1, 'RO': 10, 'RU': 1, 'SE': 29, 'SG': 2, 'SI': 11, 'SK': 5, 'SX': 1, 'TH': 2, 'TR': 1, 'TW': 1, 'UA': 3, 'US': 67, 'ZA': 5}","{'normal': 2246, 'sponsor': 670, 'supersponsor': 330}","{'animator': 983, 'artist': 1428, 'fursuiter': 1589, 'musician': 1049}"
03/12/2024,True,2024-03-12T23:48:38.762+00:00,2024-03-12T23:48:38.762+00:00,2024,EF28,3264,"{'18': 36, '19': 65, '20': 110, '21': 121, '22': 162, '23': 199, '24': 187, '25': 206, '26': 183, '27': 202, '28': 170, '29': 169, '30': 168, '31': 143, '32': 133, '33': 129, '34': 107, '35': 109, '36': 110, '37': 87, '38': 69, '39': 56, '40': 50, '41': 57, '42': 25, '43': 16, '44': 26, '45': 20, '46': 19, '47': 22, '48': 12, '49': 15, '50': 10, '51': 8, '52': 7, '53': 8, '54': 3, '55': 8, '56': 6, '57': 4, '58': 2, '59': 6, '60': 4, '62': 4, '63': 2, '64': 2, '68': 1, '69': 2, '70': 1, '71': 1, '74': 1, '89': 1}",{},"{'approved': 314, 'partially paid': 145, 'paid': 2805}","{'XS': 7, 'S': 108, 'M': 515, 'L': 572, 'XL': 384, 'XXL': 222}","{'AR': 1, 'AT': 136, 'AU': 11, 'BE': 48, 'BG': 4, 'BR': 5, 'BS': 1, 'CA': 12, 'CH': 91, 'CL': 1, 'CO': 1, 'CY': 1, 'CZ': 35, 'DE': 1897, 'DK': 58, 'EE': 6, 'ES': 57, 'FI': 50, 'FR': 74, 'GB': 163, 'GE': 1, 'GG': 2, 'GR': 1, 'HK': 1, 'HR': 2, 'HU': 33, 'IE': 31, 'IL': 10, 'IM': 1, 'IS': 5, 'IT': 34, 'JP': 2, 'LT': 3, 'LU': 14, 'LV': 5, 'MT': 2, 'MX': 3, 'MY': 1, 'NL': 218, 'NO': 28, 'NZ': 1, 'PL': 67, 'PT': 7, 'QA': 1, 'RO': 10, 'RU': 1, 'SE': 30, 'SG': 2, 'SI': 11, 'SK': 5, 'SX': 1, 'TH': 2, 'TR': 1, 'TW': 1, 'UA': 3, 'US': 67, 'ZA': 5}","{'normal': 2253, 'sponsor': 672, 'supersponsor': 334}","{'animator': 984, 'artist': 1431, 'fursuiter': 1594, 'musician': 1051}"
03/13/2024,True,2024-03-13T23:47:33.338+00:00,2024-03-13T23:47:33.338+00:00,2024,EF28,3277,"{'18': 38, '19': 66, '20': 112, '21': 121, '22': 163, '23': 200, '24': 188, '25': 206, '26': 183, '27': 202, '28': 171, '29': 171, '30': 170, '31': 143, '32': 133, '33': 129, '34': 107, '35': 109, '36': 110, '37': 87, '38': 69, '39': 56, '40': 50, '41': 57, '42': 25, '43': 16, '44': 26, '45': 20, '46': 19, '47': 22, '48': 12, '49': 15, '50': 10, '51': 8, '52': 7, '53': 8, '54': 3, '55': 8, '56': 6, '57': 4, '58': 2, '59': 6, '60': 4, '62': 4, '63': 2, '64': 2, '68': 1, '69': 2, '70': 1, '71': 1, '74': 1, '89': 1}",{},"{'new': 6, 'approved': 305, 'partially paid': 118, 'paid': 2848}","{'XS': 7, 'S': 107, 'M': 520, 'L': 574, 'XL': 385, 'XXL': 222}","{'AR': 1, 'AT': 137, 'AU': 11, 'BE': 49, 'BG': 4, 'BR': 5, 'BS': 1, 'CA': 12, 'CH': 91, 'CL': 1, 'CO': 1, 'CY': 1, 'CZ': 36, 'DE': 1900, 'DK': 58, 'EE': 6, 'ES': 58, 'FI': 50, 'FR': 74, 'GB': 165, 'GE': 1, 'GG': 2, 'GR': 1, 'HK': 1, 'HR': 2, 'HU': 33, 'IE': 31, 'IL': 11, 'IM': 1, 'IS': 5, 'IT': 34, 'JP': 2, 'LT': 4, 'LU': 14, 'LV': 5, 'MT': 2, 'MX': 3, 'MY': 1, 'NL': 220, 'NO': 28, 'NZ': 1, 'PL': 67, 'PT': 7, 'QA': 1, 'RO': 10, 'RU': 1, 'SE': 30, 'SG': 2, 'SI': 11, 'SK': 5, 'SX': 1, 'TH': 2, 'TR': 1, 'TW': 1, 'UA': 3, 'US': 67, 'ZA': 5}","{'normal': 2263, 'sponsor': 674, 'supersponsor': 335}","{'animator': 988, 'artist': 1434, 'fursuiter': 1598, 'musician': 1057}"
03/14/2024,True,2024-03-14T23:47:22.216+00:00,2024-03-14T23:47:22.216+00:00,2024,EF28,3282,"{'18': 39, '19': 66, '20': 112, '21': 121, '22': 163, '23': 200, '24': 188, '25': 207, '26': 183, '27': 203, '28': 171, '29': 171, '30': 171, '31': 144, '32': 133, '33': 129, '34': 107, '35': 109, '36': 110, '37': 87, '38': 69, '39': 56, '40': 50, '41': 57, '42': 25, '43': 16, '44': 26, '45': 20, '46': 19, '47': 22, '48': 12, '49': 15, '50': 10, '51': 8, '52': 7, '53': 8, '54': 3, '55': 8, '56': 6, '57': 4, '58': 2, '59': 6, '60': 4, '62': 4, '63': 2, '64': 2, '68': 1, '69': 2, '70': 1, '71': 1, '74': 1, '89': 1}",{},"{'new': 1, 'approved': 294, 'partially paid': 98, 'paid': 2889}","{'XS': 7, 'S': 108, 'M': 521, 'L': 574, 'XL': 385, 'XXL': 222}","{'AR': 1, 'AT': 137, 'AU': 11, 'BE': 49, 'BG': 4, 'BR': 5, 'BS': 1, 'CA': 13, 'CH': 91, 'CL': 1, 'CO': 1, 'CY': 1, 'CZ': 37, 'DE': 1902, 'DK': 58, 'EE': 6, 'ES': 58, 'FI': 50, 'FR': 74, 'GB': 165, 'GE': 1, 'GG': 2, 'GR': 1, 'HK': 1, 'HR': 2, 'HU': 33, 'IE': 31, 'IL': 11, 'IM': 1, 'IS': 5, 'IT': 34, 'JP': 2, 'LT': 4, 'LU': 14, 'LV': 5, 'MT': 2, 'MX': 3, 'MY': 1, 'NL': 220, 'NO': 29, 'NZ': 1, 'PL': 67, 'PT': 7, 'QA': 1, 'RO': 10, 'RU': 1, 'SE': 30, 'SG': 2, 'SI': 11, 'SK': 5, 'SX': 1, 'TH': 2, 'TR': 1, 'TW': 1, 'UA': 3, 'US': 67, 'ZA': 5}","{'normal': 2268, 'sponsor': 673, 'supersponsor': 336}","{'animator': 989, 'artist': 1437, 'fursuiter': 1599, 'musician': 1059}"
03/15/2024,True,2024-03-15T23:47:07.729+00:00,2024-03-15T23:47:07.729+00:00,2024,EF28,3287,"{'18': 39, '19': 66, '20': 113, '21': 121, '22': 164, '23': 200, '24': 188, '25': 208, '26': 184, '27': 203, '28': 172, '29': 171, '30': 171, '31': 144, '32': 133, '33': 129, '34': 107, '35': 109, '36': 110, '37': 87, '38': 69, '39': 56, '40': 50, '41': 57, '42': 25, '43': 16, '44': 26, '45': 20, '46': 19, '47': 22, '48': 12, '49': 15, '50': 10, '51': 8, '52': 7, '53': 8, '54': 3, '55': 8, '56': 6, '57': 4, '58': 2, '59': 6, '60': 4, '62': 4, '63': 2, '64': 2, '68': 1, '69': 2, '70': 1, '71': 1, '74': 1, '89': 1}",{},"{'approved': 281, 'partially paid': 89, 'paid': 2917}","{'XS': 7, 'S': 109, 'M': 522, 'L': 574, 'XL': 385, 'XXL': 222}","{'AR': 1, 'AT': 137, 'AU': 11, 'BE': 49, 'BG': 4, 'BR': 6, 'BS': 1, 'CA': 13, 'CH': 91, 'CL': 1, 'CO': 1, 'CY': 1, 'CZ': 37, 'DE': 1903, 'DK': 58, 'EE': 6, 'ES': 58, 'FI': 50, 'FR': 74, 'GB': 165, 'GE': 1, 'GG': 2, 'GR': 1, 'HK': 1, 'HR': 2, 'HU': 33, 'IE': 31, 'IL': 11, 'IM': 1, 'IS': 5, 'IT': 34, 'JP': 2, 'LT': 4, 'LU': 14, 'LV': 5, 'MT': 2, 'MX': 3, 'MY': 1, 'NL': 221, 'NO': 30, 'NZ': 1, 'PL': 68, 'PT': 7, 'QA': 1, 'RO': 10, 'RU': 1, 'SE': 30, 'SG': 2, 'SI': 11, 'SK': 5, 'SX': 1, 'TH': 2, 'TR': 1, 'TW': 1, 'UA': 3, 'US': 67, 'ZA': 5}","{'normal': 2273, 'sponsor': 673, 'supersponsor': 336}","{'animator': 989, 'artist': 1438, 'fursuiter': 1600, 'musician': 1059}"
03/16/2024,True,2024-03-16T23:47:18.723+00:00,2024-03-16T23:47:18.723+00:00,2024,EF28,3301,"{'18': 39, '19': 67, '20': 113, '21': 124, '22': 165, '23': 200, '24': 189, '25': 210, '26': 185, '27': 205, '28': 173, '29': 172, '30': 171, '31': 145, '32': 133, '33': 129, '34': 107, '35': 109, '36': 110, '37': 87, '38': 69, '39': 56, '40': 50, '41': 57, '42': 25, '43': 16, '44': 26, '45': 20, '46': 19, '47': 22, '48': 12, '49': 15, '50': 10, '51': 8, '52': 7, '53': 8, '54': 3, '55': 8, '56': 6, '57': 4, '58': 2, '59': 6, '60': 4, '62': 4, '63': 2, '64': 2, '68': 1, '69': 2, '70': 1, '71': 1, '74': 1, '89': 1}",{},"{'approved': 285, 'partially paid': 83, 'paid': 2933}","{'XS': 7, 'S': 109, 'M': 523, 'L': 578, 'XL': 385, 'XXL': 222}","{'AR': 1, 'AT': 137, 'AU': 11, 'BE': 50, 'BG': 4, 'BR': 6, 'BS': 1, 'CA': 13, 'CH': 91, 'CL': 1, 'CO': 1, 'CY': 1, 'CZ': 37, 'DE': 1908, 'DK': 60, 'EE': 6, 'ES': 58, 'FI': 50, 'FR': 74, 'GB': 166, 'GE': 1, 'GG': 2, 'GR': 1, 'HK': 1, 'HR': 2, 'HU': 33, 'ID': 1, 'IE': 31, 'IL': 11, 'IM': 1, 'IS': 5, 'IT': 34, 'JP': 2, 'LT': 4, 'LU': 14, 'LV': 5, 'MT': 2, 'MX': 3, 'MY': 1, 'NL': 223, 'NO': 30, 'NZ': 1, 'PL': 68, 'PT': 7, 'QA': 1, 'RO': 10, 'RU': 1, 'SE': 30, 'SG': 2, 'SI': 11, 'SK': 5, 'SX': 1, 'TH': 2, 'TR': 1, 'TW': 1, 'UA': 3, 'US': 69, 'ZA': 5}","{'normal': 2286, 'sponsor': 674, 'supersponsor': 336}","{'animator': 992, 'artist': 1443, 'fursuiter': 1608, 'musician': 1061}"
03/17/2024,True,2024-03-17T23:47:51.005+00:00,2024-03-17T23:47:51.005+00:00,2024,EF28,3314,"{'18': 39, '19': 67, '20': 113, '21': 125, '22': 166, '23': 201, '24': 189, '25': 210, '26': 186, '27': 206, '28': 173, '29': 172, '30': 171, '31': 147, '32': 135, '33': 130, '34': 107, '35': 109, '36': 111, '37': 88, '38': 69, '39': 56, '40': 51, '41': 57, '42': 25, '43': 16, '44': 26, '45': 20, '46': 19, '47': 22, '48': 12, '49': 15, '50': 10, '51': 8, '52': 7, '53': 8, '54': 3, '55': 8, '56': 6, '57': 4, '58': 2, '59': 6, '60': 4, '62': 4, '63': 2, '64': 2, '68': 1, '69': 2, '70': 1, '71': 1, '74': 1, '89': 1}",{},"{'new': 3, 'approved': 284, 'partially paid': 79, 'paid': 2948}","{'XS': 7, 'S': 111, 'M': 527, 'L': 578, 'XL': 388, 'XXL': 222}","{'AR': 1, 'AT': 137, 'AU': 11, 'BE': 50, 'BG': 4, 'BR': 6, 'BS': 1, 'CA': 13, 'CH': 92, 'CL': 1, 'CO': 1, 'CY': 1, 'CZ': 37, 'DE': 1913, 'DK': 61, 'EE': 6, 'ES': 58, 'FI': 50, 'FR': 74, 'GB': 167, 'GE': 1, 'GG': 2, 'GR': 1, 'HK': 1, 'HR': 2, 'HU': 33, 'ID': 1, 'IE': 31, 'IL': 11, 'IM': 1, 'IS': 5, 'IT': 34, 'JP': 3, 'LT': 6, 'LU': 14, 'LV': 5, 'MT': 2, 'MX': 3, 'MY': 1, 'NL': 224, 'NO': 30, 'NZ': 1, 'PL': 68, 'PT': 7, 'QA': 1, 'RO': 10, 'RU': 1, 'SE': 31, 'SG': 2, 'SI': 11, 'SK': 5, 'SX': 1, 'TH': 2, 'TR': 1, 'TW': 1, 'UA': 3, 'US': 69, 'ZA': 5}","{'normal': 2292, 'sponsor': 680, 'supersponsor': 337}","{'animator': 996, 'artist': 1450, 'fursuiter': 1613, 'musician': 1065}"
03/18/2024,True,2024-03-18T23:47:18.540+00:00,2024-03-18T23:47:18.540+00:00,2024,EF28,3309,"{'18': 39, '19': 66, '20': 112, '21': 126, '22': 167, '23': 200, '24': 188, '25': 209, '26': 185, '27': 207, '28': 172, '29': 172, '30': 170, '31': 147, '32': 135, '33': 129, '34': 107, '35': 110, '36': 111, '37': 88, '38': 70, '39': 56, '40': 50, '41': 57, '42': 25, '43': 16, '44': 26, '45': 20, '46': 19, '47': 22, '48': 12, '49': 15, '50': 10, '51': 8, '52': 7, '53': 8, '54': 3, '55': 8, '56': 6, '57': 4, '58': 2, '59': 6, '60': 4, '62': 4, '63': 2, '64': 2, '68': 1, '69': 2, '70': 1, '71': 1, '74': 1, '89': 1}",{},"{'approved': 270, 'partially paid': 70, 'paid': 2969}","{'XS': 7, 'S': 111, 'M': 527, 'L': 577, 'XL': 388, 'XXL': 220}","{'AR': 1, 'AT': 138, 'AU': 11, 'BE': 50, 'BG': 4, 'BR': 6, 'BS': 1, 'CA': 12, 'CH': 91, 'CL': 1, 'CO': 1, 'CY': 1, 'CZ': 37, 'DE': 1909, 'DK': 61, 'EE': 6, 'ES': 57, 'FI': 52, 'FR': 73, 'GB': 166, 'GE': 1, 'GG': 2, 'GR': 1, 'HK': 1, 'HR': 2, 'HU': 33, 'ID': 1, 'IE': 30, 'IL': 11, 'IM': 1, 'IS': 4, 'IT': 34, 'JP': 3, 'LT': 6, 'LU': 14, 'LV': 5, 'MT': 2, 'MX': 3, 'MY': 1, 'NL': 227, 'NO': 30, 'NZ': 1, 'PL': 69, 'PT': 7, 'QA': 1, 'RO': 10, 'RU': 1, 'SE': 31, 'SG': 2, 'SI': 11, 'SK': 5, 'SX': 1, 'TH': 2, 'TR': 1, 'TW': 1, 'UA': 3, 'US': 68, 'ZA': 5}","{'normal': 2290, 'sponsor': 678, 'supersponsor': 336}","{'animator': 995, 'artist': 1450, 'fursuiter': 1611, 'musician': 1067}"
03/19/2024,True,2024-03-19T23:47:15.332+00:00,2024-03-19T23:47:15.332+00:00,2024,EF28,3311,"{'18': 39, '19': 67, '20': 112, '21': 126, '22': 168, '23': 201, '24': 188, '25': 209, '26': 184, '27': 207, '28': 172, '29': 172, '30': 170, '31': 147, '32': 135, '33': 129, '34': 107, '35': 110, '36': 111, '37': 88, '38': 70, '39': 56, '40': 50, '41': 57, '42': 25, '43': 16, '44': 26, '45': 20, '46': 19, '47': 22, '48': 12, '49': 15, '50': 10, '51': 8, '52': 7, '53': 8, '54': 3, '55': 8, '56': 6, '57': 4, '58': 2, '59': 6, '60': 4, '62': 4, '63': 2, '64': 2, '68': 1, '69': 2, '70': 1, '71': 1, '74': 1, '89': 1}",{},"{'new': 1, 'approved': 262, 'partially paid': 61, 'paid': 2987}","{'XS': 7, 'S': 111, 'M': 529, 'L': 577, 'XL': 388, 'XXL': 221}","{'AR': 1, 'AT': 138, 'AU': 11, 'BE': 50, 'BG': 4, 'BR': 6, 'BS': 1, 'CA': 12, 'CH': 91, 'CL': 1, 'CO': 1, 'CY': 1, 'CZ': 37, 'DE': 1909, 'DK': 61, 'EE': 6, 'ES': 57, 'FI': 52, 'FR': 73, 'GB': 167, 'GE': 1, 'GG': 2, 'GR': 1, 'HK': 1, 'HR': 2, 'HU': 33, 'ID': 1, 'IE': 30, 'IL': 11, 'IM': 1, 'IS': 4, 'IT': 34, 'JP': 3, 'LT': 6, 'LU': 14, 'LV': 5, 'MT': 2, 'MX': 3, 'MY': 1, 'NL': 229, 'NO': 29, 'NZ': 1, 'PL': 69, 'PT': 7, 'QA': 1, 'RO': 10, 'RU': 1, 'SE': 31, 'SG': 2, 'SI': 11, 'SK': 5, 'SX': 1, 'TH': 2, 'TR': 1, 'TW': 1, 'UA': 3, 'US': 68, 'ZA': 5}","{'normal': 2292, 'sponsor': 678, 'supersponsor': 336}","{'animator': 996, 'artist': 1452, 'fursuiter': 1612, 'musician': 1069}"
03/20/2024,True,2024-03-20T23:48:00.649+00:00,2024-03-20T23:48:00.649+00:00,2024,EF28,3317,"{'18': 39, '19': 67, '20': 113, '21': 127, '22': 169, '23': 201, '24': 188, '25': 209, '26': 185, '27': 207, '28': 172, '29': 172, '30': 172, '31': 146, '32': 136, '33': 129, '34': 107, '35': 110, '36': 111, '37': 88, '38': 70, '39': 56, '40': 50, '41': 57, '42': 25, '43': 16, '44': 26, '45': 20, '46': 19, '47': 22, '48': 12, '49': 15, '50': 10, '51': 8, '52': 7, '53': 8, '54': 3, '55': 8, '56': 6, '57': 4, '58': 2, '59': 6, '60': 4, '62': 4, '63': 2, '64': 2, '68': 1, '69': 2, '70': 1, '71': 1, '74': 1, '89': 1}",{},"{'approved': 256, 'partially paid': 56, 'paid': 3005}","{'XS': 7, 'S': 112, 'M': 531, 'L': 577, 'XL': 390, 'XXL': 221}","{'AR': 1, 'AT': 138, 'AU': 11, 'BE': 50, 'BG': 4, 'BR': 6, 'BS': 1, 'CA': 12, 'CH': 91, 'CL': 1, 'CO': 1, 'CY': 1, 'CZ': 38, 'DE': 1911, 'DK': 61, 'EE': 6, 'ES': 57, 'FI': 53, 'FR': 73, 'GB': 168, 'GE': 1, 'GG': 2, 'GR': 1, 'HK': 1, 'HR': 2, 'HU': 33, 'ID': 1, 'IE': 30, 'IL': 11, 'IM': 1, 'IS': 4, 'IT': 34, 'JP': 3, 'LT': 6, 'LU': 14, 'LV': 5, 'MT': 2, 'MX': 3, 'MY': 1, 'NL': 229, 'NO': 29, 'NZ': 1, 'PL': 70, 'PT': 7, 'QA': 1, 'RO': 10, 'RU': 1, 'SE': 31, 'SG': 2, 'SI': 11, 'SK': 5, 'SX': 1, 'TH': 2, 'TR': 1, 'TW': 1, 'UA': 3, 'US': 68, 'ZA': 5}","{'normal': 2296, 'sponsor': 679, 'supersponsor': 337}","{'animator': 998, 'artist': 1456, 'fursuiter': 1616, 'musician': 1072}"
03/21/2024,True,2024-03-21T23:47:15.487+00:00,2024-03-21T23:47:15.487+00:00,2024,EF28,3322,"{'18': 39, '19': 68, '20': 113, '21': 127, '22': 169, '23': 201, '24': 188, '25': 210, '26': 186, '27': 207, '28': 173, '29': 172, '30': 172, '31': 146, '32': 136, '33': 129, '34': 107, '35': 110, '36': 112, '37': 88, '38': 70, '39': 56, '40': 50, '41': 57, '42': 25, '43': 16, '44': 26, '45': 20, '46': 19, '47': 22, '48': 12, '49': 15, '50': 10, '51': 8, '52': 7, '53': 8, '54': 3, '55': 8, '56': 6, '57': 4, '58': 2, '59': 6, '60': 4, '62': 4, '63': 2, '64': 2, '68': 1, '69': 2, '70': 1, '71': 1, '74': 1, '89': 1}",{},"{'approved': 256, 'partially paid': 56, 'paid': 3010}","{'XS': 7, 'S': 112, 'M': 531, 'L': 578, 'XL': 391, 'XXL': 221}","{'AR': 1, 'AT': 139, 'AU': 11, 'BE': 50, 'BG': 4, 'BR': 6, 'BS': 1, 'CA': 12, 'CH': 91, 'CL': 1, 'CO': 1, 'CY': 1, 'CZ': 38, 'DE': 1915, 'DK': 61, 'EE': 6, 'ES': 57, 'FI': 53, 'FR': 73, 'GB': 168, 'GE': 1, 'GG': 2, 'GR': 1, 'HK': 1, 'HR': 2, 'HU': 33, 'ID': 1, 'IE': 30, 'IL': 11, 'IM': 1, 'IS': 4, 'IT': 34, 'JP': 3, 'LT': 6, 'LU': 14, 'LV': 5, 'MT': 2, 'MX': 3, 'MY': 1, 'NL': 229, 'NO': 29, 'NZ': 1, 'PL': 70, 'PT': 7, 'QA': 1, 'RO': 10, 'RU': 1, 'SE': 31, 'SG': 2, 'SI': 11, 'SK': 5, 'SX': 1, 'TH': 2, 'TR': 1, 'TW': 1, 'UA': 3, 'US': 68, 'ZA': 5}","{'normal': 2301, 'sponsor': 679, 'supersponsor': 337}","{'animator': 998, 'artist': 1456, 'fursuiter': 1616, 'musician': 1072}"
03/22/2024,True,2024-03-22T23:47:01.764+00:00,2024-03-22T23:47:01.764+00:00,2024,EF28,3329,"{'18': 39, '19': 68, '20': 113, '21': 128, '22': 169, '23': 202, '24': 189, '25': 211, '26': 188, '27': 208, '28': 173, '29': 172, '30': 172, '31': 146, '32': 136, '33': 129, '34': 107, '35': 110, '36': 112, '37': 88, '38': 70, '39': 56, '40': 50, '41': 57, '42': 25, '43': 16, '44': 26, '45': 20, '46': 19, '47': 22, '48': 12, '49': 15, '50': 10, '51': 8, '52': 7, '53': 8, '54': 3, '55': 8, '56': 6, '57': 4, '58': 2, '59': 6, '60': 4, '62': 4, '63': 2, '64': 2, '68': 1, '69': 2, '70': 1, '71': 1, '74': 1, '89': 1}",{},"{'approved': 258, 'partially paid': 51, 'paid': 3020}","{'XS': 7, 'S': 112, 'M': 532, 'L': 578, 'XL': 392, 'XXL': 221}","{'AR': 1, 'AT': 139, 'AU': 11, 'BE': 50, 'BG': 4, 'BR': 6, 'BS': 1, 'CA': 12, 'CH': 91, 'CL': 1, 'CO': 1, 'CY': 1, 'CZ': 38, 'DE': 1919, 'DK': 61, 'EE': 6, 'ES': 57, 'FI': 53, 'FR': 73, 'GB': 168, 'GE': 1, 'GG': 2, 'GR': 1, 'HK': 1, 'HR': 2, 'HU': 33, 'ID': 1, 'IE': 30, 'IL': 11, 'IM': 1, 'IS': 4, 'IT': 35, 'JP': 3, 'LT': 6, 'LU': 14, 'LV': 5, 'MT': 2, 'MX': 3, 'MY': 1, 'NL': 231, 'NO': 29, 'NZ': 1, 'PL': 70, 'PT': 7, 'QA': 1, 'RO': 10, 'RU': 1, 'SE': 31, 'SG': 2, 'SI': 11, 'SK': 5, 'SX': 1, 'TH': 2, 'TR': 1, 'TW': 1, 'UA': 3, 'US': 68, 'ZA': 5}","{'normal': 2307, 'sponsor': 678, 'supersponsor': 339}","{'animator': 1000, 'artist': 1458, 'fursuiter': 1620, 'musician': 1074}"
03/23/2024,True,2024-03-23T23:47:15.205+00:00,2024-03-23T23:47:15.205+00:00,2024,EF28,3342,"{'18': 39, '19': 69, '20': 114, '21': 129, '22': 170, '23': 203, '24': 190, '25': 212, '26': 190, '27': 208, '28': 174, '29': 172, '30': 173, '31': 146, '32': 136, '33': 129, '34': 107, '35': 110, '36': 112, '37': 89, '38': 70, '39': 56, '40': 50, '41': 57, '42': 25, '43': 16, '44': 26, '45': 20, '46': 20, '47': 22, '48': 12, '49': 15, '50': 10, '51': 8, '52': 7, '53': 8, '54': 3, '55': 8, '56': 6, '57': 4, '58': 2, '59': 6, '60': 4, '62': 4, '63': 2, '64': 2, '68': 1, '69': 2, '70': 1, '71': 1, '74': 1, '89': 1}",{},"{'new': 2, 'approved': 267, 'partially paid': 47, 'paid': 3026}","{'XS': 7, 'S': 113, 'M': 534, 'L': 579, 'XL': 394, 'XXL': 222}","{'AR': 1, 'AT': 139, 'AU': 11, 'BE': 50, 'BG': 4, 'BR': 6, 'BS': 1, 'CA': 12, 'CH': 91, 'CL': 1, 'CO': 1, 'CY': 1, 'CZ': 39, 'DE': 1925, 'DK': 62, 'EE': 6, 'ES': 57, 'FI': 53, 'FR': 73, 'GB': 170, 'GE': 1, 'GG': 2, 'GR': 1, 'HK': 1, 'HR': 2, 'HU': 33, 'ID': 1, 'IE': 31, 'IL': 11, 'IM': 1, 'IS': 4, 'IT': 35, 'JP': 3, 'LT': 6, 'LU': 14, 'LV': 5, 'MT': 2, 'MX': 3, 'MY': 1, 'NL': 233, 'NO': 29, 'NZ': 1, 'PL': 70, 'PT': 7, 'QA': 1, 'RO': 10, 'RU': 1, 'SE': 31, 'SG': 2, 'SI': 11, 'SK': 5, 'SX': 1, 'TH': 2, 'TR': 1, 'TW': 1, 'UA': 3, 'US': 68, 'ZA': 5}","{'normal': 2317, 'sponsor': 679, 'supersponsor': 341}","{'animator': 1006, 'artist': 1465, 'fursuiter': 1629, 'musician': 1080}"
03/24/2024,True,2024-03-24T23:48:29.106+00:00,2024-03-24T23:48:29.106+00:00,2024,EF28,3352,"{'18': 39, '19': 69, '20': 115, '21': 130, '22': 170, '23': 205, '24': 192, '25': 212, '26': 191, '27': 209, '28': 174, '29': 172, '30': 173, '31': 146, '32': 136, '33': 130, '34': 108, '35': 110, '36': 112, '37': 89, '38': 70, '39': 56, '40': 50, '41': 57, '42': 25, '43': 16, '44': 26, '45': 20, '46': 20, '47': 22, '48': 12, '49': 15, '50': 10, '51': 8, '52': 7, '53': 8, '54': 3, '55': 8, '56': 6, '57': 4, '58': 2, '59': 6, '60': 4, '62': 4, '63': 2, '64': 2, '68': 1, '69': 2, '70': 1, '71': 1, '74': 1, '89': 1}",{},"{'new': 3, 'approved': 271, 'partially paid': 45, 'paid': 3033}","{'XS': 7, 'S': 113, 'M': 534, 'L': 580, 'XL': 395, 'XXL': 223}","{'AR': 1, 'AT': 139, 'AU': 11, 'BE': 51, 'BG': 4, 'BR': 6, 'BS': 1, 'CA': 12, 'CH': 92, 'CL': 1, 'CO': 1, 'CY': 1, 'CZ': 39, 'DE': 1929, 'DK': 64, 'EE': 6, 'ES': 57, 'FI': 53, 'FR': 73, 'GB': 171, 'GE': 1, 'GG': 2, 'GR': 1, 'HK': 1, 'HR': 2, 'HU': 33, 'ID': 1, 'IE': 31, 'IL': 11, 'IM': 1, 'IS': 4, 'IT': 35, 'JP': 3, 'LT': 6, 'LU': 14, 'LV': 5, 'MT': 2, 'MX': 3, 'MY': 1, 'NL': 233, 'NO': 29, 'NZ': 1, 'PL': 70, 'PT': 7, 'QA': 1, 'RO': 10, 'RU': 1, 'SE': 31, 'SG': 2, 'SI': 11, 'SK': 5, 'SX': 1, 'TH': 2, 'TR': 1, 'TW': 1, 'UA': 3, 'US': 69, 'ZA': 5}","{'normal': 2325, 'sponsor': 680, 'supersponsor': 342}","{'animator': 1011, 'artist': 1470, 'fursuiter': 1633, 'musician': 1081}"
03/25/2024,True,2024-03-25T23:47:35.456+00:00,2024-03-25T23:47:35.456+00:00,2024,EF28,3321,"{'18': 37, '19': 68, '20': 114, '21': 127, '22': 167, '23': 203, '24': 192, '25': 211, '26': 190, '27': 207, '28': 172, '29': 171, '30': 172, '31': 145, '32': 136, '33': 129, '34': 106, '35': 110, '36': 109, '37': 88, '38': 70, '39': 54, '40': 50, '41': 56, '42': 25, '43': 16, '44': 26, '45': 20, '46': 20, '47': 22, '48': 12, '49': 15, '50': 10, '51': 8, '52': 7, '53': 8, '54': 3, '55': 8, '56': 6, '57': 4, '58': 2, '59': 6, '60': 4, '62': 4, '63': 2, '64': 2, '68': 1, '69': 2, '70': 1, '71': 1, '74': 1, '89': 1}",{},"{'approved': 229, 'partially paid': 40, 'paid': 3052}","{'XS': 7, 'S': 111, 'M': 529, 'L': 579, 'XL': 390, 'XXL': 221}","{'AR': 1, 'AT': 138, 'AU': 11, 'BE': 51, 'BG': 4, 'BR': 6, 'BS': 1, 'CA': 12, 'CH': 90, 'CL': 1, 'CO': 1, 'CY': 1, 'CZ': 40, 'DE': 1916, 'DK': 63, 'EE': 6, 'ES': 55, 'FI': 52, 'FR': 73, 'GB': 167, 'GE': 1, 'GG': 2, 'GR': 1, 'HK': 1, 'HR': 2, 'HU': 32, 'ID': 1, 'IE': 31, 'IL': 11, 'IM': 1, 'IS': 4, 'IT': 35, 'JP': 3, 'LT': 6, 'LU': 14, 'LV': 5, 'MT': 2, 'MX': 3, 'MY': 1, 'NL': 231, 'NO': 27, 'NZ': 1, 'PL': 69, 'PT': 7, 'QA': 1, 'RO': 10, 'SE': 30, 'SG': 2, 'SI': 11, 'SK': 5, 'SX': 1, 'TH': 2, 'TR': 1, 'TW': 1, 'UA': 3, 'US': 69, 'ZA': 5}","{'normal': 2300, 'sponsor': 675, 'supersponsor': 341}","{'animator': 1003, 'artist': 1459, 'fursuiter': 1613, 'musician': 1070}"
03/26/2024,True,2024-03-26T23:49:07.376+00:00,2024-03-26T23:49:07.376+00:00,2024,EF28,3333,"{'18': 37, '19': 68, '20': 115, '21': 127, '22': 169, '23': 204, '24': 192, '25': 213, '26': 191, '27': 207, '28': 174, '29': 171, '30': 172, '31': 146, '32': 136, '33': 129, '34': 106, '35': 110, '36': 109, '37': 88, '38': 70, '39': 55, '40': 50, '41': 56, '42': 26, '43': 16, '44': 26, '45': 20, '46': 20, '47': 22, '48': 12, '49': 15, '50': 10, '51': 8, '52': 7, '53': 8, '54': 3, '55': 8, '56': 6, '57': 4, '58': 2, '59': 6, '60': 4, '62': 4, '63': 2, '64': 2, '68': 1, '69': 2, '70': 1, '71': 1, '74': 1, '89': 1}",{},"{'approved': 228, 'partially paid': 39, 'paid': 3066}","{'XS': 7, 'S': 112, 'M': 531, 'L': 581, 'XL': 392, 'XXL': 221}","{'AR': 1, 'AT': 138, 'AU': 11, 'BE': 51, 'BG': 4, 'BR': 6, 'BS': 1, 'CA': 12, 'CH': 90, 'CL': 1, 'CO': 1, 'CY': 1, 'CZ': 40, 'DE': 1923, 'DK': 63, 'EE': 6, 'ES': 55, 'FI': 52, 'FR': 73, 'GB': 168, 'GE': 1, 'GG': 2, 'GR': 1, 'HK': 1, 'HR': 2, 'HU': 32, 'ID': 1, 'IE': 31, 'IL': 11, 'IM': 1, 'IS': 4, 'IT': 35, 'JP': 3, 'LT': 6, 'LU': 14, 'LV': 5, 'MT': 2, 'MX': 3, 'MY': 1, 'NL': 233, 'NO': 28, 'NZ': 1, 'PL': 69, 'PT': 7, 'QA': 1, 'RO': 10, 'RU': 1, 'SE': 30, 'SG': 2, 'SI': 11, 'SK': 5, 'SX': 1, 'TH': 2, 'TR': 1, 'TW': 1, 'UA': 3, 'US': 69, 'ZA': 5}","{'normal': 2307, 'sponsor': 680, 'supersponsor': 341}","{'animator': 1008, 'artist': 1465, 'fursuiter': 1618, 'musician': 1075}"
03/27/2024,True,2024-03-27T23:47:14.143+00:00,2024-03-27T23:47:14.143+00:00,2024,EF28,3344,"{'18': 37, '19': 68, '20': 115, '21': 128, '22': 169, '23': 204, '24': 192, '25': 217, '26': 192, '27': 208, '28': 175, '29': 171, '30': 172, '31': 146, '32': 137, '33': 129, '34': 106, '35': 111, '36': 110, '37': 88, '38': 70, '39': 55, '40': 50, '41': 56, '42': 26, '43': 16, '44': 26, '45': 20, '46': 20, '47': 22, '48': 12, '49': 15, '50': 10, '51': 8, '52': 7, '53': 8, '54': 3, '55': 8, '56': 6, '57': 4, '58': 2, '59': 6, '60': 4, '62': 4, '63': 2, '64': 2, '68': 1, '69': 2, '70': 1, '71': 1, '74': 1, '89': 1}",{},"{'approved': 231, 'partially paid': 39, 'paid': 3074}","{'XS': 7, 'S': 112, 'M': 534, 'L': 584, 'XL': 393, 'XXL': 222}","{'AR': 1, 'AT': 138, 'AU': 11, 'BE': 51, 'BG': 4, 'BR': 6, 'BS': 1, 'CA': 12, 'CH': 90, 'CL': 1, 'CO': 1, 'CY': 1, 'CZ': 40, 'DE': 1926, 'DK': 63, 'EE': 6, 'ES': 55, 'FI': 52, 'FR': 73, 'GB': 170, 'GE': 1, 'GG': 2, 'GR': 1, 'HK': 1, 'HR': 2, 'HU': 32, 'ID': 1, 'IE': 31, 'IL': 11, 'IM': 1, 'IS': 4, 'IT': 35, 'JP': 3, 'LT': 6, 'LU': 15, 'LV': 5, 'MT': 2, 'MX': 3, 'MY': 1, 'NL': 235, 'NO': 28, 'NZ': 1, 'PL': 70, 'PT': 7, 'QA': 1, 'RO': 10, 'RU': 1, 'SE': 30, 'SG': 2, 'SI': 11, 'SK': 6, 'SX': 1, 'TH': 2, 'TR': 1, 'TW': 1, 'UA': 3, 'US': 70, 'ZA': 5}","{'normal': 2315, 'sponsor': 681, 'supersponsor': 343}","{'animator': 1012, 'artist': 1471, 'fursuiter': 1620, 'musician': 1080}"
03/28/2024,True,2024-03-28T23:47:31.098+00:00,2024-03-28T23:47:31.098+00:00,2024,EF28,3351,"{'18': 37, '19': 68, '20': 115, '21': 128, '22': 169, '23': 204, '24': 195, '25': 217, '26': 193, '27': 208, '28': 175, '29': 171, '30': 172, '31': 148, '32': 137, '33': 129, '34': 106, '35': 111, '36': 110, '37': 88, '38': 70, '39': 55, '40': 50, '41': 56, '42': 26, '43': 16, '44': 27, '45': 20, '46': 20, '47': 22, '48': 12, '49': 15, '50': 10, '51': 8, '52': 7, '53': 8, '54': 3, '55': 8, '56': 6, '57': 4, '58': 2, '59': 6, '60': 4, '62': 4, '63': 2, '64': 2, '68': 1, '69': 2, '70': 1, '71': 1, '74': 1, '89': 1}",{},"{'new': 2, 'approved': 230, 'partially paid': 31, 'paid': 3088}","{'XS': 7, 'S': 113, 'M': 535, 'L': 585, 'XL': 393, 'XXL': 222}","{'AR': 1, 'AT': 139, 'AU': 11, 'BE': 51, 'BG': 4, 'BR': 6, 'BS': 1, 'CA': 12, 'CH': 90, 'CL': 1, 'CO': 1, 'CY': 1, 'CZ': 40, 'DE': 1929, 'DK': 63, 'EE': 6, 'ES': 55, 'FI': 52, 'FR': 73, 'GB': 172, 'GE': 1, 'GG': 2, 'GR': 1, 'HK': 1, 'HR': 2, 'HU': 32, 'ID': 1, 'IE': 31, 'IL': 11, 'IM': 1, 'IS': 4, 'IT': 35, 'JP': 3, 'LT': 6, 'LU': 15, 'LV': 5, 'MT': 2, 'MX': 3, 'MY': 1, 'NL': 235, 'NO': 28, 'NZ': 1, 'PL': 70, 'PT': 7, 'QA': 1, 'RO': 10, 'RU': 1, 'SE': 30, 'SG': 2, 'SI': 11, 'SK': 7, 'SX': 1, 'TH': 2, 'TR': 1, 'TW': 1, 'UA': 3, 'US': 70, 'ZA': 5}","{'normal': 2322, 'sponsor': 681, 'supersponsor': 343}","{'animator': 1017, 'artist': 1476, 'fursuiter': 1624, 'musician': 1085}"
03/29/2024,True,2024-03-29T23:47:15.262+00:00,2024-03-29T23:47:15.262+00:00,2024,EF28,3360,"{'18': 37, '19': 68, '20': 117, '21': 128, '22': 171, '23': 205, '24': 196, '25': 217, '26': 193, '27': 210, '28': 176, '29': 171, '30': 172, '31': 148, '32': 137, '33': 129, '34': 106, '35': 111, '36': 110, '37': 88, '38': 70, '39': 55, '40': 50, '41': 56, '42': 26, '43': 16, '44': 27, '45': 20, '46': 20, '47': 22, '48': 12, '49': 15, '50': 10, '51': 8, '52': 7, '53': 8, '54': 3, '55': 8, '56': 6, '57': 4, '58': 2, '59': 6, '60': 4, '62': 4, '63': 2, '64': 2, '68': 1, '69': 2, '70': 1, '71': 1, '74': 1, '89': 1}",{},"{'approved': 237, 'partially paid': 30, 'paid': 3093}","{'XS': 7, 'S': 113, 'M': 537, 'L': 587, 'XL': 393, 'XXL': 222}","{'AR': 1, 'AT': 139, 'AU': 12, 'BE': 51, 'BG': 4, 'BR': 6, 'BS': 1, 'CA': 12, 'CH': 90, 'CL': 1, 'CO': 1, 'CY': 1, 'CZ': 40, 'DE': 1932, 'DK': 63, 'EE': 6, 'ES': 55, 'FI': 52, 'FR': 74, 'GB': 174, 'GE': 1, 'GG': 2, 'GR': 1, 'HK': 1, 'HR': 2, 'HU': 32, 'ID': 1, 'IE': 31, 'IL': 11, 'IM': 1, 'IS': 4, 'IT': 35, 'JP': 3, 'LT': 6, 'LU': 15, 'LV': 5, 'MT': 2, 'MX': 3, 'MY': 1, 'NL': 237, 'NO': 28, 'NZ': 1, 'PL': 70, 'PT': 7, 'QA': 1, 'RO': 10, 'RU': 1, 'SE': 30, 'SG': 2, 'SI': 11, 'SK': 7, 'SX': 1, 'TH': 2, 'TR': 1, 'TW': 1, 'UA': 3, 'US': 70, 'ZA': 5}","{'normal': 2330, 'sponsor': 682, 'supersponsor': 343}","{'animator': 1020, 'artist': 1480, 'fursuiter': 1628, 'musician': 1088}"
03/30/2024,True,2024-03-30T23:47:18.822+00:00,2024-03-30T23:47:18.822+00:00,2024,EF28,3373,"{'18': 38, '19': 68, '20': 120, '21': 130, '22': 171, '23': 207, '24': 196, '25': 218, '26': 195, '27': 211, '28': 176, '29': 171, '30': 172, '31': 148, '32': 137, '33': 129, '34': 107, '35': 111, '36': 110, '37': 88, '38': 70, '39': 55, '40': 50, '41': 56, '42': 26, '43': 16, '44': 27, '45': 20, '46': 20, '47': 22, '48': 12, '49': 15, '50': 10, '51': 8, '52': 7, '53': 8, '54': 3, '55': 8, '56': 6, '57': 4, '58': 2, '59': 6, '60': 4, '62': 4, '63': 2, '64': 2, '68': 1, '69': 2, '70': 1, '71': 1, '74': 1, '89': 1}",{},"{'approved': 246, 'partially paid': 29, 'paid': 3098}","{'XS': 7, 'S': 113, 'M': 537, 'L': 593, 'XL': 393, 'XXL': 222}","{'AR': 1, 'AT': 141, 'AU': 12, 'BE': 51, 'BG': 4, 'BR': 6, 'BS': 1, 'CA': 12, 'CH': 90, 'CL': 1, 'CO': 1, 'CY': 1, 'CZ': 40, 'DE': 1938, 'DK': 63, 'EE': 6, 'ES': 55, 'FI': 53, 'FR': 74, 'GB': 174, 'GE': 1, 'GG': 2, 'GR': 1, 'HK': 1, 'HR': 2, 'HU': 32, 'ID': 1, 'IE': 31, 'IL': 11, 'IM': 1, 'IS': 4, 'IT': 35, 'JP': 3, 'LT': 6, 'LU': 15, 'LV': 5, 'MT': 2, 'MX': 3, 'MY': 1, 'NL': 238, 'NO': 28, 'NZ': 1, 'PL': 72, 'PT': 7, 'QA': 1, 'RO': 10, 'RU': 1, 'SE': 30, 'SG': 2, 'SI': 11, 'SK': 7, 'SX': 1, 'TH': 2, 'TR': 1, 'TW': 1, 'UA': 3, 'US': 71, 'ZA': 5}","{'normal': 2339, 'sponsor': 685, 'supersponsor': 344}","{'animator': 1024, 'artist': 1485, 'fursuiter': 1636, 'musician': 1093}"
03/31/2024,True,2024-03-31T23:47:25.598+00:00,2024-03-31T23:47:25.598+00:00,2024,EF28,3387,"{'18': 38, '19': 72, '20': 120, '21': 130, '22': 172, '23': 208, '24': 197, '25': 219, '26': 195, '27': 211, '28': 177, '29': 171, '30': 172, '31': 149, '32': 137, '33': 130, '34': 107, '35': 111, '36': 110, '37': 88, '38': 70, '39': 55, '40': 50, '41': 56, '42': 26, '43': 17, '44': 27, '45': 20, '46': 20, '47': 22, '48': 13, '49': 15, '50': 11, '51': 8, '52': 7, '53': 8, '54': 3, '55': 8, '56': 6, '57': 4, '58': 2, '59': 6, '60': 4, '62': 4, '63': 2, '64': 2, '68': 1, '69': 2, '70': 1, '71': 1, '74': 1, '89': 1}",{},"{'new': 1, 'approved': 253, 'partially paid': 29, 'paid': 3104}","{'XS': 7, 'S': 113, 'M': 541, 'L': 596, 'XL': 393, 'XXL': 223}","{'AR': 1, 'AT': 142, 'AU': 12, 'BE': 51, 'BG': 4, 'BR': 6, 'BS': 1, 'CA': 12, 'CH': 91, 'CL': 1, 'CO': 1, 'CY': 1, 'CZ': 41, 'DE': 1945, 'DK': 64, 'EE': 6, 'ES': 55, 'FI': 54, 'FR': 74, 'GB': 174, 'GE': 1, 'GG': 2, 'GR': 1, 'HK': 1, 'HR': 2, 'HU': 32, 'ID': 1, 'IE': 31, 'IL': 11, 'IM': 1, 'IS': 4, 'IT': 35, 'JP': 3, 'LT': 6, 'LU': 15, 'LV': 5, 'MT': 2, 'MX': 3, 'MY': 1, 'NL': 239, 'NO': 28, 'NZ': 1, 'PL': 72, 'PT': 7, 'QA': 1, 'RO': 10, 'RU': 1, 'SE': 30, 'SG': 2, 'SI': 11, 'SK': 7, 'SX': 1, 'TH': 2, 'TR': 1, 'TW': 1, 'UA': 3, 'US': 72, 'ZA': 5}","{'normal': 2349, 'sponsor': 689, 'supersponsor': 344}","{'animator': 1029, 'artist': 1490, 'fursuiter': 1641, 'musician': 1097}"
04/01/2024,True,2024-04-01T23:48:06.029+00:00,2024-04-01T23:48:06.029+00:00,2024,EF28,3406,"{'18': 39, '19': 73, '20': 122, '21': 130, '22': 174, '23': 211, '24': 199, '25': 220, '26': 197, '27': 212, '28': 178, '29': 171, '30': 173, '31': 150, '32': 137, '33': 130, '34': 107, '35': 112, '36': 110, '37': 88, '38': 70, '39': 55, '40': 50, '41': 56, '42': 26, '43': 17, '44': 27, '45': 20, '46': 20, '47': 22, '48': 13, '49': 15, '50': 11, '51': 8, '52': 6, '53': 8, '54': 3, '55': 8, '56': 6, '57': 4, '58': 2, '59': 6, '60': 4, '62': 4, '63': 2, '64': 2, '68': 1, '69': 2, '70': 1, '71': 1, '74': 1, '75': 1, '89': 1}",{},"{'new': 2, 'approved': 263, 'partially paid': 29, 'paid': 3112}","{'XS': 7, 'S': 114, 'M': 543, 'L': 600, 'XL': 394, 'XXL': 224}","{'AR': 1, 'AT': 143, 'AU': 12, 'BE': 51, 'BG': 4, 'BR': 6, 'BS': 1, 'CA': 12, 'CH': 92, 'CL': 1, 'CO': 1, 'CY': 1, 'CZ': 41, 'DE': 1957, 'DK': 64, 'EE': 6, 'ES': 55, 'FI': 54, 'FR': 75, 'GB': 176, 'GE': 1, 'GG': 2, 'GR': 1, 'HK': 1, 'HR': 2, 'HU': 32, 'ID': 1, 'IE': 31, 'IL': 11, 'IM': 1, 'IS': 4, 'IT': 35, 'JP': 3, 'LT': 6, 'LU': 15, 'LV': 5, 'MT': 2, 'MX': 3, 'MY': 1, 'NL': 241, 'NO': 28, 'NZ': 1, 'PL': 72, 'PT': 7, 'QA': 1, 'RO': 10, 'RU': 1, 'SE': 30, 'SG': 2, 'SI': 11, 'SK': 7, 'SX': 1, 'TH': 2, 'TR': 1, 'TW': 1, 'UA': 3, 'US': 72, 'ZA': 5}","{'normal': 2361, 'sponsor': 694, 'supersponsor': 346}","{'animator': 1036, 'artist': 1499, 'fursuiter': 1652, 'musician': 1101}"
04/02/2024,True,2024-04-02T23:48:15.996+00:00,2024-04-02T23:48:15.996+00:00,2024,EF28,3405,"{'18': 39, '19': 74, '20': 121, '21': 130, '22': 172, '23': 211, '24': 199, '25': 221, '26': 197, '27': 213, '28': 178, '29': 172, '30': 173, '31': 150, '32': 136, '33': 130, '34': 107, '35': 112, '36': 110, '37': 88, '38': 70, '39': 54, '40': 50, '41': 56, '42': 26, '43': 17, '44': 27, '45': 20, '46': 20, '47': 22, '48': 13, '49': 15, '50': 11, '51': 8, '52': 6, '53': 8, '54': 3, '55': 8, '56': 6, '57': 4, '58': 2, '59': 6, '60': 4, '62': 4, '63': 2, '64': 2, '68': 1, '69': 2, '70': 1, '71': 1, '74': 1, '75': 1, '89': 1}",{},"{'new': 1, 'approved': 239, 'partially paid': 21, 'paid': 3144}","{'XS': 7, 'S': 114, 'M': 542, 'L': 600, 'XL': 391, 'XXL': 225}","{'AT': 142, 'AU': 12, 'BE': 51, 'BG': 4, 'BR': 6, 'BS': 1, 'CA': 12, 'CH': 93, 'CL': 1, 'CO': 1, 'CY': 1, 'CZ': 40, 'DE': 1960, 'DK': 63, 'EE': 6, 'ES': 55, 'FI': 54, 'FR': 76, 'GB': 177, 'GE': 1, 'GG': 2, 'GR': 1, 'HK': 1, 'HR': 2, 'HU': 32, 'IE': 31, 'IL': 10, 'IM': 1, 'IS': 4, 'IT': 35, 'JP': 3, 'LT': 6, 'LU': 15, 'LV': 4, 'MT': 2, 'MX': 3, 'MY': 1, 'NL': 242, 'NO': 28, 'NZ': 1, 'PL': 71, 'PT': 7, 'QA': 1, 'RO': 10, 'RU': 1, 'SE': 30, 'SG': 2, 'SI': 11, 'SK': 7, 'SX': 1, 'TH': 2, 'TR': 1, 'TW': 1, 'UA': 3, 'US': 72, 'ZA': 5}","{'normal': 2363, 'sponsor': 692, 'supersponsor': 345}","{'animator': 1033, 'artist': 1494, 'fursuiter': 1648, 'musician': 1100}"
04/03/2024,True,2024-04-03T23:52:47.353+00:00,2024-04-03T23:52:47.353+00:00,2024,EF28,3411,"{'18': 40, '19': 74, '20': 121, '21': 131, '22': 174, '23': 212, '24': 198, '25': 221, '26': 197, '27': 213, '28': 178, '29': 172, '30': 174, '31': 150, '32': 136, '33': 130, '34': 107, '35': 112, '36': 110, '37': 89, '38': 70, '39': 54, '40': 50, '41': 56, '42': 26, '43': 17, '44': 27, '45': 20, '46': 20, '47': 22, '48': 13, '49': 15, '50': 11, '51': 8, '52': 6, '53': 8, '54': 3, '55': 8, '56': 6, '57': 4, '58': 2, '59': 6, '60': 4, '62': 4, '63': 2, '64': 2, '68': 1, '69': 2, '70': 1, '71': 1, '74': 1, '75': 1, '89': 1}",{},"{'new': 2, 'approved': 231, 'partially paid': 18, 'paid': 3160}","{'XS': 7, 'S': 114, 'M': 542, 'L': 602, 'XL': 393, 'XXL': 226}","{'AT': 143, 'AU': 12, 'BE': 51, 'BG': 4, 'BR': 6, 'BS': 1, 'CA': 12, 'CH': 93, 'CL': 1, 'CO': 1, 'CY': 1, 'CZ': 40, 'DE': 1962, 'DK': 64, 'EE': 6, 'ES': 56, 'FI': 54, 'FR': 76, 'GB': 177, 'GE': 1, 'GG': 2, 'GR': 1, 'HK': 1, 'HR': 2, 'HU': 32, 'IE': 31, 'IL': 11, 'IM': 1, 'IS': 4, 'IT': 35, 'JP': 3, 'LT': 6, 'LU': 15, 'LV': 4, 'MT': 2, 'MX': 3, 'MY': 1, 'NL': 242, 'NO': 28, 'NZ': 1, 'PL': 71, 'PT': 7, 'QA': 1, 'RO': 10, 'RU': 1, 'SE': 30, 'SG': 2, 'SI': 11, 'SK': 7, 'SX': 1, 'TH': 2, 'TR': 1, 'TW': 1, 'UA': 3, 'US': 72, 'ZA': 5}","{'normal': 2366, 'sponsor': 695, 'supersponsor': 345}","{'animator': 1037, 'artist': 1496, 'fursuiter': 1651, 'musician': 1103}"
04/04/2024,True,2024-04-04T23:48:34.979+00:00,2024-04-04T23:48:34.979+00:00,2024,EF28,3421,"{'18': 40, '19': 75, '20': 121, '21': 132, '22': 173, '23': 213, '24': 200, '25': 222, '26': 197, '27': 214, '28': 179, '29': 173, '30': 174, '31': 150, '32': 136, '33': 130, '34': 108, '35': 112, '36': 110, '37': 90, '38': 70, '39': 54, '40': 50, '41': 56, '42': 26, '43': 17, '44': 27, '45': 20, '46': 20, '47': 22, '48': 13, '49': 15, '50': 11, '51': 8, '52': 6, '53': 8, '54': 3, '55': 8, '56': 6, '57': 4, '58': 2, '59': 6, '60': 4, '62': 4, '63': 2, '64': 2, '68': 1, '69': 2, '70': 1, '71': 1, '74': 1, '75': 1, '89': 1}",{},"{'approved': 234, 'partially paid': 17, 'paid': 3170}","{'XS': 7, 'S': 114, 'M': 543, 'L': 602, 'XL': 395, 'XXL': 228}","{'AT': 143, 'AU': 12, 'BE': 51, 'BG': 4, 'BR': 6, 'BS': 1, 'CA': 12, 'CH': 93, 'CL': 1, 'CO': 1, 'CY': 1, 'CZ': 40, 'DE': 1969, 'DK': 64, 'EE': 6, 'ES': 57, 'FI': 54, 'FR': 76, 'GB': 177, 'GE': 1, 'GG': 2, 'GR': 1, 'HK': 1, 'HR': 2, 'HU': 33, 'IE': 31, 'IL': 11, 'IM': 1, 'IS': 4, 'IT': 35, 'JP': 3, 'LT': 6, 'LU': 15, 'LV': 5, 'MT': 2, 'MX': 3, 'MY': 1, 'NL': 241, 'NO': 29, 'NZ': 1, 'PL': 71, 'PT': 7, 'QA': 1, 'RO': 10, 'RU': 1, 'SE': 30, 'SG': 2, 'SI': 11, 'SK': 7, 'SX': 1, 'TH': 2, 'TR': 1, 'TW': 1, 'UA': 3, 'US': 72, 'ZA': 5}","{'normal': 2373, 'sponsor': 698, 'supersponsor': 345}","{'animator': 1038, 'artist': 1500, 'fursuiter': 1655, 'musician': 1105}"
04/05/2024,True,2024-04-05T23:49:38.012+00:00,2024-04-05T23:49:38.012+00:00,2024,EF28,3430,"{'18': 40, '19': 75, '20': 121, '21': 134, '22': 173, '23': 213, '24': 200, '25': 222, '26': 197, '27': 216, '28': 179, '29': 173, '30': 177, '31': 150, '32': 137, '33': 131, '34': 108, '35': 112, '36': 110, '37': 90, '38': 70, '39': 54, '40': 50, '41': 56, '42': 26, '43': 17, '44': 27, '45': 20, '46': 20, '47': 22, '48': 13, '49': 15, '50': 11, '51': 8, '52': 6, '53': 8, '54': 3, '55': 8, '56': 6, '57': 4, '58': 2, '59': 6, '60': 4, '62': 4, '63': 2, '64': 2, '68': 1, '69': 2, '70': 1, '71': 1, '74': 1, '75': 1, '89': 1}",{},"{'approved': 234, 'partially paid': 16, 'paid': 3180}","{'XS': 7, 'S': 114, 'M': 544, 'L': 604, 'XL': 397, 'XXL': 227}","{'AT': 143, 'AU': 12, 'BE': 51, 'BG': 4, 'BR': 6, 'BS': 1, 'CA': 12, 'CH': 93, 'CL': 1, 'CO': 1, 'CY': 1, 'CZ': 40, 'DE': 1975, 'DK': 66, 'EE': 6, 'ES': 57, 'FI': 54, 'FR': 76, 'GB': 177, 'GE': 1, 'GG': 2, 'GR': 1, 'HK': 1, 'HR': 2, 'HU': 33, 'IE': 31, 'IL': 11, 'IM': 1, 'IS': 4, 'IT': 35, 'JP': 3, 'LT': 6, 'LU': 15, 'LV': 5, 'MT': 2, 'MX': 3, 'MY': 1, 'NL': 241, 'NO': 30, 'NZ': 1, 'PL': 71, 'PT': 7, 'QA': 1, 'RO': 10, 'RU': 1, 'SE': 30, 'SG': 2, 'SI': 11, 'SK': 7, 'SX': 1, 'TH': 2, 'TR': 1, 'TW': 1, 'UA': 3, 'US': 72, 'ZA': 5}","{'normal': 2377, 'sponsor': 701, 'supersponsor': 347}","{'animator': 1042, 'artist': 1506, 'fursuiter': 1660, 'musician': 1108}"
04/06/2024,True,2024-04-06T23:47:27.158+00:00,2024-04-06T23:47:27.158+00:00,2024,EF28,3436,"{'18': 40, '19': 75, '20': 121, '21': 134, '22': 174, '23': 213, '24': 200, '25': 223, '26': 197, '27': 217, '28': 179, '29': 173, '30': 178, '31': 150, '32': 137, '33': 131, '34': 108, '35': 113, '36': 110, '37': 91, '38': 70, '39': 54, '40': 50, '41': 56, '42': 26, '43': 17, '44': 27, '45': 20, '46': 20, '47': 22, '48': 13, '49': 15, '50': 11, '51': 8, '52': 6, '53': 8, '54': 3, '55': 8, '56': 6, '57': 4, '58': 2, '59': 6, '60': 4, '62': 4, '63': 2, '64': 2, '68': 1, '69': 2, '70': 1, '71': 1, '74': 1, '75': 1, '89': 1}",{},"{'new': 5, 'approved': 232, 'partially paid': 15, 'paid': 3184}","{'XS': 7, 'S': 114, 'M': 545, 'L': 605, 'XL': 398, 'XXL': 227}","{'AT': 143, 'AU': 12, 'BE': 51, 'BG': 4, 'BR': 6, 'BS': 1, 'CA': 12, 'CH': 94, 'CL': 1, 'CO': 1, 'CY': 1, 'CZ': 40, 'DE': 1979, 'DK': 66, 'EE': 6, 'ES': 57, 'FI': 54, 'FR': 77, 'GB': 177, 'GE': 1, 'GG': 2, 'GR': 1, 'HK': 1, 'HR': 2, 'HU': 33, 'IE': 31, 'IL': 11, 'IM': 1, 'IS': 4, 'IT': 35, 'JP': 3, 'LT': 6, 'LU': 15, 'LV': 5, 'MT': 2, 'MX': 3, 'MY': 1, 'NL': 241, 'NO': 30, 'NZ': 1, 'PL': 71, 'PT': 7, 'QA': 1, 'RO': 10, 'RU': 1, 'SE': 30, 'SG': 2, 'SI': 11, 'SK': 7, 'SX': 1, 'TH': 2, 'TR': 1, 'TW': 1, 'UA': 3, 'US': 72, 'ZA': 5}","{'normal': 2380, 'sponsor': 704, 'supersponsor': 347}","{'animator': 1043, 'artist': 1508, 'fursuiter': 1660, 'musician': 1108}"
04/07/2024,True,2024-04-07T23:47:44.679+00:00,2024-04-07T23:47:44.679+00:00,2024,EF28,3451,"{'18': 40, '19': 75, '20': 121, '21': 134, '22': 174, '23': 215, '24': 201, '25': 226, '26': 198, '27': 218, '28': 180, '29': 173, '30': 179, '31': 150, '32': 137, '33': 131, '34': 109, '35': 113, '36': 110, '37': 92, '38': 71, '39': 54, '40': 50, '41': 56, '42': 26, '43': 17, '44': 27, '45': 20, '46': 21, '47': 22, '48': 13, '49': 16, '50': 11, '51': 8, '52': 6, '53': 8, '54': 3, '55': 8, '56': 6, '57': 4, '58': 2, '59': 6, '60': 4, '62': 4, '63': 2, '64': 2, '68': 1, '69': 2, '70': 1, '71': 1, '74': 1, '75': 1, '89': 1}",{},"{'approved': 248, 'partially paid': 14, 'paid': 3189}","{'XS': 7, 'S': 115, 'M': 546, 'L': 606, 'XL': 400, 'XXL': 227}","{'AT': 143, 'AU': 12, 'BE': 51, 'BG': 4, 'BR': 6, 'BS': 1, 'CA': 12, 'CH': 95, 'CL': 1, 'CO': 1, 'CY': 1, 'CZ': 40, 'DE': 1986, 'DK': 66, 'EE': 7, 'ES': 57, 'FI': 54, 'FR': 78, 'GB': 181, 'GE': 1, 'GG': 2, 'GR': 1, 'HK': 1, 'HR': 2, 'HU': 33, 'IE': 31, 'IL': 11, 'IM': 1, 'IS': 4, 'IT': 35, 'JP': 3, 'LT': 6, 'LU': 15, 'LV': 5, 'MT': 2, 'MX': 3, 'MY': 1, 'NL': 241, 'NO': 31, 'NZ': 1, 'PL': 71, 'PT': 7, 'QA': 1, 'RO': 10, 'RU': 1, 'SE': 30, 'SG': 2, 'SI': 11, 'SK': 7, 'SX': 1, 'TH': 2, 'TR': 1, 'TW': 1, 'UA': 3, 'US': 72, 'ZA': 5}","{'normal': 2390, 'sponsor': 708, 'supersponsor': 348}","{'animator': 1049, 'artist': 1514, 'fursuiter': 1666, 'musician': 1113}"
04/08/2024,True,2024-04-08T23:48:28.014+00:00,2024-04-08T23:48:28.014+00:00,2024,EF28,3445,"{'18': 39, '19': 74, '20': 121, '21': 135, '22': 174, '23': 214, '24': 200, '25': 225, '26': 198, '27': 217, '28': 180, '29': 173, '30': 178, '31': 150, '32': 136, '33': 131, '34': 110, '35': 113, '36': 110, '37': 92, '38': 71, '39': 54, '40': 50, '41': 56, '42': 26, '43': 17, '44': 27, '45': 20, '46': 21, '47': 22, '48': 13, '49': 16, '50': 11, '51': 8, '52': 6, '53': 8, '54': 3, '55': 8, '56': 6, '57': 4, '58': 2, '59': 6, '60': 4, '62': 4, '63': 2, '64': 2, '68': 1, '69': 2, '70': 1, '71': 1, '74': 1, '75': 1, '89': 1}",{},"{'new': 2, 'approved': 222, 'partially paid': 14, 'paid': 3207}","{'XS': 7, 'S': 115, 'M': 545, 'L': 607, 'XL': 400, 'XXL': 227}","{'AT': 143, 'AU': 12, 'BE': 51, 'BG': 4, 'BR': 6, 'BS': 1, 'CA': 12, 'CH': 95, 'CL': 1, 'CO': 1, 'CY': 1, 'CZ': 39, 'DE': 1984, 'DK': 66, 'EE': 7, 'ES': 56, 'FI': 54, 'FR': 78, 'GB': 181, 'GE': 1, 'GG': 2, 'GR': 1, 'HK': 1, 'HR': 2, 'HU': 33, 'IE': 31, 'IL': 11, 'IM': 1, 'IS': 4, 'IT': 36, 'JP': 3, 'LT': 6, 'LU': 15, 'LV': 5, 'MT': 2, 'MX': 3, 'MY': 1, 'NL': 239, 'NO': 31, 'NZ': 1, 'PL': 70, 'PT': 7, 'QA': 1, 'RO': 10, 'RU': 1, 'SE': 29, 'SG': 2, 'SI': 11, 'SK': 7, 'SX': 1, 'TH': 2, 'TR': 1, 'TW': 1, 'UA': 3, 'US': 73, 'ZA': 5}","{'normal': 2384, 'sponsor': 708, 'supersponsor': 348}","{'animator': 1047, 'artist': 1513, 'fursuiter': 1662, 'musician': 1111}"
04/09/2024,True,2024-04-09T23:48:33.678+00:00,2024-04-09T23:48:33.678+00:00,2024,EF28,3453,"{'18': 39, '19': 74, '20': 121, '21': 135, '22': 175, '23': 214, '24': 202, '25': 225, '26': 198, '27': 218, '28': 180, '29': 174, '30': 180, '31': 150, '32': 136, '33': 131, '34': 110, '35': 113, '36': 111, '37': 92, '38': 71, '39': 54, '40': 50, '41': 56, '42': 26, '43': 17, '44': 27, '45': 20, '46': 21, '47': 22, '48': 13, '49': 16, '50': 11, '51': 8, '52': 6, '53': 8, '54': 3, '55': 8, '56': 6, '57': 4, '58': 2, '59': 6, '60': 4, '62': 4, '63': 2, '64': 2, '68': 1, '69': 2, '70': 1, '71': 1, '74': 1, '75': 1, '89': 1}",{},"{'new': 1, 'approved': 220, 'partially paid': 13, 'paid': 3219}","{'XS': 7, 'S': 115, 'M': 546, 'L': 608, 'XL': 400, 'XXL': 227}","{'AT': 144, 'AU': 12, 'BE': 51, 'BG': 4, 'BR': 6, 'BS': 1, 'CA': 12, 'CH': 95, 'CL': 1, 'CO': 1, 'CY': 1, 'CZ': 39, 'DE': 1987, 'DK': 66, 'EE': 7, 'ES': 56, 'FI': 54, 'FR': 78, 'GB': 181, 'GE': 1, 'GG': 2, 'GR': 1, 'HK': 1, 'HR': 2, 'HU': 33, 'IE': 31, 'IL': 11, 'IM': 1, 'IS': 4, 'IT': 36, 'JP': 3, 'LT': 6, 'LU': 15, 'LV': 5, 'MT': 2, 'MX': 3, 'MY': 1, 'NL': 240, 'NO': 31, 'NZ': 1, 'PL': 71, 'PT': 7, 'QA': 1, 'RO': 10, 'RU': 1, 'SE': 29, 'SG': 2, 'SI': 11, 'SK': 7, 'SX': 1, 'TH': 2, 'TR': 1, 'TW': 1, 'UA': 3, 'US': 75, 'ZA': 5}","{'normal': 2391, 'sponsor': 708, 'supersponsor': 349}","{'animator': 1050, 'artist': 1518, 'fursuiter': 1665, 'musician': 1117}"
04/10/2024,True,2024-04-10T23:48:53.686+00:00,2024-04-10T23:48:53.686+00:00,2024,EF28,3457,"{'18': 39, '19': 74, '20': 121, '21': 136, '22': 176, '23': 214, '24': 202, '25': 225, '26': 198, '27': 218, '28': 180, '29': 174, '30': 180, '31': 150, '32': 136, '33': 131, '34': 111, '35': 113, '36': 111, '37': 92, '38': 71, '39': 54, '40': 50, '41': 57, '42': 26, '43': 17, '44': 27, '45': 20, '46': 21, '47': 22, '48': 13, '49': 16, '50': 11, '51': 8, '52': 6, '53': 8, '54': 3, '55': 8, '56': 6, '57': 4, '58': 2, '59': 6, '60': 4, '62': 4, '63': 2, '64': 2, '68': 1, '69': 2, '70': 1, '71': 1, '74': 1, '75': 1, '89': 1}",{},"{'approved': 221, 'partially paid': 13, 'paid': 3223}","{'XS': 7, 'S': 115, 'M': 547, 'L': 608, 'XL': 400, 'XXL': 227}","{'AT': 144, 'AU': 12, 'BE': 51, 'BG': 4, 'BR': 6, 'BS': 1, 'CA': 12, 'CH': 95, 'CL': 1, 'CO': 1, 'CY': 1, 'CZ': 39, 'DE': 1988, 'DK': 66, 'EE': 7, 'ES': 56, 'FI': 54, 'FR': 78, 'GB': 182, 'GE': 1, 'GG': 2, 'GR': 1, 'HK': 1, 'HR': 2, 'HU': 33, 'IE': 31, 'IL': 12, 'IM': 1, 'IS': 4, 'IT': 36, 'JP': 3, 'LT': 6, 'LU': 15, 'LV': 5, 'MT': 2, 'MX': 3, 'MY': 1, 'NL': 241, 'NO': 31, 'NZ': 1, 'PL': 71, 'PT': 7, 'QA': 1, 'RO': 10, 'RU': 1, 'SE': 29, 'SG': 2, 'SI': 11, 'SK': 7, 'SX': 1, 'TH': 2, 'TR': 1, 'TW': 1, 'UA': 3, 'US': 75, 'ZA': 5}","{'normal': 2394, 'sponsor': 708, 'supersponsor': 350}","{'animator': 1050, 'artist': 1518, 'fursuiter': 1666, 'musician': 1118}"
