Date,ok,CurrentDateTimeUtc,LastChangeDateTimeUtc,Year,Convention,TotalCount,Age,Gender,Status,ShirtSize,Country,Sponsor,SpecialInterest
01/13/2025,True,2025-01-13T23:34:40.092+00:00,2025-01-13T23:34:40.092+00:00,2025,EF29,4,"{'47': 1, '51': 1, '52': 2}",{},"{'new': 3, 'paid': 1}",{'XL': 1},{'DE': 4},"{'normal': 3, 'supersponsor': 1}","{'animator': 1, 'artist': 2, 'fursuiter': 3, 'musician': 2}"
01/14/2025,True,2025-01-14T23:45:38.050+00:00,2025-01-14T23:45:38.050+00:00,2025,EF29,4,"{'47': 1, '51': 1, '52': 2}",{},"{'new': 3, 'paid': 1}",{'XL': 1},{'DE': 4},"{'normal': 3, 'supersponsor': 1}","{'animator': 1, 'artist': 2, 'fursuiter': 3, 'musician': 2}"
01/15/2025,True,2025-01-15T23:47:02.816+00:00,2025-01-15T23:47:02.816+00:00,2025,EF29,305,"{'20': 2, '21': 4, '22': 9, '23': 12, '24': 7, '25': 14, '26': 12, '27': 8, '28': 7, '29': 9, '30': 12, '31': 12, '32': 12, '33': 12, '34': 17, '35': 9, '36': 15, '37': 16, '38': 16, '39': 14, '40': 10, '41': 12, '42': 8, '43': 3, '44': 5, '45': 4, '46': 3, '47': 7, '48': 4, '49': 2, '50': 5, '51': 3, '52': 3, '53': 3, '54': 4, '55': 1, '56': 2, '58': 1, '59': 1, '60': 2, '63': 2, '65': 1}",{},"{'new': 4, 'approved': 264, 'paid': 37}","{'XS': 1, 'S': 9, 'M': 42, 'L': 58, 'XL': 42, 'XXL': 29}","{'AT': 13, 'BE': 2, 'CC': 1, 'CH': 13, 'CZ': 1, 'DE': 230, 'DK': 6, 'ES': 1, 'FI': 3, 'FR': 3, 'GB': 5, 'HU': 3, 'IE': 2, 'IT': 2, 'NL': 18, 'NO': 1, 'SI': 1}","{'normal': 197, 'sponsor': 53, 'supersponsor': 55}","{'animator': 52, 'artist': 89, 'fursuiter': 132, 'musician': 62}"
01/16/2025,True,2025-01-16T23:45:02.218+00:00,2025-01-16T23:45:02.218+00:00,2025,EF29,341,"{'19': 1, '20': 2, '21': 4, '22': 10, '23': 15, '24': 9, '25': 14, '26': 13, '27': 10, '28': 8, '29': 10, '30': 14, '31': 14, '32': 13, '33': 13, '34': 18, '35': 10, '36': 16, '37': 18, '38': 17, '39': 16, '40': 12, '41': 13, '42': 8, '43': 3, '44': 5, '45': 5, '46': 3, '47': 9, '48': 5, '49': 2, '50': 6, '51': 3, '52': 5, '53': 3, '54': 4, '55': 1, '56': 2, '58': 1, '59': 1, '60': 2, '63': 2, '65': 1}",{},"{'approved': 262, 'paid': 79}","{'XS': 2, 'S': 10, 'M': 49, 'L': 64, 'XL': 46, 'XXL': 31}","{'AT': 13, 'BE': 3, 'CC': 1, 'CH': 15, 'CZ': 1, 'DE': 259, 'DK': 6, 'ES': 1, 'FI': 4, 'FR': 4, 'GB': 5, 'HU': 3, 'IE': 2, 'IT': 3, 'NL': 19, 'NO': 1, 'SI': 1}","{'normal': 223, 'sponsor': 58, 'supersponsor': 60}","{'animator': 55, 'artist': 98, 'fursuiter': 143, 'musician': 68}"
01/17/2025,True,2025-01-17T23:45:01.567+00:00,2025-01-17T23:45:01.567+00:00,2025,EF29,349,"{'19': 1, '20': 2, '21': 4, '22': 11, '23': 15, '24': 10, '25': 15, '26': 13, '27': 10, '28': 8, '29': 11, '30': 15, '31': 15, '32': 13, '33': 13, '34': 18, '35': 12, '36': 16, '37': 18, '38': 17, '39': 16, '40': 12, '41': 13, '42': 8, '43': 3, '44': 5, '45': 5, '46': 3, '47': 9, '48': 5, '49': 2, '50': 6, '51': 3, '52': 5, '53': 3, '54': 4, '55': 1, '56': 2, '58': 1, '59': 1, '60': 2, '63': 2, '65': 1}",{},"{'new': 1, 'approved': 251, 'paid': 97}","{'XS': 2, 'S': 10, 'M': 51, 'L': 64, 'XL': 46, 'XXL': 32}","{'AT': 14, 'BE': 3, 'CC': 1, 'CH': 16, 'CZ': 1, 'DE': 265, 'DK': 6, 'ES': 1, 'FI': 4, 'FR': 4, 'GB': 5, 'HU': 3, 'IE': 2, 'IT': 3, 'NL': 19, 'NO': 1, 'SI': 1}","{'normal': 229, 'sponsor': 60, 'supersponsor': 60}","{'animator': 56, 'artist': 99, 'fursuiter': 145, 'musician': 70}"
01/18/2025,True,2025-01-18T23:45:01.357+00:00,2025-01-18T23:45:01.357+00:00,2025,EF29,356,"{'19': 1, '20': 2, '21': 4, '22': 11, '23': 15, '24': 11, '25': 15, '26': 14, '27': 10, '28': 8, '29': 11, '30': 15, '31': 15, '32': 13, '33': 13, '34': 18, '35': 13, '36': 16, '37': 18, '38': 19, '39': 16, '40': 12, '41': 14, '42': 8, '43': 3, '44': 5, '45': 5, '46': 3, '47': 9, '48': 5, '49': 2, '50': 6, '51': 3, '52': 5, '53': 3, '54': 4, '55': 1, '56': 2, '57': 1, '58': 1, '59': 1, '60': 2, '63': 2, '65': 1}",{},"{'new': 2, 'approved': 250, 'paid': 104}","{'XS': 2, 'S': 10, 'M': 51, 'L': 65, 'XL': 46, 'XXL': 32}","{'AT': 14, 'BE': 3, 'CC': 1, 'CH': 16, 'CZ': 1, 'DE': 272, 'DK': 6, 'ES': 1, 'FI': 4, 'FR': 4, 'GB': 5, 'HU': 3, 'IE': 2, 'IT': 3, 'NL': 19, 'NO': 1, 'SI': 1}","{'normal': 235, 'sponsor': 60, 'supersponsor': 61}","{'animator': 59, 'artist': 103, 'fursuiter': 149, 'musician': 72}"
01/19/2025,True,2025-01-19T23:46:01.609+00:00,2025-01-19T23:46:01.609+00:00,2025,EF29,363,"{'19': 1, '20': 2, '21': 5, '22': 11, '23': 15, '24': 13, '25': 15, '26': 14, '27': 10, '28': 8, '29': 11, '30': 15, '31': 15, '32': 13, '33': 13, '34': 18, '35': 13, '36': 17, '37': 18, '38': 19, '39': 16, '40': 12, '41': 15, '42': 8, '43': 3, '44': 6, '45': 6, '46': 3, '47': 9, '48': 5, '49': 2, '50': 6, '51': 3, '52': 5, '53': 3, '54': 4, '55': 1, '56': 2, '57': 1, '58': 1, '59': 1, '60': 2, '63': 2, '65': 1}",{},"{'approved': 249, 'paid': 114}","{'XS': 2, 'S': 10, 'M': 52, 'L': 65, 'XL': 46, 'XXL': 33}","{'AT': 14, 'AU': 1, 'BE': 3, 'CC': 1, 'CH': 16, 'CZ': 1, 'DE': 276, 'DK': 6, 'ES': 1, 'FI': 4, 'FR': 4, 'GB': 6, 'HU': 3, 'IE': 2, 'IT': 3, 'LU': 1, 'NL': 19, 'NO': 1, 'SI': 1}","{'normal': 242, 'sponsor': 60, 'supersponsor': 61}","{'animator': 59, 'artist': 104, 'fursuiter': 150, 'musician': 72}"
01/20/2025,True,2025-01-20T23:45:01.251+00:00,2025-01-20T23:45:01.251+00:00,2025,EF29,364,"{'19': 1, '20': 2, '21': 5, '22': 11, '23': 15, '24': 13, '25': 15, '26': 14, '27': 10, '28': 9, '29': 11, '30': 15, '31': 15, '32': 13, '33': 13, '34': 18, '35': 13, '36': 17, '37': 18, '38': 19, '39': 16, '40': 12, '41': 15, '42': 8, '43': 3, '44': 6, '45': 6, '46': 3, '47': 9, '48': 5, '49': 2, '50': 6, '51': 3, '52': 5, '53': 3, '54': 4, '55': 1, '56': 2, '57': 1, '58': 1, '59': 1, '60': 2, '63': 2, '65': 1}",{},"{'approved': 233, 'paid': 131}","{'XS': 2, 'S': 10, 'M': 52, 'L': 65, 'XL': 46, 'XXL': 34}","{'AT': 14, 'AU': 1, 'BE': 3, 'CC': 1, 'CH': 17, 'CZ': 1, 'DE': 276, 'DK': 6, 'ES': 1, 'FI': 4, 'FR': 4, 'GB': 6, 'HU': 3, 'IE': 2, 'IT': 3, 'LU': 1, 'NL': 19, 'NO': 1, 'SI': 1}","{'normal': 242, 'sponsor': 61, 'supersponsor': 61}","{'animator': 59, 'artist': 104, 'fursuiter': 151, 'musician': 73}"
01/21/2025,True,2025-01-21T23:45:01.560+00:00,2025-01-21T23:45:01.560+00:00,2025,EF29,364,"{'19': 1, '20': 2, '21': 5, '22': 11, '23': 15, '24': 13, '25': 15, '26': 14, '27': 10, '28': 9, '29': 11, '30': 15, '31': 15, '32': 13, '33': 13, '34': 18, '35': 13, '36': 17, '37': 18, '38': 19, '39': 16, '40': 12, '41': 15, '42': 8, '43': 3, '44': 6, '45': 6, '46': 3, '47': 9, '48': 5, '49': 2, '50': 6, '51': 3, '52': 5, '53': 3, '54': 4, '55': 1, '56': 2, '57': 1, '58': 1, '59': 1, '60': 2, '63': 2, '65': 1}",{},"{'approved': 220, 'paid': 144}","{'XS': 2, 'S': 10, 'M': 52, 'L': 65, 'XL': 46, 'XXL': 34}","{'AT': 14, 'AU': 1, 'BE': 3, 'CC': 1, 'CH': 17, 'CZ': 1, 'DE': 276, 'DK': 6, 'ES': 1, 'FI': 4, 'FR': 4, 'GB': 6, 'HU': 3, 'IE': 2, 'IT': 3, 'LU': 1, 'NL': 19, 'NO': 1, 'SI': 1}","{'normal': 242, 'sponsor': 61, 'supersponsor': 61}","{'animator': 59, 'artist': 104, 'fursuiter': 151, 'musician': 73}"
01/22/2025,True,2025-01-22T23:46:05.510+00:00,2025-01-22T23:46:05.510+00:00,2025,EF29,364,"{'19': 1, '20': 2, '21': 5, '22': 11, '23': 15, '24': 13, '25': 15, '26': 14, '27': 10, '28': 9, '29': 11, '30': 15, '31': 15, '32': 13, '33': 13, '34': 18, '35': 13, '36': 17, '37': 18, '38': 19, '39': 16, '40': 12, '41': 15, '42': 8, '43': 3, '44': 6, '45': 6, '46': 3, '47': 9, '48': 5, '49': 2, '50': 6, '51': 3, '52': 5, '53': 3, '54': 4, '55': 1, '56': 2, '57': 1, '58': 1, '59': 1, '60': 2, '63': 2, '65': 1}",{},"{'approved': 211, 'paid': 153}","{'XS': 2, 'S': 10, 'M': 52, 'L': 65, 'XL': 46, 'XXL': 34}","{'AT': 14, 'AU': 1, 'BE': 3, 'CC': 1, 'CH': 17, 'CZ': 1, 'DE': 276, 'DK': 6, 'ES': 1, 'FI': 4, 'FR': 4, 'GB': 6, 'HU': 3, 'IE': 2, 'IT': 3, 'LU': 1, 'NL': 19, 'NO': 1, 'SI': 1}","{'normal': 242, 'sponsor': 61, 'supersponsor': 61}","{'animator': 59, 'artist': 104, 'fursuiter': 151, 'musician': 73}"
01/23/2025,True,2025-01-23T23:45:02.243+00:00,2025-01-23T23:45:02.243+00:00,2025,EF29,366,"{'19': 1, '20': 2, '21': 5, '22': 11, '23': 15, '24': 13, '25': 15, '26': 14, '27': 10, '28': 9, '29': 11, '30': 15, '31': 15, '32': 13, '33': 13, '34': 18, '35': 13, '36': 17, '37': 18, '38': 19, '39': 16, '40': 12, '41': 15, '42': 8, '43': 3, '44': 6, '45': 6, '46': 4, '47': 9, '48': 5, '49': 2, '50': 7, '51': 3, '52': 5, '53': 3, '54': 4, '55': 1, '56': 2, '57': 1, '58': 1, '59': 1, '60': 2, '63': 2, '65': 1}",{},"{'approved': 209, 'paid': 157}","{'XS': 2, 'S': 10, 'M': 52, 'L': 65, 'XL': 46, 'XXL': 34}","{'AT': 14, 'AU': 1, 'BE': 3, 'CC': 1, 'CH': 17, 'CZ': 1, 'DE': 278, 'DK': 6, 'ES': 1, 'FI': 4, 'FR': 4, 'GB': 6, 'HU': 3, 'IE': 2, 'IT': 3, 'LU': 1, 'NL': 19, 'NO': 1, 'SI': 1}","{'normal': 243, 'sponsor': 61, 'supersponsor': 62}","{'animator': 60, 'artist': 105, 'fursuiter': 151, 'musician': 73}"
01/24/2025,True,2025-01-24T23:46:16.690+00:00,2025-01-24T23:46:16.690+00:00,2025,EF29,366,"{'19': 1, '20': 2, '21': 5, '22': 11, '23': 15, '24': 13, '25': 15, '26': 14, '27': 10, '28': 9, '29': 11, '30': 15, '31': 15, '32': 13, '33': 13, '34': 18, '35': 13, '36': 17, '37': 18, '38': 19, '39': 16, '40': 12, '41': 15, '42': 8, '43': 3, '44': 6, '45': 6, '46': 4, '47': 9, '48': 5, '49': 2, '50': 7, '51': 3, '52': 5, '53': 3, '54': 4, '55': 1, '56': 2, '57': 1, '58': 1, '59': 1, '60': 2, '63': 2, '65': 1}",{},"{'approved': 194, 'paid': 172}","{'XS': 2, 'S': 10, 'M': 52, 'L': 66, 'XL': 46, 'XXL': 34}","{'AT': 14, 'AU': 1, 'BE': 3, 'CC': 1, 'CH': 17, 'CZ': 1, 'DE': 278, 'DK': 6, 'ES': 1, 'FI': 4, 'FR': 4, 'GB': 6, 'HU': 3, 'IE': 2, 'IT': 3, 'LU': 1, 'NL': 19, 'NO': 1, 'SI': 1}","{'normal': 244, 'sponsor': 61, 'supersponsor': 61}","{'animator': 60, 'artist': 105, 'fursuiter': 151, 'musician': 73}"
01/25/2025,True,2025-01-25T23:45:01.348+00:00,2025-01-25T23:45:01.348+00:00,2025,EF29,367,"{'19': 1, '20': 2, '21': 5, '22': 11, '23': 15, '24': 13, '25': 15, '26': 14, '27': 11, '28': 9, '29': 11, '30': 15, '31': 15, '32': 13, '33': 13, '34': 18, '35': 13, '36': 17, '37': 18, '38': 19, '39': 16, '40': 12, '41': 15, '42': 8, '43': 3, '44': 6, '45': 6, '46': 4, '47': 9, '48': 5, '49': 2, '50': 7, '51': 3, '52': 5, '53': 3, '54': 4, '55': 1, '56': 2, '57': 1, '58': 1, '59': 1, '60': 2, '63': 2, '65': 1}",{},"{'new': 1, 'approved': 189, 'paid': 177}","{'XS': 2, 'S': 10, 'M': 52, 'L': 66, 'XL': 47, 'XXL': 34}","{'AT': 14, 'AU': 1, 'BE': 3, 'CC': 1, 'CH': 17, 'CZ': 1, 'DE': 279, 'DK': 6, 'ES': 1, 'FI': 4, 'FR': 4, 'GB': 6, 'HU': 3, 'IE': 2, 'IT': 3, 'LU': 1, 'NL': 19, 'NO': 1, 'SI': 1}","{'normal': 245, 'sponsor': 61, 'supersponsor': 61}","{'animator': 60, 'artist': 105, 'fursuiter': 151, 'musician': 73}"
01/26/2025,True,2025-01-26T23:45:01.952+00:00,2025-01-26T23:45:01.952+00:00,2025,EF29,370,"{'19': 1, '20': 2, '21': 5, '22': 11, '23': 15, '24': 13, '25': 15, '26': 15, '27': 11, '28': 9, '29': 11, '30': 15, '31': 15, '32': 13, '33': 13, '34': 18, '35': 14, '36': 17, '37': 18, '38': 19, '39': 16, '40': 12, '41': 15, '42': 8, '43': 3, '44': 6, '45': 6, '46': 4, '47': 9, '48': 6, '49': 2, '50': 7, '51': 3, '52': 5, '53': 3, '54': 4, '55': 1, '56': 2, '57': 1, '58': 1, '59': 1, '60': 2, '63': 2, '65': 1}",{},"{'approved': 187, 'paid': 183}","{'XS': 2, 'S': 10, 'M': 52, 'L': 66, 'XL': 48, 'XXL': 34}","{'AT': 14, 'AU': 1, 'BE': 3, 'CC': 1, 'CH': 17, 'CZ': 1, 'DE': 282, 'DK': 6, 'ES': 1, 'FI': 4, 'FR': 4, 'GB': 6, 'HU': 3, 'IE': 2, 'IT': 3, 'LU': 1, 'NL': 19, 'NO': 1, 'SI': 1}","{'normal': 248, 'sponsor': 61, 'supersponsor': 61}","{'animator': 60, 'artist': 106, 'fursuiter': 151, 'musician': 73}"
01/27/2025,True,2025-01-27T23:45:01.415+00:00,2025-01-27T23:45:01.415+00:00,2025,EF29,370,"{'19': 1, '20': 2, '21': 5, '22': 11, '23': 15, '24': 13, '25': 15, '26': 15, '27': 11, '28': 9, '29': 11, '30': 15, '31': 15, '32': 13, '33': 13, '34': 18, '35': 14, '36': 17, '37': 18, '38': 19, '39': 16, '40': 12, '41': 15, '42': 8, '43': 3, '44': 6, '45': 6, '46': 4, '47': 9, '48': 6, '49': 2, '50': 7, '51': 3, '52': 5, '53': 3, '54': 4, '55': 1, '56': 2, '57': 1, '58': 1, '59': 1, '60': 2, '63': 2, '65': 1}",{},"{'approved': 174, 'paid': 196}","{'XS': 2, 'S': 10, 'M': 52, 'L': 66, 'XL': 48, 'XXL': 34}","{'AT': 14, 'AU': 1, 'BE': 3, 'CC': 1, 'CH': 17, 'CZ': 1, 'DE': 282, 'DK': 6, 'ES': 1, 'FI': 4, 'FR': 4, 'GB': 6, 'HU': 3, 'IE': 2, 'IT': 3, 'LU': 1, 'NL': 19, 'NO': 1, 'SI': 1}","{'normal': 248, 'sponsor': 61, 'supersponsor': 61}","{'animator': 60, 'artist': 106, 'fursuiter': 151, 'musician': 73}"
01/28/2025,True,2025-01-28T23:45:01.490+00:00,2025-01-28T23:45:01.490+00:00,2025,EF29,372,"{'19': 1, '20': 2, '21': 5, '22': 11, '23': 15, '24': 13, '25': 15, '26': 15, '27': 11, '28': 9, '29': 11, '30': 15, '31': 15, '32': 13, '33': 13, '34': 18, '35': 14, '36': 17, '37': 18, '38': 19, '39': 17, '40': 12, '41': 16, '42': 8, '43': 3, '44': 6, '45': 6, '46': 4, '47': 9, '48': 6, '49': 2, '50': 7, '51': 3, '52': 5, '53': 3, '54': 4, '55': 1, '56': 2, '57': 1, '58': 1, '59': 1, '60': 2, '63': 2, '65': 1}",{},"{'new': 2, 'approved': 165, 'paid': 205}","{'XS': 2, 'S': 10, 'M': 52, 'L': 67, 'XL': 48, 'XXL': 34}","{'AT': 14, 'AU': 1, 'BE': 3, 'CC': 1, 'CH': 17, 'CZ': 1, 'DE': 283, 'DK': 6, 'ES': 1, 'FI': 4, 'FR': 4, 'GB': 6, 'HU': 3, 'IE': 2, 'IT': 3, 'LU': 1, 'NL': 20, 'NO': 1, 'SI': 1}","{'normal': 248, 'sponsor': 62, 'supersponsor': 62}","{'animator': 60, 'artist': 106, 'fursuiter': 152, 'musician': 74}"
01/29/2025,True,2025-01-29T23:45:01.717+00:00,2025-01-29T23:45:01.717+00:00,2025,EF29,373,"{'19': 1, '20': 2, '21': 5, '22': 11, '23': 15, '24': 13, '25': 15, '26': 15, '27': 11, '28': 9, '29': 11, '30': 15, '31': 15, '32': 13, '33': 13, '34': 18, '35': 14, '36': 17, '37': 18, '38': 19, '39': 17, '40': 12, '41': 16, '42': 8, '43': 4, '44': 6, '45': 6, '46': 4, '47': 9, '48': 6, '49': 2, '50': 7, '51': 3, '52': 5, '53': 3, '54': 4, '55': 1, '56': 2, '57': 1, '58': 1, '59': 1, '60': 2, '63': 2, '65': 1}",{},"{'new': 1, 'approved': 161, 'paid': 211}","{'XS': 2, 'S': 10, 'M': 53, 'L': 67, 'XL': 48, 'XXL': 34}","{'AT': 14, 'AU': 1, 'BE': 3, 'CC': 1, 'CH': 17, 'CZ': 1, 'DE': 283, 'DK': 6, 'ES': 1, 'FI': 4, 'FR': 4, 'GB': 7, 'HU': 3, 'IE': 2, 'IT': 3, 'LU': 1, 'NL': 20, 'NO': 1, 'SI': 1}","{'normal': 248, 'sponsor': 63, 'supersponsor': 62}","{'animator': 60, 'artist': 108, 'fursuiter': 153, 'musician': 74}"
01/30/2025,True,2025-01-30T23:46:29.071+00:00,2025-01-30T23:46:29.071+00:00,2025,EF29,377,"{'19': 1, '20': 2, '21': 5, '22': 11, '23': 16, '24': 13, '25': 16, '26': 15, '27': 11, '28': 9, '29': 11, '30': 15, '31': 15, '32': 13, '33': 13, '34': 19, '35': 14, '36': 17, '37': 18, '38': 19, '39': 17, '40': 12, '41': 16, '42': 8, '43': 4, '44': 6, '45': 7, '46': 4, '47': 9, '48': 6, '49': 2, '50': 7, '51': 3, '52': 5, '53': 3, '54': 4, '55': 1, '56': 2, '57': 1, '58': 1, '59': 1, '60': 2, '63': 2, '65': 1}",{},"{'new': 4, 'approved': 157, 'paid': 216}","{'XS': 2, 'S': 10, 'M': 56, 'L': 67, 'XL': 48, 'XXL': 34}","{'AT': 14, 'AU': 1, 'BE': 3, 'CC': 1, 'CH': 17, 'CZ': 1, 'DE': 286, 'DK': 6, 'ES': 1, 'FI': 4, 'FR': 4, 'GB': 7, 'HU': 3, 'IE': 2, 'IT': 3, 'LU': 1, 'NL': 20, 'NO': 1, 'PL': 1, 'SI': 1}","{'normal': 252, 'sponsor': 63, 'supersponsor': 62}","{'animator': 61, 'artist': 112, 'fursuiter': 154, 'musician': 75}"
01/31/2025,True,2025-01-31T23:45:01.926+00:00,2025-01-31T23:45:01.926+00:00,2025,EF29,377,"{'19': 1, '20': 2, '21': 5, '22': 11, '23': 16, '24': 13, '25': 16, '26': 15, '27': 11, '28': 9, '29': 11, '30': 15, '31': 15, '32': 13, '33': 13, '34': 19, '35': 14, '36': 17, '37': 18, '38': 19, '39': 17, '40': 12, '41': 16, '42': 8, '43': 4, '44': 6, '45': 7, '46': 4, '47': 9, '48': 6, '49': 2, '50': 7, '51': 3, '52': 5, '53': 3, '54': 4, '55': 1, '56': 2, '57': 1, '58': 1, '59': 1, '60': 2, '63': 2, '65': 1}",{},"{'approved': 154, 'paid': 223}","{'XS': 2, 'S': 10, 'M': 56, 'L': 67, 'XL': 48, 'XXL': 34}","{'AT': 14, 'AU': 1, 'BE': 3, 'CC': 1, 'CH': 17, 'CZ': 1, 'DE': 286, 'DK': 6, 'ES': 1, 'FI': 4, 'FR': 4, 'GB': 7, 'HU': 3, 'IE': 2, 'IT': 3, 'LU': 1, 'NL': 20, 'NO': 1, 'PL': 1, 'SI': 1}","{'normal': 253, 'sponsor': 63, 'supersponsor': 61}","{'animator': 61, 'artist': 112, 'fursuiter': 154, 'musician': 75}"
02/01/2025,True,2025-02-01T23:45:01.494+00:00,2025-02-01T23:45:01.494+00:00,2025,EF29,382,"{'19': 1, '20': 2, '21': 5, '22': 11, '23': 17, '24': 13, '25': 16, '26': 15, '27': 12, '28': 9, '29': 11, '30': 15, '31': 15, '32': 13, '33': 13, '34': 19, '35': 14, '36': 18, '37': 18, '38': 19, '39': 17, '40': 12, '41': 16, '42': 9, '43': 4, '44': 6, '45': 7, '46': 4, '47': 9, '48': 6, '49': 2, '50': 7, '51': 4, '52': 5, '53': 3, '54': 4, '55': 1, '56': 2, '57': 1, '58': 1, '59': 1, '60': 2, '63': 2, '65': 1}",{},"{'new': 2, 'approved': 149, 'paid': 231}","{'XS': 2, 'S': 10, 'M': 57, 'L': 67, 'XL': 49, 'XXL': 36}","{'AT': 14, 'AU': 1, 'BE': 3, 'CC': 1, 'CH': 17, 'CZ': 1, 'DE': 289, 'DK': 6, 'ES': 1, 'FI': 4, 'FR': 4, 'GB': 8, 'HU': 3, 'IE': 2, 'IT': 3, 'LU': 1, 'NL': 21, 'NO': 1, 'PL': 1, 'SI': 1}","{'normal': 254, 'sponsor': 64, 'supersponsor': 64}","{'animator': 63, 'artist': 115, 'fursuiter': 157, 'musician': 76}"
02/02/2025,True,2025-02-02T23:45:02.147+00:00,2025-02-02T23:45:02.147+00:00,2025,EF29,384,"{'19': 1, '20': 2, '21': 5, '22': 11, '23': 17, '24': 13, '25': 16, '26': 15, '27': 13, '28': 9, '29': 11, '30': 15, '31': 15, '32': 13, '33': 13, '34': 20, '35': 14, '36': 18, '37': 18, '38': 19, '39': 17, '40': 12, '41': 16, '42': 9, '43': 4, '44': 6, '45': 7, '46': 4, '47': 9, '48': 6, '49': 2, '50': 7, '51': 4, '52': 5, '53': 3, '54': 4, '55': 1, '56': 2, '57': 1, '58': 1, '59': 1, '60': 2, '63': 2, '65': 1}",{},"{'approved': 148, 'paid': 236}","{'XS': 2, 'S': 10, 'M': 57, 'L': 67, 'XL': 49, 'XXL': 36}","{'AT': 14, 'AU': 1, 'BE': 3, 'CC': 1, 'CH': 17, 'CZ': 1, 'DE': 291, 'DK': 6, 'ES': 1, 'FI': 4, 'FR': 4, 'GB': 8, 'HU': 3, 'IE': 2, 'IT': 3, 'LU': 1, 'NL': 21, 'NO': 1, 'PL': 1, 'SI': 1}","{'normal': 256, 'sponsor': 64, 'supersponsor': 64}","{'animator': 63, 'artist': 115, 'fursuiter': 157, 'musician': 76}"
02/03/2025,True,2025-02-03T23:45:02.080+00:00,2025-02-03T23:45:02.080+00:00,2025,EF29,385,"{'19': 1, '20': 2, '21': 5, '22': 11, '23': 17, '24': 13, '25': 16, '26': 15, '27': 13, '28': 9, '29': 11, '30': 16, '31': 15, '32': 13, '33': 13, '34': 20, '35': 14, '36': 18, '37': 18, '38': 19, '39': 17, '40': 12, '41': 16, '42': 9, '43': 4, '44': 6, '45': 7, '46': 4, '47': 9, '48': 6, '49': 2, '50': 7, '51': 4, '52': 5, '53': 3, '54': 4, '55': 1, '56': 2, '57': 1, '58': 1, '59': 1, '60': 2, '63': 2, '65': 1}",{},"{'new': 1, 'approved': 142, 'paid': 242}","{'XS': 2, 'S': 10, 'M': 57, 'L': 67, 'XL': 49, 'XXL': 36}","{'AT': 14, 'AU': 1, 'BE': 3, 'CC': 1, 'CH': 17, 'CZ': 1, 'DE': 292, 'DK': 6, 'ES': 1, 'FI': 4, 'FR': 4, 'GB': 8, 'HU': 3, 'IE': 2, 'IT': 3, 'LU': 1, 'NL': 21, 'NO': 1, 'PL': 1, 'SI': 1}","{'normal': 257, 'sponsor': 64, 'supersponsor': 64}","{'animator': 63, 'artist': 115, 'fursuiter': 158, 'musician': 76}"
02/04/2025,True,2025-02-04T23:46:34.219+00:00,2025-02-04T23:46:34.219+00:00,2025,EF29,386,"{'19': 1, '20': 2, '21': 5, '22': 11, '23': 17, '24': 13, '25': 16, '26': 15, '27': 13, '28': 9, '29': 11, '30': 16, '31': 15, '32': 13, '33': 14, '34': 20, '35': 14, '36': 18, '37': 18, '38': 19, '39': 17, '40': 12, '41': 16, '42': 9, '43': 4, '44': 6, '45': 7, '46': 4, '47': 9, '48': 6, '49': 2, '50': 7, '51': 4, '52': 5, '53': 3, '54': 4, '55': 1, '56': 2, '57': 1, '58': 1, '59': 1, '60': 2, '63': 2, '65': 1}",{},"{'new': 1, 'approved': 134, 'paid': 251}","{'XS': 2, 'S': 10, 'M': 58, 'L': 67, 'XL': 49, 'XXL': 36}","{'AT': 14, 'AU': 1, 'BE': 3, 'CC': 1, 'CH': 17, 'CZ': 1, 'DE': 292, 'DK': 6, 'ES': 1, 'FI': 4, 'FR': 4, 'GB': 8, 'HU': 4, 'IE': 2, 'IT': 3, 'LU': 1, 'NL': 21, 'NO': 1, 'PL': 1, 'SI': 1}","{'normal': 257, 'sponsor': 65, 'supersponsor': 64}","{'animator': 64, 'artist': 116, 'fursuiter': 159, 'musician': 77}"
02/05/2025,True,2025-02-05T23:46:36.647+00:00,2025-02-05T23:46:36.647+00:00,2025,EF29,386,"{'19': 1, '20': 2, '21': 5, '22': 11, '23': 17, '24': 13, '25': 16, '26': 15, '27': 13, '28': 9, '29': 11, '30': 16, '31': 15, '32': 13, '33': 14, '34': 20, '35': 14, '36': 18, '37': 18, '38': 19, '39': 17, '40': 12, '41': 16, '42': 9, '43': 4, '44': 6, '45': 7, '46': 4, '47': 9, '48': 6, '49': 2, '50': 7, '51': 4, '52': 5, '53': 3, '54': 4, '55': 1, '56': 2, '57': 1, '58': 1, '59': 1, '60': 2, '63': 2, '65': 1}",{},"{'approved': 128, 'paid': 258}","{'XS': 2, 'S': 10, 'M': 58, 'L': 67, 'XL': 48, 'XXL': 37}","{'AT': 14, 'AU': 1, 'BE': 3, 'CC': 1, 'CH': 17, 'CZ': 1, 'DE': 292, 'DK': 6, 'ES': 1, 'FI': 4, 'FR': 4, 'GB': 8, 'HU': 4, 'IE': 2, 'IT': 3, 'LU': 1, 'NL': 21, 'NO': 1, 'PL': 1, 'SI': 1}","{'normal': 257, 'sponsor': 65, 'supersponsor': 64}","{'animator': 64, 'artist': 116, 'fursuiter': 159, 'musician': 77}"
02/06/2025,True,2025-02-06T23:45:01.886+00:00,2025-02-06T23:45:01.886+00:00,2025,EF29,386,"{'19': 1, '20': 2, '21': 5, '22': 11, '23': 17, '24': 13, '25': 16, '26': 15, '27': 13, '28': 9, '29': 11, '30': 16, '31': 15, '32': 13, '33': 14, '34': 20, '35': 14, '36': 18, '37': 18, '38': 19, '39': 17, '40': 12, '41': 16, '42': 9, '43': 4, '44': 6, '45': 7, '46': 4, '47': 9, '48': 6, '49': 2, '50': 7, '51': 4, '52': 5, '53': 3, '54': 4, '55': 1, '56': 2, '57': 1, '58': 1, '59': 1, '60': 2, '63': 2, '65': 1}",{},"{'approved': 127, 'paid': 259}","{'XS': 2, 'S': 10, 'M': 58, 'L': 67, 'XL': 48, 'XXL': 37}","{'AT': 14, 'AU': 1, 'BE': 3, 'CC': 1, 'CH': 17, 'CZ': 1, 'DE': 292, 'DK': 6, 'ES': 1, 'FI': 4, 'FR': 4, 'GB': 8, 'HU': 4, 'IE': 2, 'IT': 3, 'LU': 1, 'NL': 21, 'NO': 1, 'PL': 1, 'SI': 1}","{'normal': 257, 'sponsor': 65, 'supersponsor': 64}","{'animator': 64, 'artist': 116, 'fursuiter': 159, 'musician': 77}"
02/07/2025,True,2025-02-07T23:45:02.384+00:00,2025-02-07T23:45:02.384+00:00,2025,EF29,386,"{'19': 1, '20': 2, '21': 5, '22': 11, '23': 17, '24': 13, '25': 16, '26': 15, '27': 13, '28': 9, '29': 11, '30': 16, '31': 15, '32': 13, '33': 14, '34': 20, '35': 14, '36': 18, '37': 18, '38': 19, '39': 17, '40': 12, '41': 16, '42': 9, '43': 4, '44': 6, '45': 7, '46': 4, '47': 9, '48': 6, '49': 2, '50': 7, '51': 4, '52': 5, '53': 3, '54': 4, '55': 1, '56': 2, '57': 1, '58': 1, '59': 1, '60': 2, '63': 2, '65': 1}",{},"{'approved': 124, 'paid': 262}","{'XS': 2, 'S': 10, 'M': 58, 'L': 67, 'XL': 48, 'XXL': 37}","{'AT': 14, 'AU': 1, 'BE': 3, 'CC': 1, 'CH': 17, 'CZ': 1, 'DE': 292, 'DK': 6, 'ES': 1, 'FI': 4, 'FR': 4, 'GB': 8, 'HU': 4, 'IE': 2, 'IT': 3, 'LU': 1, 'NL': 21, 'NO': 1, 'PL': 1, 'SI': 1}","{'normal': 257, 'sponsor': 65, 'supersponsor': 64}","{'animator': 64, 'artist': 116, 'fursuiter': 159, 'musician': 77}"
02/08/2025,True,2025-02-08T23:45:03.908+00:00,2025-02-08T23:45:03.908+00:00,2025,EF29,390,"{'19': 1, '20': 2, '21': 6, '22': 11, '23': 17, '24': 13, '25': 16, '26': 15, '27': 13, '28': 10, '29': 11, '30': 16, '31': 15, '32': 14, '33': 14, '34': 20, '35': 14, '36': 18, '37': 18, '38': 19, '39': 17, '40': 12, '41': 16, '42': 9, '43': 4, '44': 6, '45': 8, '46': 4, '47': 9, '48': 6, '49': 2, '50': 7, '51': 4, '52': 5, '53': 3, '54': 4, '55': 1, '56': 2, '57': 1, '58': 1, '59': 1, '60': 2, '63': 2, '65': 1}",{},"{'new': 4, 'approved': 122, 'paid': 264}","{'XS': 2, 'S': 10, 'M': 58, 'L': 67, 'XL': 49, 'XXL': 37}","{'AT': 14, 'AU': 1, 'BE': 3, 'CC': 1, 'CH': 17, 'CZ': 1, 'DE': 295, 'DK': 7, 'ES': 1, 'FI': 4, 'FR': 4, 'GB': 8, 'HU': 4, 'IE': 2, 'IT': 3, 'LU': 1, 'NL': 21, 'NO': 1, 'PL': 1, 'SI': 1}","{'normal': 259, 'sponsor': 65, 'supersponsor': 66}","{'animator': 64, 'artist': 116, 'fursuiter': 159, 'musician': 77}"
02/09/2025,True,2025-02-09T23:46:02.200+00:00,2025-02-09T23:46:02.200+00:00,2025,EF29,400,"{'19': 1, '20': 2, '21': 6, '22': 11, '23': 18, '24': 13, '25': 19, '26': 15, '27': 13, '28': 10, '29': 12, '30': 16, '31': 15, '32': 14, '33': 15, '34': 20, '35': 15, '36': 18, '37': 19, '38': 21, '39': 17, '40': 12, '41': 16, '42': 9, '43': 4, '44': 6, '45': 8, '46': 4, '47': 9, '48': 6, '49': 2, '50': 7, '51': 4, '52': 5, '53': 3, '54': 4, '55': 1, '56': 2, '57': 1, '58': 1, '59': 1, '60': 2, '63': 2, '65': 1}",{},"{'new': 7, 'approved': 127, 'paid': 266}","{'XS': 2, 'S': 10, 'M': 58, 'L': 69, 'XL': 54, 'XXL': 37}","{'AT': 15, 'AU': 1, 'BE': 3, 'CC': 1, 'CH': 17, 'CZ': 1, 'DE': 303, 'DK': 7, 'ES': 1, 'FI': 4, 'FR': 4, 'GB': 8, 'HU': 4, 'IE': 2, 'IT': 3, 'LU': 1, 'NL': 22, 'NO': 1, 'PL': 1, 'SI': 1}","{'normal': 265, 'sponsor': 68, 'supersponsor': 67}","{'animator': 65, 'artist': 119, 'fursuiter': 163, 'musician': 79}"
02/10/2025,True,2025-02-10T23:45:01.352+00:00,2025-02-10T23:45:01.352+00:00,2025,EF29,404,"{'19': 1, '20': 2, '21': 6, '22': 11, '23': 18, '24': 14, '25': 19, '26': 15, '27': 14, '28': 10, '29': 12, '30': 16, '31': 16, '32': 14, '33': 15, '34': 20, '35': 15, '36': 18, '37': 19, '38': 21, '39': 17, '40': 12, '41': 16, '42': 9, '43': 4, '44': 6, '45': 8, '46': 4, '47': 9, '48': 6, '49': 2, '50': 7, '51': 4, '52': 5, '53': 4, '54': 4, '55': 1, '56': 2, '57': 1, '58': 1, '59': 1, '60': 2, '63': 2, '65': 1}",{},"{'new': 2, 'approved': 134, 'paid': 268}","{'XS': 2, 'S': 10, 'M': 60, 'L': 70, 'XL': 55, 'XXL': 37}","{'AT': 15, 'AU': 1, 'BE': 3, 'CC': 1, 'CH': 18, 'CZ': 1, 'DE': 306, 'DK': 7, 'ES': 1, 'FI': 4, 'FR': 4, 'GB': 8, 'HU': 4, 'IE': 2, 'IT': 3, 'LU': 1, 'NL': 22, 'NO': 1, 'PL': 1, 'SI': 1}","{'normal': 267, 'sponsor': 69, 'supersponsor': 68}","{'animator': 66, 'artist': 120, 'fursuiter': 164, 'musician': 80}"
02/11/2025,True,2025-02-11T23:45:01.136+00:00,2025-02-11T23:45:01.136+00:00,2025,EF29,405,"{'19': 1, '20': 2, '21': 6, '22': 11, '23': 18, '24': 14, '25': 19, '26': 15, '27': 14, '28': 10, '29': 12, '30': 16, '31': 17, '32': 14, '33': 15, '34': 20, '35': 15, '36': 18, '37': 19, '38': 21, '39': 17, '40': 12, '41': 16, '42': 9, '43': 4, '44': 6, '45': 8, '46': 4, '47': 9, '48': 6, '49': 2, '50': 7, '51': 4, '52': 5, '53': 4, '54': 4, '55': 1, '56': 2, '57': 1, '58': 1, '59': 1, '60': 2, '63': 2, '65': 1}",{},"{'approved': 130, 'paid': 275}","{'XS': 2, 'S': 10, 'M': 60, 'L': 70, 'XL': 55, 'XXL': 37}","{'AT': 15, 'AU': 1, 'BE': 3, 'CC': 1, 'CH': 18, 'CZ': 1, 'DE': 307, 'DK': 7, 'ES': 1, 'FI': 4, 'FR': 4, 'GB': 8, 'HU': 4, 'IE': 2, 'IT': 3, 'LU': 1, 'NL': 22, 'NO': 1, 'PL': 1, 'SI': 1}","{'normal': 268, 'sponsor': 69, 'supersponsor': 68}","{'animator': 66, 'artist': 120, 'fursuiter': 164, 'musician': 81}"
02/12/2025,True,2025-02-12T23:45:02.047+00:00,2025-02-12T23:45:02.047+00:00,2025,EF29,407,"{'19': 1, '20': 2, '21': 6, '22': 11, '23': 19, '24': 14, '25': 19, '26': 15, '27': 14, '28': 10, '29': 12, '30': 16, '31': 17, '32': 14, '33': 15, '34': 20, '35': 15, '36': 18, '37': 20, '38': 21, '39': 17, '40': 12, '41': 16, '42': 9, '43': 4, '44': 6, '45': 8, '46': 4, '47': 9, '48': 6, '49': 2, '50': 7, '51': 4, '52': 5, '53': 4, '54': 4, '55': 1, '56': 2, '57': 1, '58': 1, '59': 1, '60': 2, '63': 2, '65': 1}",{},"{'new': 1, 'approved': 128, 'paid': 278}","{'XS': 2, 'S': 10, 'M': 60, 'L': 71, 'XL': 56, 'XXL': 37}","{'AT': 15, 'AU': 1, 'BE': 3, 'CC': 1, 'CH': 18, 'CZ': 1, 'DE': 309, 'DK': 7, 'ES': 1, 'FI': 4, 'FR': 4, 'GB': 8, 'HU': 4, 'IE': 2, 'IT': 3, 'LU': 1, 'NL': 22, 'NO': 1, 'PL': 1, 'SI': 1}","{'normal': 270, 'sponsor': 69, 'supersponsor': 68}","{'animator': 66, 'artist': 120, 'fursuiter': 165, 'musician': 81}"
02/13/2025,True,2025-02-13T23:46:21.395+00:00,2025-02-13T23:46:21.395+00:00,2025,EF29,409,"{'19': 1, '20': 2, '21': 7, '22': 11, '23': 19, '24': 15, '25': 19, '26': 15, '27': 14, '28': 10, '29': 12, '30': 16, '31': 17, '32': 14, '33': 15, '34': 20, '35': 15, '36': 18, '37': 20, '38': 21, '39': 17, '40': 12, '41': 16, '42': 9, '43': 4, '44': 6, '45': 8, '46': 4, '47': 9, '48': 6, '49': 2, '50': 7, '51': 4, '52': 5, '53': 4, '54': 4, '55': 1, '56': 2, '57': 1, '58': 1, '59': 1, '60': 2, '63': 2, '65': 1}",{},"{'new': 1, 'approved': 129, 'paid': 279}","{'XS': 2, 'S': 10, 'M': 60, 'L': 71, 'XL': 56, 'XXL': 37}","{'AT': 15, 'AU': 1, 'BE': 3, 'CC': 1, 'CH': 18, 'CZ': 1, 'DE': 310, 'DK': 7, 'ES': 1, 'FI': 4, 'FR': 4, 'GB': 8, 'HU': 4, 'IE': 2, 'IT': 3, 'LU': 1, 'NL': 22, 'NO': 1, 'PL': 1, 'SI': 1, 'US': 1}","{'normal': 272, 'sponsor': 69, 'supersponsor': 68}","{'animator': 67, 'artist': 121, 'fursuiter': 166, 'musician': 82}"
02/14/2025,True,2025-02-14T23:45:02.161+00:00,2025-02-14T23:45:02.161+00:00,2025,EF29,410,"{'19': 1, '20': 2, '21': 7, '22': 11, '23': 19, '24': 15, '25': 19, '26': 15, '27': 14, '28': 10, '29': 12, '30': 16, '31': 17, '32': 14, '33': 15, '34': 21, '35': 15, '36': 18, '37': 20, '38': 21, '39': 17, '40': 12, '41': 16, '42': 9, '43': 4, '44': 6, '45': 8, '46': 4, '47': 9, '48': 6, '49': 2, '50': 7, '51': 4, '52': 5, '53': 4, '54': 4, '55': 1, '56': 2, '57': 1, '58': 1, '59': 1, '60': 2, '63': 2, '65': 1}",{},"{'new': 1, 'approved': 123, 'paid': 286}","{'XS': 2, 'S': 10, 'M': 60, 'L': 71, 'XL': 57, 'XXL': 37}","{'AT': 15, 'AU': 1, 'BE': 3, 'CC': 1, 'CH': 18, 'CZ': 1, 'DE': 311, 'DK': 7, 'ES': 1, 'FI': 4, 'FR': 4, 'GB': 8, 'HU': 4, 'IE': 2, 'IT': 3, 'LU': 1, 'NL': 22, 'NO': 1, 'PL': 1, 'SI': 1, 'US': 1}","{'normal': 272, 'sponsor': 70, 'supersponsor': 68}","{'animator': 68, 'artist': 122, 'fursuiter': 167, 'musician': 83}"
02/15/2025,True,2025-02-15T23:45:01.991+00:00,2025-02-15T23:45:01.991+00:00,2025,EF29,2070,"{'18': 26, '19': 37, '20': 64, '21': 75, '22': 99, '23': 115, '24': 120, '25': 118, '26': 141, '27': 110, '28': 105, '29': 101, '30': 101, '31': 86, '32': 99, '33': 63, '34': 79, '35': 73, '36': 61, '37': 55, '38': 51, '39': 44, '40': 27, '41': 38, '42': 24, '43': 18, '44': 11, '45': 18, '46': 11, '47': 16, '48': 8, '49': 10, '50': 13, '51': 6, '52': 7, '53': 5, '54': 5, '55': 3, '56': 5, '57': 2, '58': 3, '59': 2, '60': 4, '61': 3, '63': 2, '65': 1, '69': 1, '70': 1, '71': 1, '72': 1, '76': 1}",{},"{'new': 24, 'approved': 1512, 'partially paid': 19, 'paid': 515}","{'XS': 10, 'S': 64, 'M': 343, 'L': 363, 'XL': 242, 'XXL': 164}","{'AR': 2, 'AT': 100, 'AU': 4, 'BE': 26, 'BG': 4, 'BR': 1, 'CA': 3, 'CC': 1, 'CH': 61, 'CY': 1, 'CZ': 16, 'DE': 1257, 'DK': 29, 'EE': 2, 'ES': 14, 'FI': 26, 'FR': 44, 'GB': 121, 'HR': 3, 'HU': 13, 'IE': 10, 'IL': 6, 'IS': 1, 'IT': 17, 'JP': 1, 'LU': 6, 'LV': 2, 'MX': 4, 'NL': 160, 'NO': 6, 'NZ': 1, 'PL': 54, 'PT': 2, 'RO': 1, 'RS': 1, 'RU': 2, 'SE': 18, 'SG': 1, 'SI': 2, 'SK': 6, 'TR': 1, 'UA': 2, 'US': 36, 'ZA': 2}","{'day': 19, 'normal': 1360, 'sponsor': 346, 'supersponsor': 345}","{'animator': 538, 'artist': 826, 'fursuiter': 954, 'musician': 608}"
02/16/2025,True,2025-02-16T23:46:09.112+00:00,2025-02-16T23:46:09.112+00:00,2025,EF29,2502,"{'18': 33, '19': 45, '20': 79, '21': 96, '22': 117, '23': 134, '24': 146, '25': 142, '26': 166, '27': 136, '28': 137, '29': 122, '30': 130, '31': 105, '32': 124, '33': 80, '34': 94, '35': 86, '36': 73, '37': 60, '38': 62, '39': 50, '40': 32, '41': 42, '42': 29, '43': 22, '44': 14, '45': 20, '46': 13, '47': 18, '48': 8, '49': 10, '50': 14, '51': 9, '52': 8, '53': 5, '54': 6, '55': 3, '56': 7, '57': 3, '58': 3, '59': 2, '60': 4, '61': 3, '62': 1, '63': 2, '65': 1, '69': 1, '70': 1, '71': 1, '72': 1, '75': 1, '76': 1}",{},"{'new': 4, 'approved': 1649, 'partially paid': 19, 'paid': 830}","{'XS': 11, 'S': 78, 'M': 413, 'L': 423, 'XL': 287, 'XXL': 188}","{'AR': 2, 'AT': 109, 'AU': 6, 'BE': 35, 'BG': 4, 'BR': 1, 'CA': 5, 'CC': 1, 'CH': 78, 'CN': 1, 'CY': 1, 'CZ': 18, 'DE': 1476, 'DK': 38, 'EC': 2, 'EE': 3, 'ES': 25, 'FI': 29, 'FR': 58, 'GB': 152, 'HK': 1, 'HR': 3, 'HU': 14, 'IE': 12, 'IL': 7, 'IS': 2, 'IT': 18, 'JP': 4, 'KH': 1, 'LT': 1, 'LU': 8, 'LV': 2, 'MX': 4, 'NL': 190, 'NO': 13, 'NZ': 2, 'PL': 77, 'PT': 4, 'RO': 2, 'RS': 1, 'RU': 2, 'SE': 23, 'SG': 3, 'SI': 3, 'SK': 6, 'TR': 1, 'UA': 2, 'US': 48, 'ZA': 4}","{'day': 21, 'normal': 1687, 'sponsor': 405, 'supersponsor': 387}","{'animator': 662, 'artist': 1017, 'fursuiter': 1152, 'musician': 729}"
02/17/2025,True,2025-02-17T23:46:32.019+00:00,2025-02-17T23:46:32.019+00:00,2025,EF29,2615,"{'18': 35, '19': 47, '20': 84, '21': 101, '22': 127, '23': 143, '24': 155, '25': 149, '26': 171, '27': 147, '28': 143, '29': 125, '30': 135, '31': 108, '32': 126, '33': 85, '34': 96, '35': 90, '36': 76, '37': 62, '38': 63, '39': 52, '40': 35, '41': 44, '42': 29, '43': 23, '44': 14, '45': 22, '46': 13, '47': 18, '48': 8, '49': 10, '50': 14, '51': 9, '52': 8, '53': 5, '54': 7, '55': 3, '56': 7, '57': 3, '58': 3, '59': 3, '60': 4, '61': 3, '62': 1, '63': 2, '65': 1, '69': 1, '70': 1, '71': 1, '72': 1, '75': 1, '76': 1}",{},"{'new': 1, 'approved': 1410, 'partially paid': 24, 'paid': 1180}","{'XS': 11, 'S': 82, 'M': 429, 'L': 437, 'XL': 298, 'XXL': 194}","{'AR': 2, 'AT': 112, 'AU': 6, 'BE': 35, 'BG': 4, 'BR': 1, 'CA': 5, 'CC': 1, 'CH': 80, 'CN': 1, 'CY': 1, 'CZ': 20, 'DE': 1531, 'DK': 38, 'EC': 2, 'EE': 3, 'ES': 28, 'FI': 29, 'FR': 65, 'GB': 167, 'HK': 1, 'HR': 3, 'HU': 15, 'IE': 13, 'IL': 7, 'IS': 2, 'IT': 18, 'JP': 4, 'KH': 1, 'LT': 1, 'LU': 10, 'LV': 2, 'MX': 5, 'NL': 197, 'NO': 13, 'NZ': 2, 'PL': 84, 'PT': 4, 'RO': 2, 'RS': 1, 'RU': 3, 'SE': 23, 'SG': 3, 'SI': 3, 'SK': 7, 'TR': 1, 'UA': 2, 'US': 53, 'ZA': 4}","{'day': 22, 'normal': 1776, 'sponsor': 422, 'supersponsor': 393}","{'animator': 692, 'artist': 1061, 'fursuiter': 1195, 'musician': 764}"
02/18/2025,True,2025-02-18T23:46:45.121+00:00,2025-02-18T23:46:45.121+00:00,2025,EF29,2688,"{'18': 37, '19': 51, '20': 87, '21': 105, '22': 132, '23': 148, '24': 164, '25': 152, '26': 180, '27': 152, '28': 146, '29': 128, '30': 138, '31': 109, '32': 127, '33': 87, '34': 97, '35': 92, '36': 78, '37': 64, '38': 63, '39': 54, '40': 35, '41': 44, '42': 29, '43': 23, '44': 14, '45': 23, '46': 14, '47': 18, '48': 8, '49': 10, '50': 14, '51': 9, '52': 8, '53': 5, '54': 7, '55': 3, '56': 7, '57': 3, '58': 3, '59': 3, '60': 4, '61': 3, '62': 1, '63': 2, '65': 1, '69': 1, '70': 1, '71': 1, '72': 1, '75': 1, '76': 1}",{},"{'approved': 1351, 'partially paid': 22, 'paid': 1315}","{'XS': 11, 'S': 85, 'M': 442, 'L': 447, 'XL': 306, 'XXL': 199}","{'AR': 2, 'AT': 114, 'AU': 6, 'BE': 35, 'BG': 4, 'BR': 1, 'CA': 5, 'CC': 1, 'CH': 84, 'CN': 1, 'CY': 1, 'CZ': 23, 'DE': 1572, 'DK': 40, 'EC': 2, 'EE': 4, 'ES': 29, 'FI': 29, 'FR': 66, 'GB': 169, 'HK': 2, 'HR': 3, 'HU': 16, 'IE': 14, 'IL': 7, 'IS': 2, 'IT': 18, 'JP': 4, 'KH': 1, 'LT': 1, 'LU': 11, 'LV': 2, 'MX': 5, 'NL': 204, 'NO': 13, 'NZ': 2, 'PL': 86, 'PT': 4, 'RO': 2, 'RS': 1, 'RU': 3, 'SE': 24, 'SG': 3, 'SI': 3, 'SK': 7, 'TR': 1, 'UA': 2, 'US': 55, 'ZA': 4}","{'day': 22, 'normal': 1836, 'sponsor': 427, 'supersponsor': 401}","{'animator': 717, 'artist': 1093, 'fursuiter': 1225, 'musician': 791}"
02/19/2025,True,2025-02-19T23:45:01.878+00:00,2025-02-19T23:45:01.878+00:00,2025,EF29,2730,"{'18': 38, '19': 51, '20': 93, '21': 109, '22': 134, '23': 149, '24': 170, '25': 156, '26': 183, '27': 155, '28': 146, '29': 130, '30': 140, '31': 110, '32': 128, '33': 87, '34': 100, '35': 92, '36': 79, '37': 65, '38': 63, '39': 54, '40': 35, '41': 44, '42': 29, '43': 23, '44': 14, '45': 23, '46': 14, '47': 19, '48': 8, '49': 10, '50': 14, '51': 9, '52': 8, '53': 5, '54': 7, '55': 3, '56': 7, '57': 3, '58': 3, '59': 3, '60': 4, '61': 3, '62': 1, '63': 2, '65': 1, '69': 1, '70': 1, '71': 1, '72': 1, '75': 1, '76': 1}",{},"{'new': 6, 'approved': 1309, 'partially paid': 23, 'paid': 1392}","{'XS': 11, 'S': 86, 'M': 446, 'L': 456, 'XL': 308, 'XXL': 202}","{'AR': 2, 'AT': 115, 'AU': 6, 'BE': 37, 'BG': 4, 'BR': 1, 'CA': 6, 'CC': 1, 'CH': 84, 'CN': 1, 'CY': 1, 'CZ': 23, 'DE': 1592, 'DK': 42, 'EC': 2, 'EE': 4, 'ES': 29, 'FI': 29, 'FR': 66, 'GB': 173, 'HK': 2, 'HR': 3, 'HU': 18, 'IE': 14, 'IL': 7, 'IS': 2, 'IT': 21, 'JP': 4, 'KH': 1, 'LT': 1, 'LU': 11, 'LV': 2, 'MX': 5, 'NL': 205, 'NO': 13, 'NZ': 2, 'PL': 89, 'PT': 4, 'RO': 2, 'RS': 1, 'RU': 3, 'SE': 25, 'SG': 3, 'SI': 3, 'SK': 7, 'TR': 1, 'UA': 2, 'US': 57, 'ZA': 4}","{'day': 23, 'normal': 1871, 'sponsor': 428, 'supersponsor': 406}","{'animator': 734, 'artist': 1113, 'fursuiter': 1241, 'musician': 806}"
02/20/2025,True,2025-02-20T23:45:01.639+00:00,2025-02-20T23:45:01.639+00:00,2025,EF29,2776,"{'18': 39, '19': 52, '20': 94, '21': 111, '22': 140, '23': 153, '24': 172, '25': 158, '26': 188, '27': 158, '28': 148, '29': 134, '30': 141, '31': 112, '32': 128, '33': 88, '34': 102, '35': 95, '36': 79, '37': 67, '38': 63, '39': 54, '40': 35, '41': 44, '42': 30, '43': 24, '44': 14, '45': 23, '46': 14, '47': 19, '48': 8, '49': 10, '50': 14, '51': 9, '52': 8, '53': 5, '54': 7, '55': 3, '56': 7, '57': 3, '58': 3, '59': 3, '60': 4, '61': 3, '62': 1, '63': 2, '65': 1, '69': 1, '70': 1, '71': 1, '72': 1, '75': 1, '76': 1}",{},"{'new': 6, 'approved': 1290, 'partially paid': 24, 'paid': 1456}","{'XS': 11, 'S': 87, 'M': 453, 'L': 464, 'XL': 314, 'XXL': 202}","{'AR': 2, 'AT': 115, 'AU': 6, 'BE': 38, 'BG': 5, 'BR': 1, 'CA': 6, 'CC': 1, 'CH': 85, 'CN': 1, 'CY': 1, 'CZ': 24, 'DE': 1616, 'DK': 42, 'EC': 2, 'EE': 4, 'ES': 29, 'FI': 29, 'FR': 67, 'GB': 179, 'HK': 2, 'HR': 3, 'HU': 19, 'IE': 14, 'IL': 7, 'IS': 2, 'IT': 21, 'JP': 4, 'KH': 1, 'LT': 1, 'LU': 11, 'LV': 2, 'MX': 5, 'NL': 206, 'NO': 13, 'NZ': 2, 'PL': 91, 'PT': 4, 'RO': 2, 'RS': 1, 'RU': 3, 'SE': 25, 'SG': 3, 'SI': 3, 'SK': 7, 'TR': 1, 'UA': 2, 'US': 64, 'ZA': 4}","{'day': 23, 'normal': 1908, 'sponsor': 434, 'supersponsor': 409}","{'animator': 750, 'artist': 1136, 'fursuiter': 1260, 'musician': 824}"
02/21/2025,True,2025-02-21T23:46:41.333+00:00,2025-02-21T23:46:41.333+00:00,2025,EF29,2832,"{'18': 44, '19': 53, '20': 95, '21': 111, '22': 145, '23': 158, '24': 173, '25': 158, '26': 192, '27': 166, '28': 152, '29': 136, '30': 142, '31': 114, '32': 131, '33': 89, '34': 104, '35': 96, '36': 81, '37': 68, '38': 64, '39': 55, '40': 35, '41': 45, '42': 31, '43': 24, '44': 14, '45': 24, '46': 15, '47': 19, '48': 8, '49': 11, '50': 14, '51': 9, '52': 8, '53': 5, '54': 7, '55': 3, '56': 7, '57': 3, '58': 3, '59': 3, '60': 4, '61': 3, '62': 1, '63': 2, '65': 1, '69': 1, '70': 1, '71': 1, '72': 1, '75': 1, '76': 1}",{},"{'new': 1, 'approved': 1303, 'partially paid': 19, 'paid': 1509}","{'XS': 11, 'S': 90, 'M': 462, 'L': 467, 'XL': 323, 'XXL': 208}","{'AR': 2, 'AT': 118, 'AU': 6, 'BE': 39, 'BG': 5, 'BR': 1, 'CA': 6, 'CC': 1, 'CH': 86, 'CN': 1, 'CY': 1, 'CZ': 25, 'DE': 1645, 'DK': 45, 'EC': 2, 'EE': 4, 'ES': 29, 'FI': 32, 'FR': 71, 'GB': 182, 'HK': 2, 'HR': 3, 'HU': 19, 'IE': 14, 'IL': 7, 'IS': 2, 'IT': 21, 'JP': 4, 'KH': 1, 'LT': 1, 'LU': 11, 'LV': 2, 'MX': 6, 'NL': 208, 'NO': 13, 'NZ': 2, 'PL': 94, 'PT': 4, 'RO': 2, 'RS': 1, 'RU': 3, 'SE': 25, 'SG': 3, 'SI': 3, 'SK': 7, 'TR': 1, 'UA': 2, 'US': 66, 'ZA': 4}","{'day': 25, 'normal': 1949, 'sponsor': 437, 'supersponsor': 419}","{'animator': 764, 'artist': 1158, 'fursuiter': 1280, 'musician': 841}"
02/22/2025,True,2025-02-22T23:45:02.026+00:00,2025-02-22T23:45:02.026+00:00,2025,EF29,2875,"{'18': 48, '19': 56, '20': 96, '21': 114, '22': 147, '23': 160, '24': 174, '25': 162, '26': 194, '27': 170, '28': 152, '29': 140, '30': 142, '31': 115, '32': 134, '33': 93, '34': 104, '35': 96, '36': 82, '37': 68, '38': 65, '39': 55, '40': 36, '41': 46, '42': 31, '43': 24, '44': 14, '45': 25, '46': 15, '47': 19, '48': 8, '49': 11, '50': 14, '51': 9, '52': 8, '53': 5, '54': 7, '55': 3, '56': 7, '57': 3, '58': 3, '59': 3, '60': 4, '61': 3, '62': 1, '63': 2, '65': 1, '69': 1, '70': 1, '71': 1, '72': 1, '75': 1, '76': 1}",{},"{'approved': 1312, 'partially paid': 19, 'paid': 1544}","{'XS': 11, 'S': 91, 'M': 469, 'L': 470, 'XL': 328, 'XXL': 213}","{'AR': 2, 'AT': 123, 'AU': 6, 'BE': 40, 'BG': 5, 'BR': 1, 'CA': 7, 'CC': 1, 'CH': 88, 'CN': 1, 'CY': 1, 'CZ': 25, 'DE': 1666, 'DK': 45, 'EC': 2, 'EE': 4, 'ES': 30, 'FI': 35, 'FR': 74, 'GB': 185, 'HK': 2, 'HR': 3, 'HU': 19, 'IE': 14, 'IL': 7, 'IS': 2, 'IT': 21, 'JP': 4, 'KH': 1, 'LT': 1, 'LU': 11, 'LV': 2, 'MX': 6, 'NL': 210, 'NO': 13, 'NZ': 2, 'PL': 95, 'PT': 4, 'RO': 2, 'RS': 1, 'RU': 3, 'SE': 25, 'SG': 3, 'SI': 3, 'SK': 7, 'TR': 1, 'UA': 2, 'US': 66, 'ZA': 4}","{'day': 25, 'normal': 1985, 'sponsor': 443, 'supersponsor': 420}","{'animator': 779, 'artist': 1180, 'fursuiter': 1304, 'musician': 852}"
02/23/2025,True,2025-02-23T23:45:01.995+00:00,2025-02-23T23:45:01.995+00:00,2025,EF29,2931,"{'18': 48, '19': 57, '20': 103, '21': 117, '22': 149, '23': 166, '24': 177, '25': 169, '26': 196, '27': 172, '28': 156, '29': 144, '30': 145, '31': 116, '32': 137, '33': 94, '34': 104, '35': 97, '36': 82, '37': 70, '38': 66, '39': 55, '40': 36, '41': 46, '42': 33, '43': 25, '44': 14, '45': 25, '46': 15, '47': 19, '48': 8, '49': 11, '50': 14, '51': 9, '52': 8, '53': 5, '54': 7, '55': 3, '56': 7, '57': 3, '58': 3, '59': 3, '60': 4, '61': 3, '62': 1, '63': 2, '65': 1, '69': 1, '70': 1, '71': 1, '72': 1, '75': 1, '76': 1}",{},"{'new': 3, 'approved': 1339, 'partially paid': 19, 'paid': 1570}","{'XS': 11, 'S': 96, 'M': 474, 'L': 476, 'XL': 335, 'XXL': 215}","{'AR': 2, 'AT': 125, 'AU': 6, 'BE': 41, 'BG': 5, 'BR': 1, 'CA': 8, 'CC': 1, 'CH': 88, 'CN': 1, 'CY': 1, 'CZ': 26, 'DE': 1695, 'DK': 45, 'EC': 2, 'EE': 4, 'ES': 32, 'FI': 36, 'FR': 78, 'GB': 187, 'HK': 2, 'HR': 3, 'HU': 19, 'IE': 15, 'IL': 7, 'IS': 2, 'IT': 22, 'JP': 4, 'KH': 1, 'LT': 1, 'LU': 11, 'LV': 2, 'MT': 1, 'MX': 6, 'NL': 212, 'NO': 14, 'NZ': 2, 'PL': 96, 'PT': 4, 'RO': 2, 'RS': 1, 'RU': 3, 'SE': 26, 'SG': 3, 'SI': 3, 'SK': 8, 'TR': 1, 'UA': 2, 'US': 70, 'ZA': 4}","{'day': 26, 'normal': 2029, 'sponsor': 451, 'supersponsor': 423}","{'animator': 795, 'artist': 1203, 'fursuiter': 1326, 'musician': 868}"
02/24/2025,True,2025-02-24T23:45:01.945+00:00,2025-02-24T23:45:01.945+00:00,2025,EF29,2989,"{'18': 50, '19': 60, '20': 105, '21': 120, '22': 155, '23': 169, '24': 181, '25': 171, '26': 200, '27': 177, '28': 161, '29': 146, '30': 146, '31': 119, '32': 140, '33': 96, '34': 104, '35': 97, '36': 84, '37': 70, '38': 66, '39': 56, '40': 36, '41': 46, '42': 33, '43': 25, '44': 15, '45': 26, '46': 16, '47': 19, '48': 9, '49': 11, '50': 14, '51': 9, '52': 8, '53': 5, '54': 7, '55': 4, '56': 7, '57': 3, '58': 3, '59': 3, '60': 4, '61': 3, '62': 1, '63': 2, '65': 1, '69': 1, '70': 1, '71': 1, '72': 1, '75': 1, '76': 1}",{},"{'approved': 1293, 'partially paid': 20, 'paid': 1676}","{'XS': 12, 'S': 99, 'M': 480, 'L': 487, 'XL': 339, 'XXL': 217}","{'AR': 2, 'AT': 127, 'AU': 6, 'BE': 41, 'BG': 5, 'BR': 1, 'CA': 8, 'CC': 1, 'CH': 91, 'CN': 1, 'CY': 1, 'CZ': 26, 'DE': 1727, 'DK': 47, 'EC': 2, 'EE': 4, 'ES': 32, 'FI': 38, 'FR': 78, 'GB': 193, 'HK': 2, 'HR': 3, 'HU': 20, 'IE': 15, 'IL': 7, 'IS': 2, 'IT': 22, 'JP': 4, 'KH': 1, 'LT': 1, 'LU': 11, 'LV': 2, 'MT': 1, 'MX': 6, 'NL': 217, 'NO': 16, 'NZ': 2, 'PL': 96, 'PT': 4, 'RO': 2, 'RS': 1, 'RU': 3, 'SE': 28, 'SG': 3, 'SI': 3, 'SK': 8, 'TR': 1, 'UA': 2, 'US': 71, 'ZA': 4}","{'day': 27, 'normal': 2075, 'sponsor': 459, 'supersponsor': 426}","{'animator': 816, 'artist': 1230, 'fursuiter': 1350, 'musician': 892}"
02/25/2025,True,2025-02-25T23:47:04.367+00:00,2025-02-25T23:47:04.367+00:00,2025,EF29,3078,"{'18': 52, '19': 62, '20': 112, '21': 125, '22': 162, '23': 173, '24': 187, '25': 173, '26': 204, '27': 181, '28': 166, '29': 152, '30': 148, '31': 125, '32': 143, '33': 99, '34': 109, '35': 102, '36': 86, '37': 71, '38': 68, '39': 56, '40': 38, '41': 46, '42': 34, '43': 26, '44': 15, '45': 28, '46': 16, '47': 19, '48': 9, '49': 11, '50': 14, '51': 9, '52': 8, '53': 5, '54': 7, '55': 4, '56': 7, '57': 3, '58': 3, '59': 3, '60': 4, '61': 3, '62': 1, '63': 2, '65': 1, '69': 1, '70': 1, '71': 1, '72': 1, '75': 1, '76': 1}",{},"{'new': 6, 'approved': 1251, 'partially paid': 19, 'paid': 1802}","{'XS': 13, 'S': 103, 'M': 499, 'L': 502, 'XL': 351, 'XXL': 221}","{'AR': 2, 'AT': 130, 'AU': 6, 'BE': 42, 'BG': 5, 'BR': 1, 'CA': 9, 'CC': 1, 'CH': 94, 'CN': 1, 'CY': 1, 'CZ': 27, 'DE': 1765, 'DK': 54, 'EC': 2, 'EE': 4, 'ES': 36, 'FI': 40, 'FR': 79, 'GB': 200, 'HK': 2, 'HR': 3, 'HU': 20, 'IE': 15, 'IL': 7, 'IS': 2, 'IT': 23, 'JP': 4, 'KH': 1, 'LT': 1, 'LU': 11, 'LV': 2, 'MT': 1, 'MX': 6, 'NL': 227, 'NO': 18, 'NZ': 2, 'PL': 96, 'PT': 4, 'RO': 2, 'RS': 1, 'RU': 3, 'SE': 34, 'SG': 3, 'SI': 3, 'SK': 8, 'TR': 1, 'UA': 2, 'US': 73, 'ZA': 4}","{'day': 27, 'normal': 2134, 'sponsor': 477, 'supersponsor': 438}","{'animator': 842, 'artist': 1276, 'fursuiter': 1393, 'musician': 926}"
02/26/2025,True,2025-02-26T23:45:01.721+00:00,2025-02-26T23:45:01.721+00:00,2025,EF29,3161,"{'18': 52, '19': 62, '20': 116, '21': 131, '22': 170, '23': 181, '24': 189, '25': 178, '26': 213, '27': 187, '28': 167, '29': 157, '30': 150, '31': 127, '32': 147, '33': 100, '34': 114, '35': 106, '36': 88, '37': 73, '38': 69, '39': 58, '40': 39, '41': 46, '42': 35, '43': 26, '44': 16, '45': 28, '46': 16, '47': 19, '48': 9, '49': 11, '50': 14, '51': 9, '52': 8, '53': 5, '54': 8, '55': 4, '56': 7, '57': 3, '58': 3, '59': 3, '60': 4, '61': 3, '62': 1, '63': 2, '65': 1, '69': 1, '70': 1, '71': 1, '72': 1, '75': 1, '76': 1}",{},"{'new': 9, 'approved': 1192, 'partially paid': 22, 'paid': 1938}","{'XS': 13, 'S': 109, 'M': 505, 'L': 513, 'XL': 358, 'XXL': 226}","{'AR': 2, 'AT': 135, 'AU': 6, 'BE': 46, 'BG': 5, 'BR': 1, 'CA': 9, 'CC': 1, 'CH': 97, 'CN': 1, 'CY': 1, 'CZ': 27, 'DE': 1808, 'DK': 55, 'EC': 2, 'EE': 4, 'ES': 40, 'FI': 40, 'FR': 79, 'GB': 209, 'HK': 2, 'HR': 3, 'HU': 20, 'IE': 16, 'IL': 7, 'IS': 2, 'IT': 24, 'JP': 4, 'KH': 1, 'LT': 1, 'LU': 11, 'LV': 2, 'MT': 1, 'MX': 6, 'NL': 233, 'NO': 18, 'NZ': 3, 'PL': 98, 'PT': 4, 'RO': 2, 'RS': 1, 'RU': 3, 'SE': 34, 'SG': 3, 'SI': 4, 'SK': 8, 'TR': 1, 'UA': 2, 'US': 75, 'ZA': 4}","{'day': 27, 'normal': 2195, 'sponsor': 487, 'supersponsor': 450}","{'animator': 868, 'artist': 1312, 'fursuiter': 1429, 'musician': 958}"
02/27/2025,True,2025-02-27T23:45:01.503+00:00,2025-02-27T23:45:01.503+00:00,2025,EF29,3234,"{'18': 55, '19': 63, '20': 119, '21': 133, '22': 175, '23': 187, '24': 191, '25': 184, '26': 221, '27': 192, '28': 169, '29': 160, '30': 156, '31': 131, '32': 152, '33': 100, '34': 115, '35': 109, '36': 91, '37': 73, '38': 71, '39': 58, '40': 39, '41': 46, '42': 36, '43': 26, '44': 17, '45': 28, '46': 17, '47': 19, '48': 9, '49': 11, '50': 14, '51': 9, '52': 8, '53': 5, '54': 8, '55': 4, '56': 7, '57': 3, '58': 3, '59': 3, '60': 4, '61': 3, '62': 1, '63': 2, '65': 1, '69': 1, '70': 1, '71': 1, '72': 1, '75': 1, '76': 1}",{},"{'approved': 1133, 'partially paid': 18, 'paid': 2083}","{'XS': 14, 'S': 109, 'M': 516, 'L': 521, 'XL': 365, 'XXL': 231}","{'AR': 2, 'AT': 137, 'AU': 6, 'BE': 46, 'BG': 5, 'BR': 1, 'CA': 9, 'CC': 1, 'CH': 100, 'CN': 1, 'CY': 1, 'CZ': 27, 'DE': 1842, 'DK': 58, 'EC': 2, 'EE': 4, 'ES': 43, 'FI': 45, 'FR': 82, 'GB': 211, 'HK': 2, 'HR': 3, 'HU': 20, 'IE': 17, 'IL': 7, 'IS': 2, 'IT': 25, 'JP': 4, 'KH': 1, 'LT': 2, 'LU': 11, 'LV': 3, 'MT': 1, 'MX': 6, 'NL': 238, 'NO': 20, 'NZ': 3, 'PL': 99, 'PT': 4, 'RO': 3, 'RS': 1, 'RU': 3, 'SE': 36, 'SG': 3, 'SI': 4, 'SK': 8, 'TR': 1, 'UA': 3, 'US': 77, 'ZA': 4}","{'day': 29, 'normal': 2253, 'sponsor': 495, 'supersponsor': 455}","{'animator': 884, 'artist': 1338, 'fursuiter': 1454, 'musician': 974}"
02/28/2025,True,2025-02-28T23:46:41.171+00:00,2025-02-28T23:46:41.171+00:00,2025,EF29,3295,"{'18': 56, '19': 67, '20': 122, '21': 137, '22': 176, '23': 191, '24': 193, '25': 189, '26': 223, '27': 196, '28': 175, '29': 163, '30': 159, '31': 133, '32': 155, '33': 101, '34': 117, '35': 110, '36': 94, '37': 75, '38': 71, '39': 60, '40': 40, '41': 46, '42': 36, '43': 26, '44': 17, '45': 29, '46': 17, '47': 19, '48': 9, '49': 11, '50': 14, '51': 9, '52': 8, '53': 5, '54': 8, '55': 4, '56': 7, '57': 3, '58': 3, '59': 3, '60': 5, '61': 3, '62': 1, '63': 2, '65': 1, '69': 1, '70': 1, '71': 1, '72': 1, '75': 1, '76': 1}",{},"{'new': 24, 'approved': 1059, 'partially paid': 18, 'paid': 2194}","{'XS': 14, 'S': 111, 'M': 522, 'L': 527, 'XL': 374, 'XXL': 234}","{'AR': 2, 'AT': 137, 'AU': 6, 'BE': 47, 'BG': 5, 'BR': 1, 'CA': 9, 'CC': 1, 'CH': 101, 'CN': 1, 'CY': 1, 'CZ': 27, 'DE': 1878, 'DK': 63, 'EC': 2, 'EE': 4, 'ES': 45, 'FI': 45, 'FR': 82, 'GB': 218, 'HK': 2, 'HR': 3, 'HU': 20, 'IE': 17, 'IL': 7, 'IS': 2, 'IT': 25, 'JP': 4, 'KH': 1, 'LT': 2, 'LU': 11, 'LV': 3, 'MT': 1, 'MX': 6, 'NL': 240, 'NO': 20, 'NZ': 3, 'PL': 101, 'PT': 4, 'RO': 3, 'RS': 1, 'RU': 3, 'SE': 38, 'SG': 3, 'SI': 5, 'SK': 9, 'TR': 1, 'UA': 3, 'US': 78, 'ZA': 4}","{'day': 31, 'normal': 2299, 'sponsor': 503, 'supersponsor': 460}","{'animator': 904, 'artist': 1368, 'fursuiter': 1482, 'musician': 999}"
03/01/2025,True,2025-03-01T23:46:40.381+00:00,2025-03-01T23:46:40.381+00:00,2025,EF29,3357,"{'18': 56, '19': 68, '20': 126, '21': 139, '22': 180, '23': 196, '24': 200, '25': 192, '26': 231, '27': 196, '28': 180, '29': 164, '30': 163, '31': 135, '32': 157, '33': 105, '34': 117, '35': 111, '36': 96, '37': 76, '38': 72, '39': 61, '40': 41, '41': 47, '42': 37, '43': 26, '44': 17, '45': 29, '46': 17, '47': 20, '48': 9, '49': 11, '50': 14, '51': 9, '52': 8, '53': 5, '54': 8, '55': 4, '56': 7, '57': 3, '58': 3, '59': 3, '60': 5, '61': 3, '62': 1, '63': 2, '65': 1, '69': 1, '70': 1, '71': 1, '72': 1, '75': 1, '76': 1}",{},"{'new': 1, 'approved': 995, 'partially paid': 22, 'paid': 2339}","{'XS': 14, 'S': 112, 'M': 527, 'L': 532, 'XL': 379, 'XXL': 236}","{'AR': 2, 'AT': 138, 'AU': 7, 'BE': 47, 'BG': 5, 'BR': 1, 'CA': 10, 'CC': 1, 'CH': 101, 'CN': 1, 'CY': 1, 'CZ': 27, 'DE': 1903, 'DK': 68, 'EC': 2, 'EE': 4, 'ES': 45, 'FI': 47, 'FR': 84, 'GB': 232, 'HK': 2, 'HR': 3, 'HU': 20, 'IE': 17, 'IL': 7, 'IS': 2, 'IT': 26, 'JP': 4, 'KH': 1, 'LT': 2, 'LU': 11, 'LV': 3, 'MT': 1, 'MX': 6, 'NL': 242, 'NO': 21, 'NZ': 3, 'PL': 105, 'PT': 4, 'RO': 3, 'RS': 1, 'RU': 3, 'SE': 39, 'SG': 3, 'SI': 6, 'SK': 9, 'TR': 1, 'UA': 3, 'US': 79, 'ZA': 4}","{'day': 31, 'normal': 2355, 'sponsor': 506, 'supersponsor': 463}","{'animator': 927, 'artist': 1398, 'fursuiter': 1514, 'musician': 1023}"
03/02/2025,True,2025-03-02T23:45:02.087+00:00,2025-03-02T23:45:02.087+00:00,2025,EF29,3409,"{'18': 56, '19': 69, '20': 127, '21': 143, '22': 182, '23': 200, '24': 202, '25': 193, '26': 232, '27': 199, '28': 185, '29': 167, '30': 166, '31': 138, '32': 159, '33': 105, '34': 120, '35': 113, '36': 98, '37': 77, '38': 74, '39': 63, '40': 42, '41': 47, '42': 37, '43': 26, '44': 17, '45': 30, '46': 17, '47': 21, '48': 9, '49': 11, '50': 14, '51': 11, '52': 8, '53': 5, '54': 8, '55': 4, '56': 7, '57': 3, '58': 3, '59': 3, '60': 5, '61': 3, '62': 1, '63': 2, '65': 1, '69': 1, '70': 1, '71': 1, '72': 1, '75': 1, '76': 1}",{},"{'new': 3, 'approved': 992, 'partially paid': 22, 'paid': 2392}","{'XS': 14, 'S': 114, 'M': 533, 'L': 543, 'XL': 387, 'XXL': 237}","{'AR': 2, 'AT': 140, 'AU': 7, 'BE': 48, 'BG': 5, 'BR': 1, 'CA': 10, 'CC': 1, 'CH': 102, 'CN': 1, 'CY': 1, 'CZ': 27, 'DE': 1923, 'DK': 70, 'EC': 2, 'EE': 6, 'ES': 45, 'FI': 50, 'FR': 85, 'GB': 238, 'HK': 2, 'HR': 3, 'HU': 20, 'IE': 18, 'IL': 7, 'IS': 2, 'IT': 27, 'JP': 4, 'KH': 1, 'LT': 2, 'LU': 12, 'LV': 3, 'MT': 1, 'MX': 6, 'NL': 245, 'NO': 22, 'NZ': 3, 'PL': 106, 'PT': 4, 'RO': 3, 'RS': 1, 'RU': 3, 'SE': 42, 'SG': 3, 'SI': 6, 'SK': 9, 'TR': 1, 'UA': 3, 'US': 82, 'ZA': 4}","{'day': 31, 'normal': 2392, 'sponsor': 519, 'supersponsor': 465}","{'animator': 943, 'artist': 1425, 'fursuiter': 1537, 'musician': 1040}"
03/03/2025,True,2025-03-03T23:45:01.733+00:00,2025-03-03T23:45:01.733+00:00,2025,EF29,3461,"{'18': 58, '19': 69, '20': 131, '21': 146, '22': 185, '23': 205, '24': 207, '25': 194, '26': 235, '27': 201, '28': 186, '29': 169, '30': 168, '31': 138, '32': 159, '33': 105, '34': 122, '35': 116, '36': 100, '37': 80, '38': 75, '39': 64, '40': 43, '41': 50, '42': 38, '43': 26, '44': 17, '45': 30, '46': 17, '47': 21, '48': 10, '49': 12, '50': 14, '51': 11, '52': 8, '53': 5, '54': 8, '55': 4, '56': 7, '57': 3, '58': 3, '59': 3, '60': 5, '61': 3, '62': 1, '63': 2, '65': 1, '69': 1, '70': 1, '71': 1, '72': 1, '75': 1, '76': 1}",{},"{'approved': 878, 'partially paid': 18, 'paid': 2565}","{'XS': 13, 'S': 117, 'M': 540, 'L': 548, 'XL': 394, 'XXL': 241}","{'AR': 2, 'AT': 144, 'AU': 7, 'BE': 48, 'BG': 5, 'BR': 1, 'CA': 10, 'CC': 1, 'CH': 102, 'CN': 1, 'CY': 1, 'CZ': 28, 'DE': 1951, 'DK': 71, 'EC': 2, 'EE': 7, 'ES': 46, 'FI': 50, 'FR': 87, 'GB': 241, 'HK': 2, 'HR': 3, 'HU': 21, 'IE': 18, 'IL': 7, 'IS': 2, 'IT': 31, 'JP': 4, 'KH': 1, 'LT': 2, 'LU': 12, 'LV': 3, 'MT': 1, 'MX': 6, 'NL': 245, 'NO': 23, 'NZ': 3, 'PL': 108, 'PT': 4, 'RO': 3, 'RS': 1, 'RU': 3, 'SE': 43, 'SG': 3, 'SI': 6, 'SK': 9, 'TR': 1, 'UA': 3, 'US': 84, 'ZA': 4}","{'day': 31, 'normal': 2434, 'sponsor': 521, 'supersponsor': 473}","{'animator': 959, 'artist': 1448, 'fursuiter': 1560, 'musician': 1056}"
03/04/2025,True,2025-03-04T23:45:01.677+00:00,2025-03-04T23:45:01.677+00:00,2025,EF29,3508,"{'18': 58, '19': 69, '20': 134, '21': 152, '22': 188, '23': 209, '24': 210, '25': 199, '26': 240, '27': 203, '28': 188, '29': 170, '30': 169, '31': 143, '32': 160, '33': 106, '34': 122, '35': 118, '36': 100, '37': 81, '38': 75, '39': 64, '40': 43, '41': 50, '42': 38, '43': 26, '44': 17, '45': 30, '46': 18, '47': 21, '48': 10, '49': 12, '50': 14, '51': 11, '52': 8, '53': 5, '54': 8, '55': 4, '56': 7, '57': 3, '58': 3, '59': 3, '60': 5, '61': 3, '62': 2, '63': 2, '65': 1, '69': 1, '70': 1, '71': 1, '72': 1, '75': 1, '76': 1}",{},"{'new': 2, 'approved': 849, 'partially paid': 18, 'paid': 2639}","{'XS': 13, 'S': 121, 'M': 547, 'L': 559, 'XL': 397, 'XXL': 243}","{'AR': 2, 'AT': 148, 'AU': 7, 'BE': 50, 'BG': 5, 'BR': 1, 'CA': 10, 'CC': 1, 'CH': 102, 'CN': 1, 'CY': 1, 'CZ': 28, 'DE': 1978, 'DK': 71, 'EC': 2, 'EE': 7, 'ES': 47, 'FI': 52, 'FR': 88, 'GB': 245, 'HK': 2, 'HR': 3, 'HU': 21, 'IE': 18, 'IL': 7, 'IS': 2, 'IT': 31, 'JP': 4, 'KH': 1, 'LT': 2, 'LU': 12, 'LV': 3, 'MT': 1, 'MX': 6, 'NL': 248, 'NO': 23, 'NZ': 3, 'PL': 110, 'PT': 4, 'RO': 3, 'RS': 1, 'RU': 3, 'SE': 43, 'SG': 3, 'SI': 6, 'SK': 9, 'TR': 1, 'UA': 3, 'US': 85, 'ZA': 4}","{'day': 31, 'normal': 2469, 'sponsor': 531, 'supersponsor': 475}","{'animator': 975, 'artist': 1467, 'fursuiter': 1583, 'musician': 1074}"
03/05/2025,True,2025-03-05T23:45:02.031+00:00,2025-03-05T23:45:02.031+00:00,2025,EF29,3538,"{'18': 59, '19': 71, '20': 137, '21': 152, '22': 189, '23': 214, '24': 214, '25': 200, '26': 241, '27': 205, '28': 190, '29': 172, '30': 169, '31': 144, '32': 161, '33': 106, '34': 123, '35': 118, '36': 100, '37': 81, '38': 75, '39': 65, '40': 44, '41': 50, '42': 38, '43': 26, '44': 17, '45': 30, '46': 18, '47': 21, '48': 11, '49': 12, '50': 14, '51': 11, '52': 8, '53': 5, '54': 8, '55': 4, '56': 7, '57': 3, '58': 3, '59': 3, '60': 5, '61': 3, '62': 2, '63': 2, '65': 1, '69': 1, '70': 1, '71': 1, '72': 1, '75': 1, '76': 1}",{},"{'new': 3, 'approved': 827, 'partially paid': 19, 'paid': 2689}","{'XS': 13, 'S': 122, 'M': 552, 'L': 561, 'XL': 401, 'XXL': 244}","{'AR': 2, 'AT': 148, 'AU': 7, 'BE': 51, 'BG': 5, 'BR': 1, 'CA': 10, 'CC': 1, 'CH': 102, 'CN': 1, 'CY': 1, 'CZ': 28, 'DE': 1997, 'DK': 72, 'EC': 2, 'EE': 7, 'ES': 48, 'FI': 52, 'FR': 88, 'GB': 247, 'HK': 2, 'HR': 3, 'HU': 22, 'IE': 18, 'IL': 8, 'IS': 2, 'IT': 33, 'JP': 4, 'KH': 1, 'LT': 2, 'LU': 12, 'LV': 3, 'MT': 1, 'MX': 6, 'NL': 249, 'NO': 24, 'NZ': 3, 'PL': 110, 'PT': 4, 'RO': 3, 'RS': 1, 'RU': 3, 'SE': 43, 'SG': 3, 'SI': 6, 'SK': 9, 'TR': 1, 'UA': 3, 'US': 85, 'ZA': 4}","{'day': 34, 'normal': 2491, 'sponsor': 534, 'supersponsor': 477}","{'animator': 984, 'artist': 1481, 'fursuiter': 1594, 'musician': 1085}"
03/06/2025,True,2025-03-06T23:45:01.603+00:00,2025-03-06T23:45:01.603+00:00,2025,EF29,3574,"{'18': 59, '19': 74, '20': 137, '21': 155, '22': 189, '23': 218, '24': 218, '25': 200, '26': 245, '27': 208, '28': 191, '29': 174, '30': 171, '31': 146, '32': 161, '33': 106, '34': 125, '35': 118, '36': 100, '37': 81, '38': 78, '39': 65, '40': 44, '41': 50, '42': 40, '43': 26, '44': 17, '45': 30, '46': 18, '47': 21, '48': 12, '49': 12, '50': 14, '51': 11, '52': 8, '53': 5, '54': 8, '55': 4, '56': 7, '57': 3, '58': 3, '59': 3, '60': 5, '61': 3, '62': 2, '63': 2, '65': 1, '69': 1, '70': 1, '71': 1, '72': 1, '75': 1, '76': 1}",{},"{'new': 4, 'approved': 834, 'partially paid': 20, 'paid': 2716}","{'XS': 13, 'S': 124, 'M': 557, 'L': 566, 'XL': 405, 'XXL': 247}","{'AR': 2, 'AT': 149, 'AU': 7, 'BE': 51, 'BG': 6, 'BR': 1, 'CA': 10, 'CC': 1, 'CH': 103, 'CN': 1, 'CY': 1, 'CZ': 28, 'DE': 2017, 'DK': 74, 'EC': 2, 'EE': 7, 'ES': 48, 'FI': 52, 'FR': 90, 'GB': 251, 'HK': 2, 'HR': 3, 'HU': 22, 'IE': 18, 'IL': 8, 'IS': 2, 'IT': 33, 'JP': 4, 'KH': 1, 'LT': 2, 'LU': 12, 'LV': 3, 'MT': 1, 'MX': 6, 'NL': 252, 'NO': 24, 'NZ': 3, 'PE': 1, 'PL': 111, 'PT': 4, 'RO': 3, 'RS': 1, 'RU': 3, 'SE': 43, 'SG': 3, 'SI': 6, 'SK': 9, 'TR': 1, 'UA': 3, 'US': 85, 'ZA': 4}","{'day': 35, 'normal': 2516, 'sponsor': 544, 'supersponsor': 477}","{'animator': 997, 'artist': 1501, 'fursuiter': 1616, 'musician': 1099}"
03/07/2025,True,2025-03-07T23:45:01.199+00:00,2025-03-07T23:45:01.199+00:00,2025,EF29,3619,"{'18': 59, '19': 75, '20': 139, '21': 156, '22': 191, '23': 219, '24': 222, '25': 204, '26': 245, '27': 212, '28': 193, '29': 176, '30': 172, '31': 150, '32': 164, '33': 106, '34': 129, '35': 121, '36': 102, '37': 82, '38': 79, '39': 65, '40': 45, '41': 51, '42': 40, '43': 26, '44': 17, '45': 30, '46': 18, '47': 21, '48': 12, '49': 12, '50': 15, '51': 11, '52': 8, '53': 5, '54': 8, '55': 4, '56': 7, '57': 3, '58': 3, '59': 3, '60': 5, '61': 3, '62': 2, '63': 2, '65': 1, '69': 1, '70': 1, '71': 1, '72': 1, '75': 1, '76': 1}",{},"{'new': 11, 'approved': 821, 'partially paid': 20, 'paid': 2767}","{'XS': 13, 'S': 124, 'M': 565, 'L': 572, 'XL': 409, 'XXL': 252}","{'AR': 2, 'AT': 152, 'AU': 7, 'BE': 51, 'BG': 6, 'BR': 1, 'CA': 11, 'CC': 1, 'CH': 103, 'CN': 1, 'CY': 1, 'CZ': 28, 'DE': 2040, 'DK': 78, 'EC': 2, 'EE': 7, 'ES': 49, 'FI': 55, 'FR': 92, 'GB': 252, 'HK': 2, 'HR': 3, 'HU': 22, 'IE': 18, 'IL': 8, 'IS': 2, 'IT': 34, 'JP': 4, 'KH': 1, 'LT': 2, 'LU': 13, 'LV': 3, 'MT': 1, 'MX': 6, 'NL': 252, 'NO': 24, 'NZ': 3, 'PE': 1, 'PL': 113, 'PT': 4, 'RO': 4, 'RS': 1, 'RU': 3, 'SE': 44, 'SG': 3, 'SI': 6, 'SK': 9, 'TR': 1, 'UA': 3, 'US': 86, 'ZA': 4}","{'day': 35, 'normal': 2553, 'sponsor': 548, 'supersponsor': 481}","{'animator': 1013, 'artist': 1522, 'fursuiter': 1633, 'musician': 1114}"
03/08/2025,True,2025-03-08T23:45:01.888+00:00,2025-03-08T23:45:01.888+00:00,2025,EF29,3665,"{'18': 59, '19': 77, '20': 141, '21': 158, '22': 193, '23': 221, '24': 226, '25': 208, '26': 249, '27': 217, '28': 195, '29': 177, '30': 173, '31': 151, '32': 165, '33': 109, '34': 133, '35': 121, '36': 102, '37': 83, '38': 80, '39': 65, '40': 46, '41': 51, '42': 41, '43': 27, '44': 17, '45': 31, '46': 18, '47': 21, '48': 12, '49': 12, '50': 15, '51': 11, '52': 8, '53': 5, '54': 8, '55': 4, '56': 7, '57': 3, '58': 3, '59': 3, '60': 5, '61': 3, '62': 2, '63': 2, '65': 1, '69': 1, '70': 1, '71': 1, '72': 1, '75': 1, '76': 1}",{},"{'new': 2, 'approved': 852, 'partially paid': 23, 'paid': 2788}","{'XS': 13, 'S': 126, 'M': 571, 'L': 579, 'XL': 412, 'XXL': 257}","{'AR': 2, 'AT': 153, 'AU': 7, 'BE': 52, 'BG': 7, 'BR': 1, 'CA': 11, 'CC': 1, 'CH': 103, 'CN': 1, 'CY': 1, 'CZ': 28, 'DE': 2065, 'DK': 78, 'EC': 2, 'EE': 7, 'ES': 50, 'FI': 55, 'FR': 92, 'GB': 257, 'HK': 2, 'HR': 3, 'HU': 22, 'IE': 18, 'IL': 8, 'IS': 2, 'IT': 36, 'JP': 4, 'KH': 1, 'LT': 2, 'LU': 13, 'LV': 3, 'MT': 1, 'MX': 6, 'NL': 254, 'NO': 25, 'NZ': 3, 'PE': 1, 'PL': 116, 'PR': 1, 'PT': 4, 'RO': 4, 'RS': 1, 'RU': 3, 'SE': 44, 'SG': 3, 'SI': 6, 'SK': 9, 'TR': 1, 'UA': 3, 'US': 89, 'ZA': 4}","{'day': 35, 'normal': 2587, 'sponsor': 555, 'supersponsor': 486}","{'animator': 1024, 'artist': 1541, 'fursuiter': 1647, 'musician': 1127}"
03/09/2025,True,2025-03-09T23:45:01.569+00:00,2025-03-09T23:45:01.569+00:00,2025,EF29,3720,"{'18': 61, '19': 83, '20': 142, '21': 160, '22': 193, '23': 223, '24': 228, '25': 214, '26': 255, '27': 222, '28': 199, '29': 179, '30': 174, '31': 154, '32': 170, '33': 109, '34': 135, '35': 121, '36': 102, '37': 83, '38': 80, '39': 66, '40': 46, '41': 52, '42': 42, '43': 27, '44': 17, '45': 31, '46': 18, '47': 21, '48': 13, '49': 12, '50': 15, '51': 11, '52': 8, '53': 5, '54': 8, '55': 5, '56': 7, '57': 3, '58': 3, '59': 3, '60': 5, '61': 4, '62': 2, '63': 2, '65': 1, '69': 1, '70': 1, '71': 1, '72': 1, '75': 1, '76': 1}",{},"{'new': 11, 'approved': 869, 'partially paid': 24, 'paid': 2816}","{'XS': 13, 'S': 128, 'M': 579, 'L': 585, 'XL': 418, 'XXL': 261}","{'AR': 2, 'AT': 153, 'AU': 7, 'BE': 52, 'BG': 7, 'BR': 1, 'CA': 11, 'CC': 1, 'CH': 105, 'CN': 1, 'CY': 1, 'CZ': 28, 'DE': 2100, 'DK': 80, 'EC': 2, 'EE': 7, 'ES': 50, 'FI': 57, 'FR': 94, 'GB': 258, 'HK': 2, 'HR': 3, 'HU': 22, 'IE': 18, 'IL': 8, 'IS': 2, 'IT': 36, 'JP': 4, 'KH': 1, 'LT': 2, 'LU': 14, 'LV': 3, 'MT': 1, 'MX': 6, 'NL': 255, 'NO': 26, 'NZ': 3, 'PE': 1, 'PL': 119, 'PR': 1, 'PT': 5, 'RO': 4, 'RS': 1, 'RU': 3, 'SE': 46, 'SG': 3, 'SI': 6, 'SK': 9, 'TR': 1, 'UA': 3, 'US': 90, 'VN': 1, 'ZA': 4}","{'day': 36, 'normal': 2629, 'sponsor': 560, 'supersponsor': 493}","{'animator': 1041, 'artist': 1566, 'fursuiter': 1670, 'musician': 1149}"
03/10/2025,True,2025-03-10T23:45:01.486+00:00,2025-03-10T23:45:01.486+00:00,2025,EF29,3772,"{'18': 62, '19': 83, '20': 145, '21': 162, '22': 197, '23': 225, '24': 233, '25': 219, '26': 259, '27': 225, '28': 204, '29': 182, '30': 175, '31': 157, '32': 170, '33': 109, '34': 136, '35': 124, '36': 104, '37': 83, '38': 80, '39': 67, '40': 47, '41': 52, '42': 43, '43': 27, '44': 17, '45': 32, '46': 19, '47': 21, '48': 13, '49': 12, '50': 15, '51': 11, '52': 8, '53': 5, '54': 8, '55': 5, '56': 7, '57': 3, '58': 3, '59': 3, '60': 5, '61': 4, '62': 2, '63': 2, '65': 1, '69': 1, '70': 1, '71': 1, '72': 1, '75': 1, '76': 1}",{},"{'new': 1, 'approved': 845, 'partially paid': 23, 'paid': 2903}","{'XS': 14, 'S': 129, 'M': 588, 'L': 593, 'XL': 421, 'XXL': 264}","{'AR': 2, 'AT': 153, 'AU': 7, 'BA': 1, 'BE': 52, 'BG': 7, 'BR': 1, 'CA': 12, 'CC': 1, 'CH': 106, 'CN': 1, 'CY': 1, 'CZ': 29, 'DE': 2128, 'DK': 81, 'EC': 2, 'EE': 7, 'ES': 50, 'FI': 57, 'FR': 94, 'GB': 261, 'HK': 2, 'HR': 3, 'HU': 23, 'IE': 18, 'IL': 8, 'IS': 2, 'IT': 40, 'JP': 4, 'KH': 1, 'LT': 2, 'LU': 15, 'LV': 3, 'MT': 1, 'MX': 6, 'NL': 258, 'NO': 27, 'NZ': 3, 'PE': 1, 'PL': 122, 'PR': 1, 'PT': 5, 'RO': 5, 'RS': 1, 'RU': 3, 'SE': 48, 'SG': 3, 'SI': 6, 'SK': 9, 'TR': 1, 'UA': 3, 'US': 90, 'VN': 1, 'ZA': 4}","{'day': 38, 'normal': 2661, 'sponsor': 570, 'supersponsor': 501}","{'animator': 1062, 'artist': 1588, 'fursuiter': 1689, 'musician': 1166}"
03/11/2025,True,2025-03-11T23:45:01.580+00:00,2025-03-11T23:45:01.580+00:00,2025,EF29,3801,"{'18': 62, '19': 81, '20': 144, '21': 167, '22': 197, '23': 226, '24': 234, '25': 220, '26': 264, '27': 227, '28': 212, '29': 184, '30': 176, '31': 158, '32': 171, '33': 110, '34': 135, '35': 125, '36': 105, '37': 84, '38': 80, '39': 67, '40': 48, '41': 52, '42': 43, '43': 27, '44': 17, '45': 32, '46': 19, '47': 21, '48': 13, '49': 12, '50': 15, '51': 11, '52': 8, '53': 5, '54': 8, '55': 4, '56': 7, '57': 4, '58': 3, '59': 3, '60': 5, '61': 4, '62': 2, '63': 2, '65': 1, '69': 1, '70': 1, '71': 1, '72': 1, '75': 1, '76': 1}",{},"{'new': 4, 'approved': 755, 'partially paid': 17, 'paid': 3025}","{'XS': 14, 'S': 129, 'M': 592, 'L': 598, 'XL': 423, 'XXL': 265}","{'AR': 2, 'AT': 154, 'AU': 7, 'BA': 1, 'BE': 51, 'BG': 7, 'BR': 2, 'CA': 12, 'CC': 1, 'CH': 107, 'CN': 1, 'CY': 1, 'CZ': 29, 'DE': 2147, 'DK': 80, 'EC': 2, 'EE': 7, 'ES': 49, 'FI': 58, 'FM': 1, 'FR': 94, 'GB': 263, 'HK': 2, 'HR': 3, 'HU': 23, 'IE': 20, 'IL': 8, 'IS': 2, 'IT': 40, 'JP': 4, 'KH': 1, 'LT': 2, 'LU': 15, 'LV': 3, 'MT': 1, 'MX': 6, 'NL': 257, 'NO': 29, 'NZ': 3, 'PE': 1, 'PL': 125, 'PR': 1, 'PT': 5, 'RO': 5, 'RS': 1, 'RU': 2, 'SE': 49, 'SG': 3, 'SI': 6, 'SK': 9, 'TR': 1, 'UA': 3, 'US': 90, 'VN': 1, 'ZA': 4}","{'day': 39, 'normal': 2684, 'sponsor': 575, 'supersponsor': 501}","{'animator': 1069, 'artist': 1596, 'fursuiter': 1705, 'musician': 1179}"
03/12/2025,True,2025-03-12T23:45:01.578+00:00,2025-03-12T23:45:01.578+00:00,2025,EF29,3850,"{'18': 62, '19': 80, '20': 147, '21': 168, '22': 199, '23': 230, '24': 236, '25': 227, '26': 267, '27': 229, '28': 214, '29': 187, '30': 178, '31': 158, '32': 176, '33': 111, '34': 139, '35': 126, '36': 106, '37': 84, '38': 81, '39': 69, '40': 48, '41': 52, '42': 45, '43': 28, '44': 17, '45': 32, '46': 19, '47': 21, '48': 13, '49': 12, '50': 15, '51': 11, '52': 9, '53': 5, '54': 8, '55': 4, '56': 7, '57': 4, '58': 3, '59': 3, '60': 5, '61': 4, '62': 2, '63': 2, '65': 1, '69': 1, '70': 1, '71': 1, '72': 1, '75': 1, '76': 1}",{},"{'new': 1, 'approved': 741, 'partially paid': 17, 'paid': 3091}","{'XS': 14, 'S': 131, 'M': 599, 'L': 602, 'XL': 427, 'XXL': 268}","{'AR': 2, 'AT': 155, 'AU': 7, 'BA': 1, 'BE': 51, 'BG': 7, 'BH': 1, 'BR': 2, 'CA': 14, 'CC': 1, 'CH': 107, 'CN': 2, 'CY': 1, 'CZ': 31, 'DE': 2169, 'DK': 82, 'EC': 2, 'EE': 7, 'ES': 52, 'FI': 58, 'FM': 1, 'FR': 94, 'GB': 265, 'HK': 2, 'HR': 4, 'HU': 23, 'IE': 20, 'IL': 8, 'IS': 2, 'IT': 44, 'JP': 4, 'KH': 1, 'LT': 2, 'LU': 15, 'LV': 3, 'MT': 1, 'MX': 6, 'NL': 260, 'NO': 29, 'NZ': 3, 'PE': 1, 'PL': 127, 'PR': 1, 'PT': 5, 'RO': 5, 'RS': 1, 'RU': 3, 'SE': 49, 'SG': 3, 'SI': 6, 'SK': 9, 'TR': 1, 'UA': 3, 'US': 92, 'VN': 1, 'ZA': 4}","{'day': 40, 'normal': 2724, 'sponsor': 579, 'supersponsor': 505}","{'animator': 1085, 'artist': 1615, 'fursuiter': 1726, 'musician': 1196}"
03/13/2025,True,2025-03-13T23:45:01.905+00:00,2025-03-13T23:45:01.905+00:00,2025,EF29,3968,"{'18': 64, '19': 83, '20': 153, '21': 178, '22': 204, '23': 238, '24': 244, '25': 232, '26': 272, '27': 235, '28': 225, '29': 196, '30': 182, '31': 165, '32': 177, '33': 117, '34': 142, '35': 130, '36': 107, '37': 87, '38': 84, '39': 71, '40': 48, '41': 52, '42': 46, '43': 28, '44': 18, '45': 32, '46': 19, '47': 22, '48': 13, '49': 12, '50': 16, '51': 11, '52': 9, '53': 5, '54': 9, '55': 4, '56': 8, '57': 4, '58': 3, '59': 3, '60': 5, '61': 4, '62': 2, '63': 2, '65': 1, '69': 1, '70': 1, '71': 1, '72': 1, '75': 1, '76': 1}",{},"{'new': 1, 'approved': 762, 'partially paid': 16, 'paid': 3189}","{'XS': 15, 'S': 134, 'M': 613, 'L': 619, 'XL': 437, 'XXL': 274}","{'AR': 2, 'AT': 157, 'AU': 7, 'BA': 1, 'BE': 52, 'BG': 7, 'BH': 1, 'BR': 2, 'CA': 14, 'CC': 1, 'CH': 113, 'CN': 2, 'CY': 1, 'CZ': 31, 'DE': 2238, 'DK': 83, 'EC': 2, 'EE': 7, 'ES': 58, 'FI': 63, 'FM': 1, 'FR': 96, 'GB': 267, 'HK': 2, 'HR': 4, 'HU': 25, 'IE': 22, 'IL': 8, 'IS': 2, 'IT': 49, 'JP': 4, 'KH': 1, 'LT': 2, 'LU': 15, 'LV': 4, 'MT': 2, 'MX': 6, 'NL': 265, 'NO': 29, 'NZ': 3, 'PE': 1, 'PL': 133, 'PR': 1, 'PT': 5, 'RO': 5, 'RS': 1, 'RU': 3, 'SE': 49, 'SG': 3, 'SI': 6, 'SK': 9, 'TR': 1, 'UA': 3, 'US': 94, 'VN': 1, 'ZA': 4}","{'day': 42, 'normal': 2817, 'sponsor': 594, 'supersponsor': 513}","{'animator': 1115, 'artist': 1655, 'fursuiter': 1780, 'musician': 1225}"
03/14/2025,True,2025-03-14T23:45:01.645+00:00,2025-03-14T23:45:01.645+00:00,2025,EF29,4098,"{'18': 64, '19': 83, '20': 158, '21': 184, '22': 210, '23': 245, '24': 254, '25': 245, '26': 279, '27': 245, '28': 232, '29': 199, '30': 187, '31': 173, '32': 182, '33': 121, '34': 146, '35': 138, '36': 110, '37': 88, '38': 87, '39': 73, '40': 48, '41': 54, '42': 48, '43': 30, '44': 18, '45': 33, '46': 19, '47': 22, '48': 15, '49': 12, '50': 16, '51': 11, '52': 9, '53': 5, '54': 9, '55': 4, '56': 8, '57': 5, '58': 3, '59': 3, '60': 7, '61': 4, '62': 2, '63': 2, '65': 1, '69': 1, '70': 1, '71': 1, '72': 1, '74': 1, '75': 1, '76': 1}",{},"{'new': 8, 'approved': 741, 'partially paid': 20, 'paid': 3329}","{'XS': 16, 'S': 137, 'M': 634, 'L': 640, 'XL': 452, 'XXL': 279}","{'AR': 2, 'AT': 161, 'AU': 7, 'BA': 1, 'BE': 52, 'BG': 7, 'BH': 1, 'BR': 3, 'CA': 15, 'CC': 1, 'CH': 114, 'CN': 2, 'CY': 1, 'CZ': 33, 'DE': 2308, 'DK': 85, 'EC': 2, 'EE': 7, 'ES': 63, 'FI': 66, 'FM': 1, 'FR': 97, 'GB': 275, 'HK': 2, 'HR': 4, 'HU': 25, 'IE': 23, 'IL': 8, 'IS': 3, 'IT': 49, 'JP': 4, 'KH': 1, 'KZ': 1, 'LT': 5, 'LU': 15, 'LV': 4, 'MT': 2, 'MX': 6, 'NL': 276, 'NO': 29, 'NZ': 3, 'PE': 1, 'PL': 141, 'PR': 1, 'PT': 5, 'RO': 5, 'RS': 1, 'RU': 3, 'SE': 50, 'SG': 3, 'SI': 6, 'SK': 9, 'TR': 1, 'UA': 3, 'US': 100, 'VN': 1, 'ZA': 4}","{'day': 46, 'normal': 2911, 'sponsor': 612, 'supersponsor': 525}","{'animator': 1149, 'artist': 1705, 'fursuiter': 1824, 'musician': 1271}"
03/15/2025,True,2025-03-15T23:45:01.164+00:00,2025-03-15T23:45:01.164+00:00,2025,EF29,4158,"{'18': 64, '19': 85, '20': 163, '21': 185, '22': 211, '23': 251, '24': 260, '25': 252, '26': 284, '27': 248, '28': 234, '29': 201, '30': 186, '31': 176, '32': 183, '33': 125, '34': 149, '35': 141, '36': 111, '37': 89, '38': 87, '39': 75, '40': 49, '41': 54, '42': 48, '43': 31, '44': 18, '45': 33, '46': 19, '47': 22, '48': 15, '49': 12, '50': 16, '51': 11, '52': 9, '53': 5, '54': 9, '55': 4, '56': 8, '57': 5, '58': 3, '59': 3, '60': 7, '61': 4, '62': 2, '63': 2, '65': 2, '69': 1, '70': 1, '71': 1, '72': 1, '74': 1, '75': 1, '76': 1}",{},"{'approved': 750, 'partially paid': 20, 'paid': 3388}","{'XS': 16, 'S': 139, 'M': 644, 'L': 651, 'XL': 458, 'XXL': 285}","{'AR': 2, 'AT': 165, 'AU': 7, 'BA': 1, 'BE': 53, 'BG': 7, 'BH': 1, 'BR': 3, 'CA': 15, 'CC': 1, 'CH': 117, 'CN': 2, 'CY': 1, 'CZ': 34, 'DE': 2339, 'DK': 86, 'EC': 2, 'EE': 7, 'ES': 63, 'FI': 66, 'FM': 1, 'FR': 99, 'GB': 278, 'HK': 2, 'HR': 4, 'HU': 25, 'IE': 24, 'IL': 8, 'IS': 3, 'IT': 51, 'JP': 4, 'KH': 1, 'KZ': 1, 'LT': 5, 'LU': 15, 'LV': 4, 'MT': 2, 'MX': 6, 'NL': 277, 'NO': 30, 'NZ': 3, 'PE': 1, 'PL': 146, 'PR': 1, 'PT': 5, 'RO': 6, 'RS': 1, 'RU': 3, 'SE': 50, 'SG': 3, 'SI': 6, 'SK': 10, 'TR': 1, 'UA': 3, 'US': 102, 'VN': 1, 'ZA': 4}","{'day': 47, 'normal': 2956, 'sponsor': 620, 'supersponsor': 531}","{'animator': 1173, 'artist': 1736, 'fursuiter': 1854, 'musician': 1298}"
03/16/2025,True,2025-03-16T23:45:01.671+00:00,2025-03-16T23:45:01.671+00:00,2025,EF29,4189,"{'18': 64, '19': 87, '20': 164, '21': 186, '22': 213, '23': 254, '24': 261, '25': 253, '26': 286, '27': 248, '28': 234, '29': 204, '30': 188, '31': 177, '32': 184, '33': 126, '34': 150, '35': 142, '36': 111, '37': 92, '38': 87, '39': 76, '40': 50, '41': 55, '42': 48, '43': 32, '44': 18, '45': 33, '46': 19, '47': 22, '48': 15, '49': 12, '50': 17, '51': 11, '52': 9, '53': 5, '54': 9, '55': 4, '56': 8, '57': 5, '58': 3, '59': 3, '60': 7, '61': 4, '62': 2, '63': 2, '65': 2, '69': 1, '70': 1, '71': 1, '72': 1, '74': 1, '75': 1, '76': 1}",{},"{'new': 1, 'approved': 743, 'partially paid': 23, 'paid': 3422}","{'XS': 16, 'S': 140, 'M': 646, 'L': 655, 'XL': 462, 'XXL': 287}","{'AR': 2, 'AT': 166, 'AU': 7, 'BA': 1, 'BE': 53, 'BG': 7, 'BH': 1, 'BR': 3, 'CA': 16, 'CC': 1, 'CH': 116, 'CN': 2, 'CY': 1, 'CZ': 34, 'DE': 2356, 'DK': 86, 'EC': 2, 'EE': 7, 'ES': 63, 'FI': 69, 'FM': 1, 'FR': 99, 'GB': 280, 'HK': 2, 'HR': 4, 'HU': 25, 'IE': 25, 'IL': 8, 'IS': 3, 'IT': 51, 'JP': 4, 'KH': 1, 'KZ': 1, 'LI': 1, 'LT': 5, 'LU': 15, 'LV': 4, 'MT': 2, 'MX': 6, 'NL': 278, 'NO': 30, 'NZ': 3, 'PE': 1, 'PL': 148, 'PR': 1, 'PT': 5, 'RO': 6, 'RS': 1, 'RU': 3, 'SE': 51, 'SG': 3, 'SI': 6, 'SK': 10, 'TR': 1, 'UA': 3, 'US': 104, 'VN': 1, 'ZA': 4}","{'day': 47, 'normal': 2983, 'sponsor': 623, 'supersponsor': 532}","{'animator': 1183, 'artist': 1749, 'fursuiter': 1868, 'musician': 1310}"
03/17/2025,True,2025-03-17T23:45:01.960+00:00,2025-03-17T23:45:01.960+00:00,2025,EF29,4015,"{'18': 52, '19': 78, '20': 157, '21': 178, '22': 197, '23': 235, '24': 251, '25': 246, '26': 269, '27': 243, '28': 222, '29': 191, '30': 176, '31': 167, '32': 179, '33': 122, '34': 146, '35': 144, '36': 110, '37': 91, '38': 87, '39': 76, '40': 49, '41': 54, '42': 47, '43': 32, '44': 18, '45': 33, '46': 18, '47': 22, '48': 15, '49': 12, '50': 17, '51': 11, '52': 9, '53': 5, '54': 9, '55': 4, '56': 8, '57': 5, '58': 3, '59': 3, '60': 7, '61': 4, '62': 2, '63': 2, '65': 2, '69': 1, '70': 1, '71': 1, '72': 1, '74': 1, '75': 1, '76': 1}",{},"{'new': 1, 'approved': 504, 'partially paid': 22, 'paid': 3488}","{'XS': 16, 'S': 137, 'M': 621, 'L': 624, 'XL': 442, 'XXL': 276}","{'AR': 1, 'AT': 156, 'AU': 7, 'BA': 1, 'BE': 51, 'BG': 7, 'BH': 1, 'BR': 2, 'CA': 16, 'CC': 1, 'CH': 114, 'CN': 1, 'CY': 1, 'CZ': 30, 'DE': 2283, 'DK': 81, 'EC': 2, 'EE': 7, 'ES': 57, 'FI': 65, 'FM': 1, 'FR': 91, 'GB': 267, 'HK': 2, 'HR': 4, 'HU': 24, 'IE': 23, 'IL': 7, 'IS': 3, 'IT': 49, 'JP': 4, 'KZ': 1, 'LI': 1, 'LT': 5, 'LU': 15, 'LV': 4, 'MT': 2, 'MX': 6, 'NL': 261, 'NO': 30, 'NZ': 3, 'PE': 1, 'PL': 137, 'PR': 1, 'PT': 4, 'RO': 5, 'RS': 2, 'RU': 3, 'SE': 50, 'SG': 3, 'SI': 6, 'SK': 9, 'TR': 1, 'UA': 3, 'US': 99, 'VN': 1, 'ZA': 3}","{'day': 43, 'normal': 2853, 'sponsor': 602, 'supersponsor': 513}","{'animator': 1125, 'artist': 1670, 'fursuiter': 1775, 'musician': 1245}"
03/18/2025,True,2025-03-18T23:45:01.290+00:00,2025-03-18T23:45:01.290+00:00,2025,EF29,4046,"{'18': 52, '19': 78, '20': 157, '21': 180, '22': 204, '23': 237, '24': 255, '25': 247, '26': 272, '27': 244, '28': 224, '29': 194, '30': 177, '31': 169, '32': 180, '33': 122, '34': 148, '35': 144, '36': 110, '37': 91, '38': 87, '39': 76, '40': 49, '41': 54, '42': 47, '43': 32, '44': 18, '45': 33, '46': 18, '47': 22, '48': 15, '49': 12, '50': 17, '51': 11, '52': 9, '53': 5, '54': 9, '55': 4, '56': 8, '57': 5, '58': 3, '59': 3, '60': 7, '61': 4, '62': 2, '63': 2, '65': 2, '69': 1, '70': 1, '71': 1, '72': 1, '74': 1, '75': 1, '76': 1}",{},"{'new': 2, 'approved': 490, 'partially paid': 31, 'paid': 3523}","{'XS': 16, 'S': 137, 'M': 625, 'L': 631, 'XL': 443, 'XXL': 277}","{'AR': 1, 'AT': 158, 'AU': 7, 'BA': 1, 'BE': 52, 'BG': 7, 'BH': 1, 'BR': 2, 'CA': 16, 'CC': 1, 'CH': 114, 'CN': 2, 'CY': 1, 'CZ': 30, 'DE': 2291, 'DK': 84, 'EC': 2, 'EE': 7, 'ES': 57, 'FI': 66, 'FM': 1, 'FR': 92, 'GB': 268, 'HK': 2, 'HR': 4, 'HU': 24, 'IE': 23, 'IL': 7, 'IS': 3, 'IT': 49, 'JP': 4, 'KZ': 1, 'LI': 1, 'LT': 5, 'LU': 15, 'LV': 4, 'MT': 2, 'MX': 6, 'NL': 265, 'NO': 30, 'NZ': 3, 'PE': 1, 'PL': 139, 'PR': 1, 'PT': 4, 'RO': 5, 'RS': 2, 'RU': 3, 'SE': 51, 'SG': 3, 'SI': 7, 'SK': 9, 'TR': 1, 'UA': 3, 'UM': 1, 'US': 103, 'VN': 1, 'ZA': 3}","{'day': 43, 'normal': 2879, 'sponsor': 606, 'supersponsor': 514}","{'animator': 1131, 'artist': 1677, 'fursuiter': 1781, 'musician': 1249}"
03/19/2025,True,2025-03-19T23:45:01.365+00:00,2025-03-19T23:45:01.365+00:00,2025,EF29,4064,"{'18': 52, '19': 79, '20': 158, '21': 181, '22': 206, '23': 241, '24': 255, '25': 249, '26': 274, '27': 244, '28': 224, '29': 194, '30': 178, '31': 169, '32': 181, '33': 122, '34': 148, '35': 144, '36': 110, '37': 91, '38': 88, '39': 76, '40': 49, '41': 54, '42': 47, '43': 33, '44': 18, '45': 33, '46': 18, '47': 22, '48': 15, '49': 12, '50': 17, '51': 11, '52': 9, '53': 5, '54': 9, '55': 4, '56': 8, '57': 5, '58': 4, '59': 3, '60': 7, '61': 4, '62': 2, '63': 2, '65': 2, '69': 1, '70': 1, '71': 1, '72': 1, '74': 1, '75': 1, '76': 1}",{},"{'approved': 490, 'partially paid': 31, 'paid': 3543}","{'XS': 16, 'S': 137, 'M': 625, 'L': 632, 'XL': 446, 'XXL': 278}","{'AR': 1, 'AT': 158, 'AU': 7, 'BA': 1, 'BE': 52, 'BG': 7, 'BH': 1, 'BR': 2, 'CA': 17, 'CC': 1, 'CH': 114, 'CN': 3, 'CY': 1, 'CZ': 30, 'DE': 2300, 'DK': 84, 'EC': 2, 'EE': 7, 'ES': 57, 'FI': 66, 'FM': 1, 'FR': 96, 'GB': 268, 'HK': 2, 'HR': 4, 'HU': 24, 'IE': 23, 'IL': 7, 'IS': 3, 'IT': 49, 'JP': 4, 'KZ': 1, 'LI': 1, 'LT': 5, 'LU': 15, 'LV': 4, 'MT': 2, 'MX': 6, 'NL': 267, 'NO': 30, 'NZ': 3, 'PE': 1, 'PL': 139, 'PR': 1, 'PT': 4, 'RO': 5, 'RS': 2, 'RU': 3, 'SE': 51, 'SG': 3, 'SI': 7, 'SK': 9, 'TR': 1, 'UA': 3, 'UM': 1, 'US': 104, 'VN': 1, 'ZA': 3}","{'day': 43, 'normal': 2892, 'sponsor': 609, 'supersponsor': 516}","{'animator': 1138, 'artist': 1685, 'fursuiter': 1788, 'musician': 1254}"
03/20/2025,True,2025-03-20T23:45:01.544+00:00,2025-03-20T23:45:01.544+00:00,2025,EF29,4075,"{'18': 52, '19': 80, '20': 159, '21': 181, '22': 207, '23': 241, '24': 255, '25': 251, '26': 274, '27': 244, '28': 224, '29': 195, '30': 180, '31': 170, '32': 181, '33': 122, '34': 149, '35': 144, '36': 110, '37': 91, '38': 88, '39': 76, '40': 49, '41': 54, '42': 47, '43': 33, '44': 18, '45': 33, '46': 18, '47': 22, '48': 15, '49': 12, '50': 17, '51': 11, '52': 9, '53': 5, '54': 9, '55': 4, '56': 8, '57': 5, '58': 4, '59': 3, '60': 7, '61': 5, '62': 2, '63': 2, '65': 2, '69': 1, '70': 1, '71': 1, '72': 1, '74': 1, '75': 1, '76': 1}",{},"{'approved': 482, 'partially paid': 30, 'paid': 3563}","{'XS': 16, 'S': 137, 'M': 625, 'L': 636, 'XL': 446, 'XXL': 278}","{'AR': 1, 'AT': 159, 'AU': 7, 'BA': 1, 'BE': 52, 'BG': 7, 'BH': 1, 'BR': 2, 'CA': 17, 'CC': 1, 'CH': 114, 'CN': 3, 'CY': 1, 'CZ': 30, 'DE': 2303, 'DK': 84, 'EC': 2, 'EE': 7, 'ES': 57, 'FI': 66, 'FM': 1, 'FR': 96, 'GB': 268, 'HK': 2, 'HR': 4, 'HU': 24, 'IE': 23, 'IL': 7, 'IS': 3, 'IT': 50, 'JP': 4, 'KZ': 1, 'LI': 1, 'LT': 6, 'LU': 15, 'LV': 4, 'MT': 2, 'MX': 6, 'NL': 270, 'NO': 30, 'NZ': 3, 'PE': 1, 'PL': 139, 'PR': 1, 'PT': 4, 'RO': 5, 'RS': 2, 'RU': 3, 'SE': 51, 'SG': 3, 'SI': 7, 'SK': 9, 'TR': 1, 'UA': 3, 'UM': 1, 'US': 106, 'VN': 1, 'ZA': 3}","{'day': 43, 'normal': 2900, 'sponsor': 610, 'supersponsor': 518}","{'animator': 1144, 'artist': 1691, 'fursuiter': 1791, 'musician': 1260}"
03/21/2025,True,2025-03-21T23:45:01.609+00:00,2025-03-21T23:45:01.609+00:00,2025,EF29,4085,"{'18': 52, '19': 80, '20': 159, '21': 182, '22': 207, '23': 242, '24': 255, '25': 252, '26': 275, '27': 244, '28': 225, '29': 196, '30': 182, '31': 170, '32': 181, '33': 123, '34': 150, '35': 144, '36': 110, '37': 91, '38': 88, '39': 76, '40': 49, '41': 54, '42': 47, '43': 33, '44': 18, '45': 33, '46': 18, '47': 22, '48': 15, '49': 12, '50': 17, '51': 11, '52': 9, '53': 5, '54': 9, '55': 4, '56': 8, '57': 5, '58': 4, '59': 3, '60': 7, '61': 5, '62': 2, '63': 2, '65': 2, '69': 1, '70': 1, '71': 1, '72': 1, '74': 1, '75': 1, '76': 1}",{},"{'new': 3, 'approved': 470, 'partially paid': 29, 'paid': 3583}","{'XS': 16, 'S': 137, 'M': 625, 'L': 638, 'XL': 446, 'XXL': 280}","{'AE': 1, 'AR': 1, 'AT': 160, 'AU': 7, 'BA': 1, 'BE': 52, 'BG': 7, 'BH': 1, 'BR': 2, 'CA': 17, 'CC': 1, 'CH': 114, 'CN': 3, 'CY': 1, 'CZ': 30, 'DE': 2305, 'DK': 84, 'EC': 2, 'EE': 7, 'ES': 57, 'FI': 66, 'FM': 1, 'FR': 96, 'GB': 271, 'HK': 2, 'HR': 4, 'HU': 24, 'IE': 23, 'IL': 7, 'IS': 3, 'IT': 50, 'JP': 4, 'KZ': 1, 'LI': 1, 'LT': 6, 'LU': 15, 'LV': 4, 'MT': 2, 'MX': 6, 'NL': 270, 'NO': 30, 'NZ': 3, 'PE': 1, 'PL': 142, 'PR': 1, 'PT': 4, 'RO': 5, 'RS': 2, 'RU': 3, 'SE': 51, 'SG': 3, 'SI': 7, 'SK': 9, 'TR': 1, 'UA': 3, 'UM': 1, 'US': 106, 'VN': 1, 'ZA': 3}","{'day': 43, 'normal': 2910, 'sponsor': 609, 'supersponsor': 519}","{'animator': 1148, 'artist': 1698, 'fursuiter': 1797, 'musician': 1263}"
03/22/2025,True,2025-03-22T23:46:55.504+00:00,2025-03-22T23:46:55.504+00:00,2025,EF29,4106,"{'18': 52, '19': 81, '20': 159, '21': 183, '22': 209, '23': 244, '24': 255, '25': 253, '26': 277, '27': 246, '28': 225, '29': 197, '30': 184, '31': 171, '32': 181, '33': 123, '34': 151, '35': 145, '36': 111, '37': 92, '38': 89, '39': 76, '40': 49, '41': 54, '42': 47, '43': 33, '44': 18, '45': 33, '46': 18, '47': 22, '48': 15, '49': 12, '50': 17, '51': 11, '52': 9, '53': 5, '54': 10, '55': 4, '56': 8, '57': 5, '58': 4, '59': 3, '60': 7, '61': 5, '62': 2, '63': 2, '65': 2, '69': 1, '70': 1, '71': 1, '72': 1, '74': 1, '75': 1, '76': 1}",{},"{'new': 3, 'approved': 485, 'partially paid': 31, 'paid': 3587}","{'XS': 16, 'S': 136, 'M': 626, 'L': 643, 'XL': 447, 'XXL': 281}","{'AE': 1, 'AR': 1, 'AT': 160, 'AU': 7, 'BA': 1, 'BE': 53, 'BG': 7, 'BH': 1, 'BR': 2, 'CA': 18, 'CC': 1, 'CH': 115, 'CN': 3, 'CY': 1, 'CZ': 30, 'DE': 2314, 'DK': 84, 'EC': 2, 'EE': 7, 'ES': 58, 'FI': 67, 'FM': 1, 'FR': 96, 'GB': 272, 'HK': 2, 'HR': 4, 'HU': 24, 'IE': 23, 'IL': 7, 'IS': 3, 'IT': 50, 'JP': 4, 'KZ': 1, 'LI': 1, 'LT': 6, 'LU': 15, 'LV': 4, 'MT': 2, 'MX': 6, 'NL': 271, 'NO': 30, 'NZ': 3, 'PE': 1, 'PL': 143, 'PR': 1, 'PT': 4, 'RO': 5, 'RS': 2, 'RU': 3, 'SE': 51, 'SG': 3, 'SI': 7, 'SK': 9, 'TR': 1, 'UA': 3, 'UM': 1, 'US': 110, 'VN': 1, 'ZA': 3}","{'day': 46, 'normal': 2925, 'sponsor': 609, 'supersponsor': 522}","{'animator': 1159, 'artist': 1711, 'fursuiter': 1808, 'musician': 1274}"
03/23/2025,True,2025-03-23T23:46:35.697+00:00,2025-03-23T23:46:35.697+00:00,2025,EF29,4122,"{'18': 53, '19': 81, '20': 161, '21': 184, '22': 211, '23': 246, '24': 255, '25': 255, '26': 277, '27': 246, '28': 227, '29': 197, '30': 184, '31': 171, '32': 181, '33': 124, '34': 153, '35': 145, '36': 111, '37': 92, '38': 89, '39': 76, '40': 49, '41': 54, '42': 47, '43': 33, '44': 18, '45': 33, '46': 18, '47': 23, '48': 15, '49': 12, '50': 17, '51': 11, '52': 9, '53': 5, '54': 10, '55': 4, '56': 8, '57': 5, '58': 4, '59': 3, '60': 7, '61': 5, '62': 2, '63': 2, '65': 2, '69': 1, '70': 1, '71': 1, '72': 1, '74': 1, '75': 1, '76': 1}",{},"{'approved': 491, 'partially paid': 30, 'paid': 3601}","{'XS': 16, 'S': 136, 'M': 629, 'L': 646, 'XL': 448, 'XXL': 281}","{'AE': 1, 'AR': 1, 'AT': 160, 'AU': 7, 'BA': 1, 'BE': 54, 'BG': 7, 'BH': 1, 'BR': 2, 'CA': 18, 'CC': 1, 'CH': 115, 'CN': 3, 'CY': 1, 'CZ': 30, 'DE': 2320, 'DK': 87, 'EC': 2, 'EE': 7, 'ES': 58, 'FI': 67, 'FM': 1, 'FR': 97, 'GB': 274, 'HK': 2, 'HR': 4, 'HU': 24, 'IE': 23, 'IL': 7, 'IS': 3, 'IT': 51, 'JP': 4, 'KZ': 1, 'LI': 1, 'LT': 6, 'LU': 15, 'LV': 4, 'MT': 2, 'MX': 6, 'NL': 273, 'NO': 30, 'NZ': 3, 'PE': 1, 'PL': 143, 'PR': 1, 'PT': 4, 'RO': 5, 'RS': 2, 'RU': 3, 'SE': 51, 'SG': 3, 'SI': 7, 'SK': 9, 'TR': 1, 'UA': 3, 'UM': 1, 'US': 110, 'VN': 1, 'ZA': 3}","{'day': 47, 'normal': 2936, 'sponsor': 610, 'supersponsor': 525}","{'animator': 1161, 'artist': 1716, 'fursuiter': 1815, 'musician': 1276}"
03/24/2025,True,2025-03-24T23:45:01.453+00:00,2025-03-24T23:45:01.453+00:00,2025,EF29,4140,"{'18': 53, '19': 82, '20': 162, '21': 184, '22': 210, '23': 248, '24': 256, '25': 255, '26': 279, '27': 245, '28': 228, '29': 198, '30': 186, '31': 173, '32': 182, '33': 124, '34': 154, '35': 145, '36': 112, '37': 92, '38': 91, '39': 76, '40': 50, '41': 54, '42': 48, '43': 33, '44': 18, '45': 33, '46': 18, '47': 23, '48': 15, '49': 12, '50': 17, '51': 11, '52': 9, '53': 5, '54': 10, '55': 4, '56': 8, '57': 5, '58': 4, '59': 3, '60': 7, '61': 5, '62': 2, '63': 2, '65': 2, '69': 1, '70': 1, '71': 1, '72': 1, '74': 1, '75': 1, '76': 1}",{},"{'approved': 475, 'partially paid': 29, 'paid': 3636}","{'XS': 17, 'S': 136, 'M': 629, 'L': 649, 'XL': 449, 'XXL': 280}","{'AE': 1, 'AR': 1, 'AT': 160, 'AU': 7, 'BA': 1, 'BE': 54, 'BG': 7, 'BH': 1, 'BR': 2, 'CA': 18, 'CC': 1, 'CH': 116, 'CN': 3, 'CY': 1, 'CZ': 30, 'DE': 2328, 'DK': 86, 'EC': 2, 'EE': 7, 'ES': 58, 'FI': 68, 'FM': 1, 'FR': 98, 'GB': 276, 'HK': 2, 'HR': 4, 'HU': 24, 'IE': 23, 'IL': 7, 'IS': 3, 'IT': 51, 'JP': 4, 'KZ': 1, 'LI': 1, 'LT': 6, 'LU': 15, 'LV': 4, 'MT': 2, 'MX': 6, 'NL': 275, 'NO': 31, 'NZ': 3, 'PE': 1, 'PL': 143, 'PR': 1, 'PT': 4, 'RO': 5, 'RS': 2, 'RU': 3, 'SE': 52, 'SG': 3, 'SI': 7, 'SK': 9, 'TR': 1, 'UA': 3, 'UM': 1, 'US': 112, 'VN': 1, 'ZA': 3}","{'day': 47, 'normal': 2950, 'sponsor': 611, 'supersponsor': 528}","{'animator': 1163, 'artist': 1724, 'fursuiter': 1823, 'musician': 1280}"
03/25/2025,True,2025-03-25T23:45:01.744+00:00,2025-03-25T23:45:01.744+00:00,2025,EF29,4152,"{'18': 53, '19': 82, '20': 163, '21': 185, '22': 210, '23': 248, '24': 257, '25': 255, '26': 279, '27': 246, '28': 228, '29': 201, '30': 187, '31': 175, '32': 182, '33': 124, '34': 154, '35': 145, '36': 113, '37': 92, '38': 92, '39': 76, '40': 50, '41': 54, '42': 48, '43': 33, '44': 18, '45': 33, '46': 18, '47': 23, '48': 15, '49': 12, '50': 17, '51': 11, '52': 9, '53': 5, '54': 10, '55': 4, '56': 8, '57': 5, '58': 4, '59': 3, '60': 7, '61': 5, '62': 2, '63': 2, '65': 2, '69': 1, '70': 1, '71': 1, '72': 1, '74': 1, '75': 1, '76': 1}",{},"{'new': 2, 'approved': 454, 'partially paid': 28, 'paid': 3668}","{'XS': 17, 'S': 136, 'M': 630, 'L': 650, 'XL': 452, 'XXL': 280}","{'AE': 1, 'AR': 1, 'AT': 160, 'AU': 7, 'BA': 1, 'BE': 54, 'BG': 7, 'BH': 1, 'BR': 2, 'CA': 18, 'CC': 1, 'CH': 116, 'CN': 3, 'CY': 1, 'CZ': 30, 'DE': 2334, 'DK': 86, 'EC': 2, 'EE': 7, 'ES': 58, 'FI': 68, 'FM': 1, 'FR': 98, 'GB': 276, 'HK': 2, 'HR': 4, 'HU': 24, 'IE': 23, 'IL': 7, 'IS': 3, 'IT': 51, 'JP': 4, 'KZ': 1, 'LI': 1, 'LT': 6, 'LU': 16, 'LV': 4, 'MT': 2, 'MX': 6, 'NL': 275, 'NO': 31, 'NZ': 3, 'PE': 1, 'PL': 143, 'PR': 1, 'PT': 4, 'RO': 5, 'RS': 2, 'RU': 3, 'SE': 53, 'SG': 3, 'SI': 7, 'SK': 9, 'TR': 1, 'UA': 3, 'UM': 1, 'US': 116, 'VN': 1, 'ZA': 3}","{'day': 48, 'normal': 2957, 'sponsor': 613, 'supersponsor': 530}","{'animator': 1168, 'artist': 1732, 'fursuiter': 1831, 'musician': 1284}"
03/26/2025,True,2025-03-26T23:45:02.106+00:00,2025-03-26T23:45:02.106+00:00,2025,EF29,4166,"{'18': 54, '19': 81, '20': 163, '21': 186, '22': 211, '23': 248, '24': 257, '25': 257, '26': 281, '27': 246, '28': 228, '29': 203, '30': 187, '31': 177, '32': 183, '33': 124, '34': 154, '35': 146, '36': 114, '37': 92, '38': 93, '39': 76, '40': 50, '41': 54, '42': 48, '43': 33, '44': 18, '45': 33, '46': 18, '47': 23, '48': 15, '49': 12, '50': 17, '51': 11, '52': 9, '53': 5, '54': 10, '55': 4, '56': 8, '57': 5, '58': 4, '59': 3, '60': 7, '61': 5, '62': 2, '63': 2, '65': 2, '69': 1, '70': 1, '71': 1, '72': 1, '74': 1, '75': 1, '76': 1}",{},"{'new': 6, 'approved': 446, 'partially paid': 25, 'paid': 3689}","{'XS': 17, 'S': 136, 'M': 630, 'L': 653, 'XL': 453, 'XXL': 281}","{'AE': 1, 'AR': 1, 'AT': 161, 'AU': 7, 'BA': 1, 'BE': 54, 'BG': 7, 'BH': 1, 'BR': 2, 'CA': 18, 'CC': 1, 'CH': 116, 'CN': 3, 'CY': 1, 'CZ': 30, 'DE': 2340, 'DK': 86, 'EC': 2, 'EE': 7, 'ES': 58, 'FI': 69, 'FM': 1, 'FR': 99, 'GB': 278, 'HK': 2, 'HR': 4, 'HU': 24, 'IE': 23, 'IL': 7, 'IS': 3, 'IT': 51, 'JP': 4, 'KW': 1, 'KZ': 1, 'LI': 1, 'LT': 6, 'LU': 16, 'LV': 4, 'MT': 2, 'MX': 6, 'NL': 277, 'NO': 31, 'NZ': 3, 'PE': 1, 'PL': 143, 'PR': 1, 'PT': 4, 'RO': 5, 'RS': 2, 'RU': 3, 'SE': 53, 'SG': 3, 'SI': 8, 'SK': 9, 'TR': 1, 'UA': 3, 'UM': 1, 'US': 116, 'ZA': 3}","{'day': 48, 'normal': 2970, 'sponsor': 614, 'supersponsor': 530}","{'animator': 1168, 'artist': 1734, 'fursuiter': 1838, 'musician': 1283}"
03/27/2025,True,2025-03-27T23:45:01.446+00:00,2025-03-27T23:45:01.446+00:00,2025,EF29,4179,"{'18': 54, '19': 81, '20': 163, '21': 186, '22': 212, '23': 253, '24': 258, '25': 260, '26': 282, '27': 246, '28': 228, '29': 204, '30': 187, '31': 177, '32': 183, '33': 124, '34': 154, '35': 146, '36': 114, '37': 92, '38': 93, '39': 76, '40': 50, '41': 54, '42': 48, '43': 33, '44': 18, '45': 33, '46': 18, '47': 23, '48': 15, '49': 12, '50': 17, '51': 11, '52': 9, '53': 5, '54': 10, '55': 4, '56': 8, '57': 5, '58': 4, '59': 3, '60': 7, '61': 5, '62': 2, '63': 2, '65': 2, '69': 1, '70': 1, '71': 2, '72': 1, '74': 1, '75': 1, '76': 1}",{},"{'new': 2, 'approved': 445, 'partially paid': 24, 'paid': 3708}","{'XS': 18, 'S': 136, 'M': 632, 'L': 654, 'XL': 454, 'XXL': 281}","{'AE': 1, 'AR': 1, 'AT': 162, 'AU': 7, 'BA': 1, 'BE': 54, 'BG': 7, 'BH': 1, 'BR': 2, 'CA': 18, 'CC': 1, 'CH': 117, 'CN': 3, 'CY': 1, 'CZ': 30, 'DE': 2344, 'DK': 86, 'EC': 2, 'EE': 7, 'ES': 58, 'FI': 69, 'FM': 1, 'FR': 99, 'GB': 280, 'HK': 2, 'HR': 4, 'HU': 24, 'IE': 23, 'IL': 7, 'IS': 3, 'IT': 52, 'JP': 4, 'KW': 1, 'KZ': 1, 'LI': 1, 'LT': 6, 'LU': 16, 'LV': 4, 'MT': 2, 'MX': 6, 'NL': 280, 'NO': 31, 'NZ': 3, 'PE': 1, 'PL': 143, 'PR': 1, 'PT': 4, 'RO': 5, 'RS': 2, 'RU': 3, 'SE': 54, 'SG': 3, 'SI': 8, 'SK': 9, 'TR': 1, 'UA': 3, 'UM': 1, 'US': 116, 'ZA': 3}","{'day': 51, 'normal': 2977, 'sponsor': 616, 'supersponsor': 531}","{'animator': 1171, 'artist': 1738, 'fursuiter': 1843, 'musician': 1286}"
03/28/2025,True,2025-03-28T23:45:02.043+00:00,2025-03-28T23:45:02.043+00:00,2025,EF29,4194,"{'18': 54, '19': 81, '20': 163, '21': 187, '22': 213, '23': 256, '24': 259, '25': 261, '26': 283, '27': 246, '28': 229, '29': 204, '30': 187, '31': 178, '32': 184, '33': 124, '34': 156, '35': 147, '36': 115, '37': 92, '38': 93, '39': 76, '40': 50, '41': 54, '42': 48, '43': 33, '44': 18, '45': 33, '46': 18, '47': 23, '48': 15, '49': 12, '50': 17, '51': 11, '52': 9, '53': 5, '54': 10, '55': 4, '56': 8, '57': 5, '58': 4, '59': 3, '60': 7, '61': 5, '62': 2, '63': 2, '65': 2, '69': 1, '70': 1, '71': 2, '72': 1, '74': 1, '75': 1, '76': 1}",{},"{'approved': 441, 'partially paid': 24, 'paid': 3729}","{'XS': 18, 'S': 136, 'M': 633, 'L': 655, 'XL': 455, 'XXL': 282}","{'AE': 1, 'AR': 1, 'AT': 163, 'AU': 7, 'BA': 1, 'BE': 54, 'BG': 7, 'BH': 1, 'BR': 2, 'CA': 18, 'CC': 1, 'CH': 118, 'CN': 3, 'CY': 1, 'CZ': 30, 'DE': 2348, 'DK': 87, 'EC': 2, 'EE': 7, 'ES': 58, 'FI': 69, 'FM': 1, 'FR': 101, 'GB': 283, 'HK': 2, 'HR': 4, 'HU': 24, 'IE': 23, 'IL': 7, 'IS': 3, 'IT': 52, 'JP': 4, 'KW': 1, 'KZ': 1, 'LI': 1, 'LT': 6, 'LU': 16, 'LV': 4, 'MT': 2, 'MX': 6, 'NL': 282, 'NO': 31, 'NZ': 3, 'PE': 1, 'PL': 143, 'PR': 1, 'PT': 4, 'RO': 5, 'RS': 2, 'RU': 3, 'SE': 54, 'SG': 3, 'SI': 8, 'SK': 9, 'TR': 1, 'UA': 3, 'UM': 1, 'US': 117, 'ZA': 3}","{'day': 51, 'normal': 2992, 'sponsor': 616, 'supersponsor': 531}","{'animator': 1176, 'artist': 1744, 'fursuiter': 1848, 'musician': 1287}"
03/29/2025,True,2025-03-29T23:47:11.496+00:00,2025-03-29T23:47:11.496+00:00,2025,EF29,4209,"{'18': 55, '19': 83, '20': 163, '21': 188, '22': 213, '23': 257, '24': 260, '25': 264, '26': 283, '27': 246, '28': 230, '29': 204, '30': 188, '31': 179, '32': 184, '33': 124, '34': 156, '35': 147, '36': 116, '37': 94, '38': 93, '39': 76, '40': 50, '41': 54, '42': 48, '43': 33, '44': 18, '45': 33, '46': 18, '47': 23, '48': 15, '49': 12, '50': 17, '51': 11, '52': 9, '53': 5, '54': 10, '55': 4, '56': 8, '57': 5, '58': 4, '59': 3, '60': 7, '61': 5, '62': 2, '63': 2, '65': 2, '69': 1, '70': 1, '71': 2, '72': 1, '74': 1, '75': 1, '76': 1}",{},"{'new': 2, 'approved': 443, 'partially paid': 25, 'paid': 3739}","{'XS': 18, 'S': 136, 'M': 633, 'L': 656, 'XL': 455, 'XXL': 285}","{'AE': 1, 'AR': 1, 'AT': 164, 'AU': 7, 'BA': 1, 'BE': 54, 'BG': 7, 'BH': 1, 'BR': 2, 'CA': 18, 'CC': 1, 'CH': 119, 'CN': 3, 'CY': 1, 'CZ': 30, 'DE': 2357, 'DK': 87, 'EC': 2, 'EE': 7, 'ES': 58, 'FI': 69, 'FM': 1, 'FR': 102, 'GB': 283, 'HK': 2, 'HR': 4, 'HU': 24, 'IE': 23, 'IL': 7, 'IS': 3, 'IT': 53, 'JP': 4, 'KW': 1, 'KZ': 1, 'LI': 1, 'LT': 6, 'LU': 17, 'LV': 4, 'MT': 2, 'MX': 6, 'NL': 283, 'NO': 31, 'NZ': 3, 'PE': 1, 'PL': 143, 'PR': 1, 'PT': 4, 'RO': 5, 'RS': 2, 'RU': 3, 'SE': 54, 'SG': 3, 'SI': 8, 'SK': 9, 'TR': 1, 'UA': 3, 'UM': 1, 'US': 117, 'ZA': 3}","{'day': 51, 'normal': 3005, 'sponsor': 617, 'supersponsor': 532}","{'animator': 1179, 'artist': 1751, 'fursuiter': 1852, 'musician': 1288}"
03/30/2025,True,2025-03-30T23:45:02.038+00:00,2025-03-30T23:45:02.038+00:00,2025,EF29,4237,"{'18': 57, '19': 83, '20': 163, '21': 188, '22': 213, '23': 260, '24': 262, '25': 265, '26': 284, '27': 249, '28': 231, '29': 206, '30': 188, '31': 180, '32': 185, '33': 124, '34': 156, '35': 152, '36': 117, '37': 95, '38': 95, '39': 76, '40': 50, '41': 54, '42': 48, '43': 34, '44': 18, '45': 33, '46': 18, '47': 23, '48': 15, '49': 12, '50': 17, '51': 11, '52': 9, '53': 6, '54': 10, '55': 4, '56': 8, '57': 5, '58': 4, '59': 3, '60': 7, '61': 5, '62': 2, '63': 2, '65': 2, '69': 1, '70': 1, '71': 2, '72': 1, '74': 1, '75': 1, '76': 1}",{},"{'new': 5, 'approved': 455, 'partially paid': 24, 'paid': 3753}","{'XS': 18, 'S': 136, 'M': 639, 'L': 659, 'XL': 456, 'XXL': 287}","{'AE': 1, 'AR': 1, 'AT': 165, 'AU': 7, 'BA': 1, 'BE': 54, 'BG': 7, 'BH': 1, 'BR': 2, 'CA': 18, 'CC': 1, 'CH': 119, 'CN': 3, 'CY': 1, 'CZ': 31, 'DE': 2372, 'DK': 87, 'EC': 2, 'EE': 7, 'ES': 58, 'FI': 70, 'FM': 1, 'FR': 104, 'GB': 285, 'HK': 2, 'HR': 4, 'HU': 24, 'IE': 23, 'IL': 7, 'IS': 3, 'IT': 53, 'JP': 4, 'KW': 1, 'KZ': 1, 'LI': 1, 'LT': 6, 'LU': 17, 'LV': 4, 'MT': 2, 'MX': 6, 'NL': 284, 'NO': 32, 'NZ': 3, 'PE': 1, 'PL': 144, 'PR': 1, 'PT': 4, 'RO': 5, 'RS': 2, 'RU': 3, 'SE': 54, 'SG': 3, 'SI': 8, 'SK': 10, 'TR': 1, 'UA': 3, 'UM': 1, 'US': 119, 'ZA': 3}","{'day': 52, 'normal': 3031, 'sponsor': 618, 'supersponsor': 532}","{'animator': 1185, 'artist': 1765, 'fursuiter': 1862, 'musician': 1293}"
03/31/2025,True,2025-03-31T23:45:01.244+00:00,2025-03-31T23:45:01.244+00:00,2025,EF29,4196,"{'18': 55, '19': 81, '20': 158, '21': 187, '22': 209, '23': 256, '24': 261, '25': 264, '26': 279, '27': 246, '28': 230, '29': 203, '30': 188, '31': 179, '32': 182, '33': 123, '34': 155, '35': 149, '36': 117, '37': 95, '38': 95, '39': 76, '40': 51, '41': 54, '42': 47, '43': 35, '44': 18, '45': 33, '46': 18, '47': 23, '48': 15, '49': 12, '50': 17, '51': 11, '52': 9, '53': 6, '54': 10, '55': 4, '56': 8, '57': 5, '58': 4, '59': 3, '60': 7, '61': 5, '62': 1, '63': 2, '65': 2, '69': 1, '70': 1, '71': 2, '72': 1, '74': 1, '75': 1, '76': 1}",{},"{'new': 5, 'approved': 378, 'partially paid': 24, 'paid': 3789}","{'XS': 18, 'S': 135, 'M': 637, 'L': 658, 'XL': 450, 'XXL': 285}","{'AE': 1, 'AR': 1, 'AT': 164, 'AU': 6, 'BA': 1, 'BE': 51, 'BG': 7, 'BH': 1, 'BR': 2, 'CA': 17, 'CC': 1, 'CH': 121, 'CN': 3, 'CY': 1, 'CZ': 31, 'DE': 2357, 'DK': 86, 'EC': 2, 'EE': 7, 'ES': 57, 'FI': 69, 'FM': 1, 'FR': 102, 'GB': 277, 'HK': 2, 'HR': 4, 'HU': 23, 'IE': 24, 'IL': 7, 'IS': 3, 'IT': 52, 'JP': 4, 'KW': 1, 'KZ': 1, 'LI': 1, 'LT': 5, 'LU': 17, 'LV': 4, 'MT': 2, 'MX': 6, 'NL': 281, 'NO': 32, 'NZ': 3, 'PE': 1, 'PL': 142, 'PR': 1, 'PT': 4, 'RO': 5, 'RS': 2, 'RU': 3, 'SE': 52, 'SG': 3, 'SI': 8, 'SK': 10, 'TR': 1, 'UA': 3, 'UM': 1, 'US': 119, 'ZA': 3}","{'day': 49, 'normal': 3001, 'sponsor': 612, 'supersponsor': 530}","{'animator': 1177, 'artist': 1747, 'fursuiter': 1848, 'musician': 1282}"
04/01/2025,True,2025-04-01T23:45:01.490+00:00,2025-04-01T23:45:01.490+00:00,2025,EF29,4206,"{'18': 56, '19': 81, '20': 159, '21': 186, '22': 210, '23': 257, '24': 261, '25': 264, '26': 281, '27': 246, '28': 229, '29': 203, '30': 188, '31': 180, '32': 182, '33': 123, '34': 156, '35': 152, '36': 117, '37': 94, '38': 95, '39': 77, '40': 52, '41': 54, '42': 48, '43': 35, '44': 18, '45': 32, '46': 18, '47': 23, '48': 15, '49': 12, '50': 17, '51': 11, '52': 9, '53': 6, '54': 10, '55': 4, '56': 8, '57': 5, '58': 4, '59': 3, '60': 7, '61': 5, '62': 1, '63': 2, '65': 2, '69': 1, '70': 1, '71': 2, '72': 1, '74': 1, '75': 1, '76': 1}",{},"{'new': 5, 'approved': 370, 'partially paid': 22, 'paid': 3809}","{'XS': 18, 'S': 135, 'M': 638, 'L': 660, 'XL': 450, 'XXL': 287}","{'AE': 1, 'AL': 1, 'AR': 1, 'AT': 164, 'AU': 7, 'BA': 1, 'BE': 51, 'BG': 9, 'BH': 1, 'BR': 2, 'CA': 17, 'CC': 1, 'CH': 121, 'CN': 3, 'CY': 1, 'CZ': 32, 'DE': 2357, 'DK': 86, 'EC': 2, 'EE': 7, 'ES': 57, 'FI': 69, 'FM': 1, 'FR': 103, 'GB': 280, 'HK': 2, 'HR': 4, 'HU': 23, 'IE': 23, 'IL': 7, 'IS': 3, 'IT': 52, 'JP': 4, 'KW': 1, 'KZ': 1, 'LI': 1, 'LT': 5, 'LU': 17, 'LV': 4, 'MT': 2, 'MX': 6, 'NL': 282, 'NO': 32, 'NZ': 3, 'PE': 1, 'PL': 143, 'PR': 1, 'PT': 4, 'RO': 5, 'RS': 2, 'RU': 3, 'SE': 52, 'SG': 3, 'SI': 8, 'SK': 10, 'TR': 1, 'UA': 3, 'UM': 1, 'US': 119, 'ZA': 3}","{'day': 49, 'normal': 3008, 'sponsor': 614, 'supersponsor': 531}","{'animator': 1180, 'artist': 1753, 'fursuiter': 1853, 'musician': 1288}"
04/02/2025,True,2025-04-02T23:45:01.306+00:00,2025-04-02T23:45:01.306+00:00,2025,EF29,4220,"{'18': 56, '19': 81, '20': 160, '21': 188, '22': 212, '23': 257, '24': 262, '25': 264, '26': 282, '27': 246, '28': 229, '29': 204, '30': 188, '31': 182, '32': 182, '33': 123, '34': 156, '35': 153, '36': 118, '37': 94, '38': 95, '39': 78, '40': 52, '41': 54, '42': 48, '43': 36, '44': 18, '45': 32, '46': 18, '47': 23, '48': 15, '49': 12, '50': 17, '51': 11, '52': 9, '53': 6, '54': 10, '55': 4, '56': 8, '57': 5, '58': 4, '59': 3, '60': 7, '61': 5, '62': 1, '63': 2, '65': 2, '69': 1, '70': 1, '71': 2, '72': 1, '74': 1, '75': 1, '76': 1}",{},"{'new': 1, 'approved': 377, 'partially paid': 20, 'paid': 3822}","{'XS': 18, 'S': 136, 'M': 638, 'L': 663, 'XL': 452, 'XXL': 289}","{'AE': 1, 'AL': 1, 'AR': 1, 'AT': 165, 'AU': 7, 'BA': 1, 'BE': 51, 'BG': 9, 'BH': 1, 'BR': 2, 'CA': 18, 'CC': 1, 'CH': 121, 'CN': 3, 'CY': 1, 'CZ': 32, 'DE': 2360, 'DK': 86, 'EC': 2, 'EE': 7, 'ES': 58, 'FI': 70, 'FM': 1, 'FR': 103, 'GB': 282, 'HK': 2, 'HR': 4, 'HU': 23, 'IE': 23, 'IL': 7, 'IS': 3, 'IT': 53, 'JP': 4, 'KW': 1, 'KZ': 1, 'LI': 1, 'LT': 5, 'LU': 17, 'LV': 4, 'MT': 2, 'MX': 6, 'NL': 284, 'NO': 32, 'NZ': 3, 'PE': 1, 'PL': 144, 'PR': 1, 'PT': 4, 'RO': 5, 'RS': 2, 'RU': 3, 'SE': 52, 'SG': 3, 'SI': 8, 'SK': 10, 'TR': 1, 'UA': 3, 'UM': 1, 'US': 120, 'ZA': 3}","{'day': 50, 'normal': 3018, 'sponsor': 616, 'supersponsor': 532}","{'animator': 1186, 'artist': 1761, 'fursuiter': 1857, 'musician': 1293}"
04/03/2025,True,2025-04-03T23:45:02.084+00:00,2025-04-03T23:45:02.084+00:00,2025,EF29,4229,"{'18': 56, '19': 81, '20': 160, '21': 188, '22': 213, '23': 257, '24': 262, '25': 265, '26': 283, '27': 247, '28': 230, '29': 204, '30': 188, '31': 182, '32': 183, '33': 123, '34': 156, '35': 153, '36': 119, '37': 94, '38': 95, '39': 78, '40': 52, '41': 54, '42': 48, '43': 36, '44': 19, '45': 32, '46': 18, '47': 23, '48': 15, '49': 12, '50': 17, '51': 11, '52': 9, '53': 6, '54': 10, '55': 4, '56': 8, '57': 5, '58': 5, '59': 3, '60': 7, '61': 5, '62': 1, '63': 2, '65': 2, '69': 1, '70': 1, '71': 2, '72': 1, '74': 1, '75': 1, '76': 1}",{},"{'new': 1, 'approved': 372, 'partially paid': 20, 'paid': 3836}","{'XS': 18, 'S': 135, 'M': 640, 'L': 666, 'XL': 455, 'XXL': 289}","{'AE': 1, 'AL': 1, 'AR': 1, 'AT': 166, 'AU': 7, 'BA': 1, 'BE': 51, 'BG': 9, 'BH': 1, 'BR': 2, 'CA': 18, 'CC': 1, 'CH': 121, 'CN': 3, 'CY': 1, 'CZ': 32, 'DE': 2366, 'DK': 86, 'EC': 2, 'EE': 7, 'ES': 58, 'FI': 70, 'FM': 1, 'FR': 105, 'GB': 282, 'HK': 2, 'HR': 4, 'HU': 23, 'IE': 23, 'IL': 7, 'IS': 3, 'IT': 53, 'JP': 4, 'KW': 1, 'KZ': 1, 'LI': 1, 'LT': 5, 'LU': 17, 'LV': 4, 'MT': 2, 'MX': 6, 'NL': 284, 'NO': 32, 'NZ': 3, 'PE': 1, 'PL': 144, 'PR': 1, 'PT': 4, 'RO': 5, 'RS': 2, 'RU': 3, 'SE': 52, 'SG': 3, 'SI': 8, 'SK': 10, 'TR': 1, 'UA': 3, 'UM': 1, 'US': 120, 'ZA': 3}","{'day': 50, 'normal': 3023, 'sponsor': 619, 'supersponsor': 533}","{'animator': 1190, 'artist': 1767, 'fursuiter': 1862, 'musician': 1296}"
04/04/2025,True,2025-04-04T23:45:01.767+00:00,2025-04-04T23:45:01.767+00:00,2025,EF29,4238,"{'18': 56, '19': 81, '20': 161, '21': 188, '22': 214, '23': 257, '24': 263, '25': 268, '26': 283, '27': 247, '28': 230, '29': 205, '30': 188, '31': 182, '32': 183, '33': 123, '34': 158, '35': 153, '36': 119, '37': 94, '38': 95, '39': 78, '40': 52, '41': 54, '42': 48, '43': 36, '44': 19, '45': 32, '46': 18, '47': 23, '48': 15, '49': 12, '50': 17, '51': 11, '52': 9, '53': 6, '54': 10, '55': 4, '56': 8, '57': 5, '58': 5, '59': 3, '60': 7, '61': 5, '62': 1, '63': 2, '65': 2, '69': 1, '70': 1, '71': 2, '72': 1, '74': 1, '75': 1, '76': 1}",{},"{'approved': 373, 'partially paid': 18, 'paid': 3847}","{'XS': 18, 'S': 135, 'M': 641, 'L': 668, 'XL': 457, 'XXL': 290}","{'AE': 1, 'AL': 1, 'AR': 1, 'AT': 166, 'AU': 7, 'BA': 1, 'BE': 53, 'BG': 9, 'BH': 1, 'BR': 2, 'CA': 18, 'CC': 1, 'CH': 121, 'CN': 3, 'CY': 1, 'CZ': 32, 'DE': 2370, 'DK': 86, 'EC': 2, 'EE': 7, 'ES': 58, 'FI': 70, 'FM': 1, 'FR': 105, 'GB': 282, 'HK': 2, 'HR': 5, 'HU': 23, 'IE': 23, 'IL': 7, 'IS': 3, 'IT': 53, 'JP': 4, 'KW': 1, 'KZ': 1, 'LI': 1, 'LT': 5, 'LU': 17, 'LV': 4, 'MT': 2, 'MX': 6, 'NL': 285, 'NO': 32, 'NZ': 3, 'PE': 1, 'PL': 144, 'PR': 1, 'PT': 4, 'RO': 5, 'RS': 2, 'RU': 3, 'SE': 52, 'SG': 3, 'SI': 8, 'SK': 11, 'TR': 1, 'UA': 3, 'UM': 1, 'US': 120, 'ZA': 3}","{'day': 52, 'normal': 3027, 'sponsor': 622, 'supersponsor': 533}","{'animator': 1193, 'artist': 1771, 'fursuiter': 1866, 'musician': 1299}"
04/05/2025,True,2025-04-05T23:45:02.137+00:00,2025-04-05T23:45:02.137+00:00,2025,EF29,4262,"{'18': 56, '19': 84, '20': 162, '21': 190, '22': 215, '23': 261, '24': 264, '25': 270, '26': 284, '27': 249, '28': 231, '29': 206, '30': 189, '31': 182, '32': 184, '33': 123, '34': 158, '35': 153, '36': 121, '37': 95, '38': 95, '39': 78, '40': 52, '41': 54, '42': 48, '43': 36, '44': 19, '45': 32, '46': 18, '47': 23, '48': 15, '49': 12, '50': 17, '51': 11, '52': 9, '53': 6, '54': 10, '55': 4, '56': 8, '57': 5, '58': 5, '59': 3, '60': 7, '61': 5, '62': 1, '63': 2, '65': 2, '69': 1, '70': 1, '71': 2, '72': 1, '74': 1, '75': 1, '76': 1}",{},"{'new': 14, 'approved': 374, 'partially paid': 18, 'paid': 3856}","{'XS': 18, 'S': 137, 'M': 642, 'L': 671, 'XL': 458, 'XXL': 296}","{'AE': 1, 'AL': 1, 'AR': 1, 'AT': 166, 'AU': 7, 'BA': 1, 'BE': 53, 'BG': 9, 'BH': 1, 'BR': 2, 'CA': 19, 'CC': 1, 'CH': 122, 'CN': 3, 'CY': 1, 'CZ': 32, 'DE': 2380, 'DK': 86, 'EC': 2, 'EE': 7, 'ES': 58, 'FI': 71, 'FM': 1, 'FR': 106, 'GB': 284, 'HK': 2, 'HR': 5, 'HU': 23, 'IE': 23, 'IL': 7, 'IS': 3, 'IT': 53, 'JP': 4, 'KH': 1, 'KW': 1, 'KZ': 1, 'LI': 1, 'LT': 5, 'LU': 17, 'LV': 4, 'MT': 2, 'MX': 6, 'NL': 285, 'NO': 32, 'NZ': 3, 'PE': 1, 'PL': 145, 'PR': 1, 'PT': 4, 'RO': 5, 'RS': 2, 'RU': 4, 'SE': 55, 'SG': 3, 'SI': 8, 'SK': 11, 'TR': 1, 'UA': 3, 'UM': 1, 'US': 122, 'ZA': 3}","{'day': 52, 'normal': 3049, 'sponsor': 624, 'supersponsor': 533}","{'animator': 1202, 'artist': 1784, 'fursuiter': 1876, 'musician': 1309}"
